Cognate_ID,aromanian,barbaniapiemontese,bellunesevenetian,campidanese,carmagnolapiemontese,carpigianoemiliano,castellodelaplanacatalan,castilianspanish,cataniansicilian,centralcatalan,dalmatian,fassanoladin,ferrareseemiliano,friulian,gardeneseladin,genoeseligurian,grossetoitalian,istroromanian,lanzotorinesepiemontese,logudorese,manisescatalan,meglenoromanian,messinesesicilian,minorcancatalan,neapolitan,northwesterncatalan,palermitansicilian,primierovenetian,provencaloccitan,rapalloligurian,ravennateromagnol,reggianoemiliano,romanian,rumantschgrischun,southeasternsicilian,standarditalian,stellaligurian,surmiranromansh,sursilvanromansh,valenciancatalan,valladerromansh,venicevenetian,vercellesepiemontese
41_horn,k ˈo r n + u,k ˈɔ r n,k ˈɔ r n + o,k ˈɔ rː + u,k ˈɔ r n,k ˈɔ r e n,b ˈa ɲ + a,k ˈw e r n + o,k ˈɔ ɾ n + u,b ˈa ɲ + ə,k w a r ŋ,k ˈɔ r n,k ˈɔ r a n,k w aː r,k ˈɔ r n,k ˈɔː r n + u,k ˈɔ r n + o,k o r n,k ˈɔ r n,k ˈo rː + u,b ˈa ɲ + a,k o r n,k ˈɔ nː + u,b ˈa ɲ + ə,k ˈɔ r n + ə,b ˈa ɲ + ˈɛ,k ˈw ˈɔ ɾ n + u,k ˈɔ r n + o,b ˈa n + o,k ˈɔ r n + u,k ˈɔ a r a n,k ˈɔː r e n,k o r n,k ˈɔ r n + ə,k ˈw ˈɔ ɾ n + u,k ˈɔ r n + o,k ˈɔː r n + u,k ˈɔ r n + ə,k ˈɔ r n + ə,b ˈa ɲ + a,k ˈɔ r n + ə,k ˈɔ r n + o,k ˈɔː r n + u
42_i,j o,m i,m i,d ˈɛ w,m i,m ˈɛ,j ˈɔ,ʑ o,j u,ʒ ˈɔ,j u,dʒ e,m i,j o,j e,m i,ˈi o,j o,m i,d ˈe o,j ˈɔ,j o,j ˈɔ,ʒ ˈɔ,ˈi j ə,j ˈɔ,j ˈɔ,m i,j e w,m i,m e,m e,j e w,j a w,j u,ˈi o,m i,ˈiə,j e w,j ˈɔ,ˈɛ w,m i,m iː
43_kill,v ˈa t + ə m,m a s + ˈe,k o p + ˈa + r,b o tːʃ ˈi r + i,m a s + ˈe,m a s + ˈɛː r,m a t + ˈa + ɾ,m a t + ˈa + ɾ,a + mː a tːs + ˈa + ɾ i,m ə t + ˈa,d r a m + ˈw o r,m a ts + ˈɛ r,m a ts + ˈa r,k o p + ˈaː,m a ts + ˈɛ,mː a sː + ˈaː,a + mː a tːs + ˈa + r e,u tʃ ˈi d + e,m a s + ˈe,b o kː + ˈi + r e,m a t + ˈa + ɾ,n e k,a + mː a tːs + ˈa + ɾ ɨ,m ə t + ˈa,a + tːʃ ˈi ɾ + ə + r ə,m a t + ˈa,a + mː a tːs + ˈa + ɾ i,k o p + ˈa + r,t y + ˈa,a + mː a sː + ˈa,a + k u p + ˈe a,m a s + ˈɛː r,a + u tʃ ˈi d + e,m ə ts + ˈa r,a + mː a tːs + ˈa + ɾ i,u tːʃ ˈi d + e + r e,m a tːs + ˈɛ,m ə ts + ˈa r,m ə ts + ˈa r,m a t + ˈa + ɾ,k ə p + ˈa r,k o p + ˈa + r,m a s + ˈɛ
44_knee,dz i n ˈu k ʎ + u,dʒ i n ˈu j,d e n ˈɔ tʃ + o,ʒ e n ˈu ɣ + u,dʒ i n ˈu j,z n ɔː tʃ,dʒ i n ˈo ʎ,r o ð ˈi ʎ + a,dʒ i n ˈɔ kː j + u,ʒ ə n ˈo ʎ,dʒ i n ˈw a k,ʒ ə n ˈe j + e,dz n ˈɔ tʃ,dʒ e n ˈɔ l + i,ʒ ə n ˈo d l,dz e n ˈu dʒː + u,dʒ i n ˈɔ kː j + o,ʒ e r ˈu ŋ k ʎ + u,dʒ i n ˈu j,b e n ˈu kː r + u,tʃ i n ˈo ʎ,z i n ˈu k ʎ + u,dʒ i n ˈɔ kː j + u,ʒ u n ˈo j,d ə n ˈu kː j + ə,ʒ i n ˈo ʎ,ɾ i n ˈw ˈɔ kː j + u,d e n ˈɔ tʃ + o,dʒ e j n ˈu j,z e n ˈu dʒː + u,dz n ˈɔ tʃ,dz n ɔː tʃ,dʒ e n ˈu ŋ kʲ,ʒ ə n ˈu ʎ,ɾ i n ˈw ˈɔ tːʃ + u,dʒ i n ˈɔ kː j + o,dz e n ˈu dʒː + u,ʒ ə n ˈu ʎ,ʒ ə n ˈu ʎ,tʃ i n ˈo ʎ,ʒ n w o ʎ,z e n ˈɔ tʃ + o,z n œ tʃ
45_know,ʃ t i + w,s a v + ˈɛ j,s a v + ˈe r,ʃ ˈi r + i,s a v + ˈɛ j,s a v + ˈe r,s a β + ˈe + ɾ,s a β + ˈe + ɾ,s a p + ˈi + ɾ i,s a β + ˈɛ,s a p + ˈa r,s a + ˈe r,s a + ˈɛ r,s a v + ˈeː,s a v + ˈə j,s a v + ˈeː,s a p + ˈe + r e,ʃ t i,s a v + ˈɛ j,i s k + ˈi + r e,s a β + ˈe + ɾ,ʃ t i + w,s a p + ˈi + ɾ ɨ,s ˈɛ β + ɾ ə,s a p + ˈɛ,s a β + ˈe,s ˈa p + i + ɾ i,s a e r,s ˈa w p + ɾ e,s a v + ˈe j,s a v + ˈeː,s a v + ˈɛ j r,a + ʃ t ˈi,s ə v + ˈa j r,s a p + ˈi + ɾ i,s a p + ˈe + r e,s a v + ˈɛ j,s ə v + ˈɛ k r,s ə v + ˈe r,s a β + ˈe + ɾ,s ə v + ˈa j r,s a v + ˈe + r,s a v + ˈe j
46_leaf,f r ˈɨ n dz + ə,f ˈœ j + a,f ˈɔ j + a,f ˈɔ lː + a,f ˈœ j + a,f ˈo j + a,f ˈu ʎ + a,ˈo x + a,f ˈɔ ɡː j + a,f ˈu ʎ + ə,f ˈw a ʎ + a,f ˈo + a,f ˈɔ j + a,f ˈw e + e,p l ˈe tʃ + a,f ˈœ dʒː + a,f ˈɔ ʎː + a,f ˈo ʎ + e,f ˈœ j + a,f ˈo dz + a,f ˈu ʎ + a,f r ˈu n z + ə,f ˈɔ ɡː j + a,f ˈu + ə,f ˈɔ ʎː + ə,f ˈu ʎ + ˈɛ,f ˈw ˈɔ ɡː j + a,f ˈɔ j + a,f ˈɥ ˈɛ j + o,f ˈœ dʒ + a,f ˈo j + a,f ˈɔ j + a,ˈf r u n z + ə,f e ʎ,f ˈɔ ɡː j + a,f ˈɔ ʎː + a,f ˈœː j + a,f i ʎ,f e ʎ,f ˈu ʎ + a,f ˈœ ʎ + ə,f ˈɔ j + a,f ˈɔː j + a
47_lie,dz ˈa k + u,s t + ˈe + k u dʒ + ˈa,s t + ˈa + r + b u t + ˈa + d o,a b a rː + ˈa j + k r o kː + ˈa w,s t + ˈe + k u dʒ + ˈa,z a k + ˈɛː r,e s t + ˈa + ɾ + t o m b + ˈa + t,e s t + ˈa + ɾ + t u m b + ˈa ð + o,k u ɾ k + ˈa + ɾ i + s i,ə s t + ˈa + s t i ɾ + ˈa t,,ˈe s e r + b u t + ˈa + ʒ ˈu,k u tʃ + ˈa r + s,j e s i + d i s + t i r + ˈaː t,ʃ t ˈɛ + p u n d ˈu,ˈeː s e + a + k w ˈeː ɡ + oː w,ˈɛ sː + e + r e + z d r a j + ˈa + t + o,z a tʃ + ˈɒ,s t + ˈe + k u dʒ + ˈa,e sː + ˈe + r e + k o l k + ˈa d + u,e s t + ˈa + ɾ + tʃ i t + ˈa + t,z a k,k u kː + ˈa + ɾ ɨ + s ɨ,ʒ ˈɛ w + ɾ ə,s t + ˈa + k u kː + ˈa t + ə,a s t + ˈa + a + s t i ɾ + ˈa + t,k u ɾ k + ˈa + ɾ i + s i,s t + ˈa + r + b u t + ˈa + d o,,s d r ˈa j + aː + s e,,dz a k + ˈɛː r,a + s t ˈa + k u l k + ˈa t,dʒ ə ʒ + ˈa j r,ʃ t i nː + i + r i + s i,ˈɛ sː + e + r e + z d r a j + ˈa + t + o,r u + v e r s + ˈeː + s e,ʃ t ˈa r + t ˈa r ə,ʒ e r,tʃ i t + ˈa + ɾ + s e,dʒ ə ʒ + ˈa j r,s t + ˈa + r + d e s + t i r + ˈa,s t ˈɛ + k w a t + ˈaː
48_liver,tɕ i k ˈa t + u,f ˈi d i k,f ˈe ɡ a t + o,f i ɡ ˈa w,f ˈi d i k,f ˈe d e ɡ,f ˈe dʒ + e,ˈi ɣ a ð o,f ˈi k a t + u,f ˈe dʒ + ə,f i ɡ ˈw o t,f j ˈa + n ˈe j ɡ ˈɛ r,f ˈɛ ɡ a t,f i ˈaː t,f u j + ˈa + f ˈo ʃ k,f ˈe ɡ a t + u,f ˈe ɡ a t + o,f i k ˈɒ ts,f ˈi d i k,f ˈi k a d + u,f ˈe tʃ + e,d r o p,f ˈi k a t + u,f ˈe dʒ + ə,f ˈɛ ɣ a t + ə,f ˈe dʒ + e,f ˈi k a t + u,f ˈɛ ɡ a t + o,f ˈe dʒ + e,f i ɡ ˈɛː t + u,f ˈeː ɡ a t,f ˈe d e ɡ,f i k ˈa t,ɲ i r ˈo m,f ˈi k i t + u,f ˈe ɡ a t + o,f ˈe ɡ a t + u,n i r ˈo m,d i r,f ˈe tʃ + e,ɲ ə r ˈo m,f i ɡ ˈa,f ˈiː d i k
49_long,l ˈu n ɡ + u,l u ŋ ɡ,l ˈɔ ŋ k,l ˈo ŋ ɡ + u,l u ŋ ɡ,l u ŋ ɡ,ʎ a ɾ k,l ˈa ɾ ɡ + o,l ˈɔ ŋ ɡ + u,ʎ a ɾ k,l u ŋ ɡ,l o ŋ k,l u ŋ ɡ,l u ŋ k,l o ŋ k,l ˈu ŋ ɡ + u,l ˈu ŋ ɡ + o,l u ŋ ɡ,l u ŋ ɡ,l ˈo ŋ ɡ + u,ʎ a ɾ k,l u n k,l ˈɔ ŋ ɡ + u,ʎ a ɾ k,l ˈw o ŋ ɡ + ə,ʎ a ɾ k,l ˈw ˈɔ ŋ ɡ + u,l ˈɔ ŋ k,l o ŋ k,l ˈu ŋ ɡ + u,l o ŋ ɡ,l ˈɔ ŋ ɡ,l u ŋ ɡ,l u ŋ,l ˈw ˈɔ ŋ k + u,l ˈu ŋ ɡ + o,l ˈu ŋ ɡ + u,l u ŋ,l j u ŋ,ʎ a ɾ k,l u ŋ,e v ˈo ŋ ɡ + o,l oː ŋ
4_belly,p ˈɨ n t i k + u,p ˈa ŋ s + a,p ˈa ŋ θ + a,b r ˈɛ n t + i,p ˈa ŋ s + a,p ˈa n s + a,p ˈa ɲ tʃ + a,t ɾ ˈi p + a,p ˈa n ts + a,p ˈa ɲ ʃ + ə,v j ˈa n t r + o,v ˈe n t ˈɛ r,p ˈa n ts + a,p ˈa n ts + e,v ˈə n t ə r,p ˈa ŋ s + a,p ˈa n tʃ + a,t ə r b ˈu x,p ˈa ŋ s + a,f r ˈe n t + e,p ˈa ɲ tʃ + a,f ˈo̯a l + i,p ˈa n ts + a,p ˈa ɲ ʃ + ə,p ˈa n ts + ə,p ˈa ɲ tʃ + ˈɛ,p ˈa n ts + a,p ˈa ŋ θ + a,v ˈɛ n t ɾ + e,p ˈa ŋ s + a,p ˈã n ts + a,p ˈaː n s + a,b ˈu r t + ə,v ˈɛ n t ə r,p ˈa n ts + a,v ˈɛ n t r + e,p ˈa ŋ s + a,v ˈa j n t ə r,v ˈɛ n t ə r,p ˈa ɲ tʃ + a,v ˈa j n t ə r,p ˈa ŋ s + a,p ˈa ŋ s + a
50_louse,p i d ˈu k ʎ + u,p u j,p e d ˈɔ tʃ + o,p r i ˈo ɣ + u,p u j,p j oː tʃ,p o ʎ,p ˈj o x + o,p i ɾ ˈɔ kː j + u,p o ʎ,p e d ˈo k l + o,p ˈo j + e,v d ˈɔ tʃ,p e d ˈɔ l + i,p o d l,p i ɡ ˈœ dʒː + u,p i d ˈɔ kː j + o,p e d ˈu k ʎ + u,p u j,p r e ˈu kː + u,p o ʎ,p i d ˈu k ʎ + u,p i ɾ ˈɔ kː j + u,p o j,p ə ɾ ˈu kː j + ə,p o ʎ,p i ɾ ˈw ˈɔ kː j + u,p e d ˈɔ tʃ + o,p e z ˈu,p i ɡ ˈœ dʒː + u,b d ˈɔ tʃ,p j oː tʃ,p ə d ˈu k + e,p l u ʎ,p ɾ ˈu tːʃ + u,p i d ˈɔ kː j + o,p ˈj œ dʒː + u,p l u ʎ,p l u ʎ,p o ʎ,p l w o ʎ,p e ˈɔ tʃ + o,p j œ tʃ
51_man,b ə r b + ˈa t + u,ˈɔ m,ˈɔ m,ˈo mː + i n + i,ˈɔ m,ˈɔ m,ˈɔ m e,ˈo m b ɾ + e,ˈɔ m + u,ˈɔ m ə,o m,o m,ˈɔ m + a n,ˈɔ m,ə l,ˈɔ mː + u,ˈɔ m + o,m ˈu ʃ k i,ˈɔ m,ˈo mː + i n + e,ˈɔ m e,b ə r b + ˈa t,m ˈa s k u l + u,ˈɔ m u,ˈɔ mː + ə,ˈɔ m e,m ˈa ʃ k u l + u,ˈɔ m,ˈɔ m e,ˈɔ mː + u,o m,o m,b ə r b + ˈa t,u m,ˈw ˈɔ mː + i n + u,ˈw ˈɔ m + o,ˈɔ mː + u,o m,u m,ˈɔ m e,o m,ˈɔ m + o,ˈoː m + a ŋ
52_many,m ˈu l t + u,ə ŋ + m ˈy tʃ,t ˈa ŋ t + i,m ˈe ð a,t ˈa ŋ t + i,t a n t,m o lˠ t,m ˈu tʃ + o,a sː ˈa + i,m o lˠ,m w a l t,t r o p,p a r ˈɛ tʃ,t a n tʲ,t r w e p,i ŋ + m ˈu dʒː + u,t ˈa n t + o,tʃ ˈu d a,t ˈa ŋ t,m ˈe d + a s,m o lˠ t,m u l t,a sː ˈa + i,m o lˠ t,a sː ˈa j + ə,m o lˠ,a sː ˈa + i,t ˈa ŋ t + i,f ˈɔ ɾ s + o,m ˈu dʒː + u,u n + m ˈo w n t,t aː n t,m u l t,b l e r,a sː ˈa + i,m ˈo l t + o,d i + b ˈæ l + i,b l e r,b j a,m o lˠ t,b l e r,t ˈa ŋ t + i,a ŋ + m ˈy tʃ
53_meat,k ˈa r n + e,k a r n,k ˈa r n + e,p ˈɛ tːs + a,k a r n,k ˈɛ r n + a,k a ɾ n,k ˈa ɾ n + e,k ˈa ɾ n + i,k a ɾ n,k ˈw o r n + o,tɕ ˈɛ r n,k ˈa r a n,tʲ a r,tɕ ə r n,k ˈa r n + e,k ˈa r n + e,k ˈɒ r n + e,k a r n,p ˈe tːs + a,k a ɾ n,k ˈa r n + i,k ˈa nː + i,k a ɾ n,k ˈa r n + ə,k a ɾ n,k ˈa ɾ n + i,k ˈa r n + e,v ˈj a n d + e,k ˈa r n + e,k ˈe a r n + a,k ˈɛː r n + a,k ˈa r n + e,tɕ a r n,k ˈa ɾ n + i,k ˈa r n + e,k ˈaː r n + e,tʲ ˈɛ r n,k a r n,k a ɾ n,tɕ a r n,k ˈa r n + e,k ˈa r n + e
54_moon,l ˈu n + ə,l ˈy ŋ + a,l ˈu n + a,l ˈu n + a,l ˈy ŋ + a,l ˈu n + a,ʎ ˈu n + a,l ˈu n + a,l ˈu n + a,ʎ ˈu n + ə,l ˈo j n + a,l ˈu n + a,l ˈu n + a,l ˈu n + e,l ˈu n + a,l ˈy ŋː + a,l ˈu n + a,l ˈu r + ˈæ,l ˈy ŋ + a,l ˈu n + a,ʎ ˈu n + a,l ˈu n + ə,l ˈu n + a,ʎ ˈu n + ə,l ˈu n + ə,ʎ ˈu n + ˈɛ,l ˈu n + a,l ˈu n + a,l ˈy n + o,l ˈy ŋː + a,l ˈo w n + a,l ˈuː n + a,l ˈu n + ə,ʎ ˈi n + ə,l ˈu n + a,l ˈu n + a,l ˈyː ŋː + a,ʎ ˈi ɲ + ə,ʎ ˈi n + ə,ʎ ˈu n + a,ʎ ˈy n + ə,l ˈu n + a,l ˈy ŋ + a
55_mountain,m ˈu n t + e,m u ŋ t,m o ŋ t + ˈa ɲ + a,m ˈɔ n t + i,m u ŋ t + ˈa ɲ + a,m u n t + ˈa ɲ + a,m u n t + ˈa ɲ + a,m o n t + ˈa ɲ + a,m u n t + ˈa ɲː + a,m u n t + ˈa ɲ + ə,m w a n t,k r ˈe p + a,m u n t + ˈa ɲ + a,m ˈɔ n t,k r ə p,b r ˈi kː + u,m o n t + ˈa ɲː + a,k ˈo d r + u,m u ŋ t + ˈa ɲ + a,m ˈo n t + e,m u n t + ˈa ɲ + a,m ˈu n t + i,m ˈu n t + i,m u n t + ˈa ɲ + ə,m u n t + ˈa ɲː + ə,m u n t + ˈa ɲ + ˈɛ,m u n t + ˈa ɲː + a,m o ŋ t + ˈa ɲ + a,m u n t + ˈa ɲ + o,m u n t + ˈa ɲ + a,m o w n t,m u n t + ˈaː ɲ + a,m ˈu n t + e,m u n t + ˈo ɲ + ə,m u n t + ˈa ɲː + a,m o n t + ˈa ɲː + a,b r ˈi kː + u,m u n t + ˈo ɲ + ə,k w ˈɔ l m,m u n t + ˈa ɲ + a,m u n t + ˈo ɲ + ə,m o ŋ t + ˈa ɲ + a,m u ŋ t + ˈaː ɲ + a
56_mouth,ɡ ˈu r + ə,b ˈu k + a,b ˈo k + a,b ˈu kː + a,b ˈu k + a,b ˈɔ k + a,b ˈo k + a,b ˈo k + a,v ˈu kː + a,b ˈo k + ə,b w a k,b ˈo tʃ + a,b ˈɔ k + a,b ˈɔ tʲ + e,b ˈo tʃ + a,b ˈu kː + a,b ˈo kː + a,ɡ ˈu r + ˈæ,b ˈu k + a,v ˈu kː + a,b ˈo k + a,r o s t,b ˈu kː + a,b ˈo k + ə,v ˈo kː + ə,b ˈo k + ˈɛ,v ˈu kː + a,b ˈo k + a,b ˈu k + o,b ˈu kː + a,b ˈo k + a,b ˈɔ k + a,ɡ ˈu r + ə,b ˈu k + ə,v ˈu kː + a,b ˈo kː + a,b ˈu kː + a,b ˈu k + ə,b ˈu k + ə,b ˈo k + a,b ˈɔ k + ə,b ˈo k + a,b ˈu k + a
57_name,n ˈu m + ə,n ˈɔ m,n ˈɔ m + e,n ˈɔ m i n + i,n ˈɔ m,n ˈɔ m,n ˈɔ m,n ˈo m b ɾ + e,n ˈɔ m + u,n ˈɔ m,n a w ŋ,i n ˈo m,n o m,n ˈɔ ŋ,i n ˈw e m,n ˈu mː + e,n ˈo m + e,l ˈu m e,n ˈɔ m,l ˈu mː e n + e,n ˈɔ m,n ˈu m + i,n ˈu m + i,n ˈɔ m,n ˈɔ mː + ə,n ˈɔ m,n ˈw ˈɔ m + u,n ˈɔ m + e,n u m,n ˈu mː + e,n o m,n ˈɔ m,n ˈu m + e,n u m,n ˈɔ m + i,n ˈo m + e,n ˈu mː + e,n o m,n u m,n ˈɔ m,n o m,n ˈɔ m + e,n ɔː m
58_neck,ɡ ˈu ʃ + e,k ˈɔ l,k ˈɔ l,ts ˈu ɣ + u,k ˈɔ l,k ɔː l,k ˈɔ ʎ,k ˈw e ʎ + o,k ˈɔ ɖː + u,k ˈɔ ʎ,k w a l,k ˈɔ l,k ˈɔ l,k w ˈɛ l,k ˈɔ l,k ˈœ lː + u,k ˈɔ lː + o,tʃ e r b ˈi tʃ + e,k ˈɔ l,k ˈo ɖː + u,k ˈɔ ʎ,ɡ ˈu ʃ + ə,k ˈɔ ɖː + u,k ˈɔ j,k ˈw o lː + ə,k ˈɔ ʎ,k ˈw ˈɔ ɖː + u,k ˈɔ l,k ˈɔ w,k ˈɔ lː + u,k ˈɔ l,k ɔː l,ɡ ɨ t,k u l + ˈj e ts,k ˈw ˈɔ ɖː + u,k ˈɔ lː + o,k ˈoː lː + u,k u l + ˈj e ts,k u l + ˈj e ts,k ˈɔ ʎ,k u l + ˈœ ts,k ˈɔ e v + o,k ˈɔ l
59_new,n o w,n œ v,n ˈo v + o,n o w,n œ w,n oː v,n ˈɔ w,n ˈw e β + o,n ˈɔ v + u,n ˈɔ w,n u f,n e f,n o v,ɲ uː f,n w e f,n ˈœ v + u,n ˈɔ v + o,n o v,n œ v,n ˈo v + u,n ˈɔ w,n o w,n ˈɔ v + u,n ˈɔ w,n ˈw o v + ə,n ˈɔ w,n ˈw ˈɔ v + u,n ˈɔ w,n u v ˈɛ w,n ˈœː v + u,n ˈɔ a v,n oː v,n o w,n o f,n ˈɔ v + u,n ˈw ˈɔ v + o,n ˈœː v + u,n o f,n ˈɛ j f,n ˈɔ w,n o w f,n ˈo v + o,n œ f
5_big,m ˈa r + e,ɡ r ˈɔ s,ɡ r a ŋ t,m ˈa nː + u,ɡ r a ŋ d,ɡ r ɔː s,ɡ ɾ a n,ɡ ɾ ˈa n d + e,ɾ ˈa nː + i,ɡ ɾ a n,m a w r,ɡ r a n,ɡ r a n d,ɡ r a n t,ɡ r a n t,ɡ r ˈœ sː + u,ɡ r ˈɔ sː + o,m ˈɒ r + e,ɡ r a ŋ d,m ˈa nː + u,ɡ ɾ a n,m ˈa r + i,ɾ ˈɔ sː + u,ɡ ɾ ˈɔ s,r ˈw o sː + ə,ɡ ɾ a n,ɾ ˈa nː + i,ɡ r a ŋ t,ɡ ɾ a n t,ɡ r ˈɔ sː + u,ɡ r ˈã n d,ɡ r aː n d,m ˈa r + e,ɡ r ˈɔ n t,ɾ ˈa nː + i,ɡ r ˈa n d + e,ɡ r ˈɔː sː + u,ɡ r ˈɔ n t,ɡ r ˈɔ n t,ɡ ɾ a n,ɡ r ˈɔ n t,ɡ r ˈa ŋ d + o,ɡ r ɔː s
60_night,n ˈo̯a p t + e,n œ j t,n ˈɔ t,n ˈɔ tː + i,n œ j t,n ɔː t,n i t,n ˈo tʃ + e,n ˈɔ tː + i,n i t,n w a t,n e t,n ˈɔ t,ɲ ˈɔ t,n w e t,n ˈœ tː + e,n ˈɔ t + e,n ˈo p t + e,n œ j t,n ˈo tː + e,n i t,n ˈo̯a p t + i,n ˈu tː + i,n i t,n ˈɔ tː + ə,n i t,n ˈw ˈɔ tː + i,n ˈɔ t,n ɥ e,n ˈœ tː + e,n ˈɔ t + a,n ɔː t,n ˈo v a p t + e,n o tɕ,n ˈɔ tː + i,n ˈɔ tː + e,n ˈœ tːʃ + e,n o tʲ,n o tɕ,n i t,n o t,n ˈɔ t + e,n œ tʃ
61_nose,n ˈa r + e,n a s,n a s,n ˈa z + u,n a z,n ˈɛː z,n a s,n a ɾ ˈi θ,n ˈa s + u,n a s,n w o s,n ˈɛ s,n a s,n aː s,n ˈɛ s,n ˈa z + u,n ˈa s + o,n ɒ s,n a s,n ˈa s + u,n a s,n a s,n ˈa s + k + a,n a s,n ˈa s + ə,n a s,n ˈa s + u,n a s,n a s,n ˈa z + u,n e a z,n ˈɛː s,n a s,n a s,n ˈa s + u,n ˈa s + o,n ˈaː z + u,n a s,n a s,n a s,n a s,n ˈa z + o,n a s
62_not,n u,n ˈɛ ŋ,n o,n ˈɔ,n ˈɛ ŋ,n ˈɔ,n o,n o,n ˈɔ,n o,n o ŋ,n o,b r ˈi z a,n ˈɔ,n e + n ˈia,n u,u n,n u,n ˈɛ ŋ,n o n,n o,n u,n ˈɔ,n o,n u n,n o,n ˈɔ,n o,n u ŋ,n u,n,m ˈia,n u,b e tɕ,n u n,n o n,n ˈɛ,b e tʲ,b u k,n o,n u,n o,n eː ŋ
63_one,ˈu n + u,y ŋ,ˈu n + o,ˈu n + u,y ŋ,u n,u n,u n,ˈu n + u,u n,j o j ŋ,u ŋ,u n,u ŋ,u ŋ,u ŋ,ˈu n + o,u r,y ŋ,ˈu n + u,u n,u n,ˈu n + u,u n,ˈu n + ə,u n,ˈu n + u,u ŋ,y ŋ,y ŋ,o w n,uː n,u n,e n,ˈu n + u,ˈu n + o,yː ŋ,e n,i n,u n,y n,ˈu n + o,j y ŋ
64_person,ˈo m + u,ˈɔ m,ˈɔ m,ˈo mː + i n + i,ˈɔ m,ˈɔ m,ˈɔ m e,ˈo m b ɾ + e,k ɾ i s t j ˈa n + u,ˈɔ m ə,o m,o m,s t j a n,ˈɔ m,ˈw ˈɔ m o,ˈɔ mː + u,ˈɔ m + o,o m,ˈɔ m,ˈo mː + i n + e,ˈɔ m e,w o m,k ɾ ɨ s t j ˈa n + u,ˈɔ m u,k r ə s t ˈj a n + ə,ˈɔ m e,k ɾ i ʃ t j ˈa n + u,ˈɔ m,ˈɔ m e,ˈɔ mː + u,s tʃ ˈã n,o m,o m,k ə r ʃ tɕ ˈa w n,k ɾ i ʃ t j ˈa n + u,ˈw ˈɔ m + o,k r i s t ˈj a ŋ,k ə r ʃ tʲ ˈa ŋ,k ə r ʃ tɕ ˈa w n,ˈɔ m e,u m + ˈa n,ˈɔ m + o,ˈoː m + a ŋ
65_rain,p l ˈo̯a j + e,p ˈj œ v + a,p ˈj o v + a,ˈa bː + a,p ˈj œ v + a,p ˈj o v + a,p lˠ ˈu dʒ + a,ʎ ˈu β j + a,k j u v + ˈu t + a,p lˠ ˈu ʒ + ə,p l o v a j + a,p ˈj e v j + a,p ˈj ˈɔ v + a,p l ˈɔ j + e,p l ˈw e j + a,ˈæ ɡ w + a,p ˈj ˈɔ dʒː + a,p l ˈo j + e,p ˈj œ v + a,p r ˈo ɡ + i d + a,p lˠ ˈu tʃ + a,p l ˈo̯a j + ə,k j u v + ˈu t + a,p lˠ ˈu ʒ + ə,k ˈj ˈɔ dʒː + ə,p lˠ ˈu ʒ + ˈɛ,ˈa kː w + a,p ˈj o v + a,p l ˈɥ ˈɛ j + o,p ˈu j + a,p ˈj u v + a,ˈaː k v + a,p l ˈo v a j + e,p l ˈj ˈɛ v dʒ + ə,ˈa kː w + a,p ˈj ˈɔ dʒː + a,ˈæː ɡ w + a,p l ˈj ˈɛ v dʒ + ə,p l ˈj ˈɛ v dʒ + ə,p lˠ ˈu tʃ + a,p l ˈœ v dʒ + ə,p ˈj ˈɔ v + a,p ˈj ˈɔ v + a
66_red,a r ˈo ʃ + u,r u s,r o s,a rː ˈu b j + u,r u s,r ˈɔ s,r ˈɔ tʃ,r ˈo x + o,rː ˈu sː + u,b ə ɾ m ˈɛ ʎ,r a w s,k ˈe tʃ e ŋ,r o s,r ˈɔ s,k ˈw e tʃ u ŋ,r ˈu sː + u,r ˈo sː + o,r ˈo j s + u,r u s,r ˈu v j + u,r ˈɔ tʃ,r o ʃ,rː ˈu sː + u,v ə ɾ m ˈɛ j,r ˈu sː + ə,r ˈɔ tʃ,ʐ ˈu sː + u,r o s,ʁ ˈu dʒ + e,r ˈu ʒ + u,r o z,r ˈɔ s,r ˈo ʃ + u,k ˈo tʃ ə n,ʐ ˈu sː + u,r ˈo sː + o,r ˈu sː + u,k ˈo tʃ ə n,tɕ ˈj e tʃ ə n,r ˈɔ tʃ,k ˈo tʃ ə n,r ˈo s + o,r u s
67_road,k ˈa l + e,s t r a,s t r ˈa ð + a,a rː ˈu ɣ + a,s t r a,s t r ˈɛ d + a,k a m ˈi,k a m ˈi n + o,ʂ ɽ ˈa t + a,k ə m ˈi,k a l,ʃ t r ˈɛ d + a,s t r ˈa d + a,s t r ˈa d + e,ʃ t r ˈɛ d + a,s t r ˈa dː + a,s t r ˈa d + a,k ˈɒ l + e,s t r a,i s t r ˈa d + a,k a m ˈi,d r u m,ʂ ɽ ˈa t + a,k ə m ˈi,s t ˈr a t + ə,k a m ˈi,ʂ ɽ ˈa t + a,s t r ˈa ð + a,k a m ˈi ŋ,s t r ˈa dː + a,s t r e a,s t r ˈɛː d + a,d r u m,v ˈi + ə,ʂ ɽ ˈa t + a,s t r ˈa d + a,ʃ t r ˈɔ,v ˈe j + ə,v ˈi + ə,k a m ˈi,v ˈi + ə,s t r ˈa d + a,s t r a
68_root,a r ə d ə ts + ˈi n + ə,r ˈɛ j s,r a ð ˈi z + a,a rː ˈe ʒ i n + i,r ˈɛ j z,r a iː z,a r ˈɛ lˠ,r a ˈi θ,rː ˈa d i k + a,ə r ˈe lˠ,r a d ˈa j k + a,r e j ʃ,r a d + ˈi s,l i d r ˈiː s,r a v ˈi z + a,r ˈe j ʒ + a,b ˈa r b + a,k ˈo r e n,r ˈɛ j s,r a j ɡ ˈi n + a,r a ˈi lˠ,k ˈo r i n,rː ˈa d i k + a,r ˈɛ lˠ,r ˈa ɾ ə k + ə,a r ˈe lˠ,ʐ ˈa ɾ i k + a,r ˈa ð i s,ʁ a s ˈi n + o,r a d ˈi tʃ + i,r a d ˈi z + a,j a r ˈiː s + a,r ə d ə tʃ ˈi n + ə,r ə dʒ ˈi ʃ,ʐ ˈa ɾ i k + a,r a d ˈi tʃ + e,r ˈæ j ʒ + e,r ˈɛ j ʃ,r ə dʒ ˈi ʃ,a r ˈɛ lˠ,r ə dʒ ˈi ʃ,r a ˈi z + a,r a d ˈiː s
69_round,ɡ u r ɡ u ʎ + ˈe̯a t + u,r u t ˈu ŋ d,t ˈo ŋ d + o,t ˈu n d + u,r u t ˈu ŋ d,r o t ˈɔ n d,r e ð ˈo,r e ð ˈo n ð + o,t ˈu nː + u,r u ð ˈo,,t o r ˈo n,t o n d,t a r ˈɔ n t,t u r ˈo n t,r ˈj u ŋ d + u,t ˈo n d + o,t o n d,r u t ˈu ŋ d,t ˈu n d + u,r e ð ˈo,ɡ u r ɡ u ʎ + a t,t ˈu nː + u,r ə ð ˈo,t ˈu nː + ə,r o ð ˈo,t ˈu nː + u,t ˈo ŋ d + o,ʁ e d ˈu ŋ,r ˈj u ŋ d + u,t o n d,a r d ˈɔ n d,r o t ˈu n d,r ə d ˈu n t,t ˈu nː + u,r o t ˈo n d + o,r ˈj u ŋ d + u,r ə d ˈɔ n t,r ə d ˈu n t,r e ð ˈo,r ə d ˈw ˈɔ n t,t ˈo ŋ d + o,r u t ˈoː ŋ t
6_bird,p ˈu ʎ + u,u z ˈɛ l,o z ˈɛ l,p i lː ˈɔ n + i,u z ˈɛ l,u z ˈɛː l,p a ɾ ð ˈa lˠ,p ˈa x a ɾ + o,a tʃ ˈɛ ɖː + u,u s ˈe ʎ,u tʃ ˈu l,u tʃ ˈe l,u z ˈɛ l,u tʃ ˈɛ l,u tʃ ˈe l,a w ʒ ˈe lː + u,u tːʃ ˈɛ lː + o,p u ʎ,u z ˈɛ l,p u dz ˈo n + e,p a ɾ ð ˈa lˠ,p u ʎ,a tʃ ˈi ɖː + u,p ə ɾ ð ˈa lˠ,a w ʃ ˈj e lː + ə,m i ʃ + ˈo,a tʃ ˈj ˈɛ ɖː + u,u z ˈɛ l,a w s ˈɛ w,ˈɔ w ʒ ˈe lː + u,u z ˈɛ a v l,u z ˈɛ l,p ˈa s ə r + e,u tʃ ˈɛ,a w tʃ ˈj ˈɛ ɖː + u,u tːʃ ˈɛ lː + o,ɔː w ʒ + ˈeː,u tʃ ˈe l,u tʃ ˈi,p a ɾ ð ˈa lˠ,u tʃ ˈɛ,o z ˈɛ + o,y z ˈɛ l
70_sand,a r ˈi n + ə,s ˈa b j + a,s ˈa b j + a,a r ˈɛ n + a,s ˈa b j + a,s ˈa b j + a,a ɾ ˈe n + a,a ɾ ˈe n + a,rː ˈi n + a,s ˈo r + ə,s a l b ˈw o ŋ,s ao l ˈo ŋ,s ˈaː b j + a,s a v a l ˈɔ ŋ,s a b l ˈo ŋ,ˈæ ŋː + a,r ˈe n + a,s a l b ˈu n,s ˈa b j + a,r e n + a,a ɾ ˈe n + a,p i s ˈo k,rː ˈi n + a,ə ɾ ˈɛ n + ə,r ˈe n + a,a ɾ ˈe n + ˈɛ,ʐ ˈi n + a,s ˈa b j + a,s ˈa b l + o,s ˈa bː j + a,s a b ˈj o w n,s ˈa b j + a,n i s ˈi p,s ə b l ˈu n,ʐ ˈi n + a,s ˈa bː j + a,s ˈaː bː j + a,s ə v l ˈu ŋ,s ə b l ˈu n,a ɾ ˈe n + a,s ə b l ˈu n,s ˈa b j + a,s ˈa b j + a
71_say,dz ˈɨ k + u,d i,d i + r,n a j,d i,d iː + r,d i + ɾ,d e θ + ˈi + ɾ,d ˈi + ɾ i,d i,d ˈe k + r o,d i + r,d i + r,d iː,d i,d i,d i,z ˈi tʃ + e,d i,n ˈa rː + e + r e,d i + ɾ,z i k,d ˈi + ɾ ɨ,d i,d ˈi ʃ + ə + r ə,d i,ɾ ˈi + ɾ i,d i + r,d ˈi + ɾ e,d i,d i,d iː + r,a + z ˈi tʃ + e,d i + r,ɾ ˈi + ɾ i,d ˈi + r e,d i,d ˈɛ k + r,d i + r,d i + ɾ,d i + r,d i + r,d iː
72_see,v ˈe d + u,v ˈə d + e,v ˈe ð + e r,b ˈi + r i,v ˈə d + e,v ˈɛ d + e r,v ˈɛ w + ɾ e,b e + ɾ,v ˈi d + i + ɾ i,b ˈɛ w + ɾ ə,v e d + ˈa r,v e d + ˈe r,v ˈɛ d + a r,v ˈj ˈɔ d + i,u d + ˈə j,v ˈe dː + e,v e d + ˈe + r e,v e d + ˈæ,v ˈə d + i,b ˈi + e + r e,v ˈo + ɾ e,v e t,v ˈi d + ɨ + ɾ ɨ,v ˈɛ w + ɾ ə,v ə ɾ + ˈɛ,b ˈɛ w + ɾ e,v ˈi ɾ + i + ɾ i,v ˈe ð + e r,v ˈɛ j + ɾ e,v ˈe dː + e,v d + eː,v ˈɛ d + e r,a + v e d + ˈe v a,v ə z + ˈa j r,v ˈi ʐ + i,v e d + ˈe + r e,v j ˈɛ j,v ˈɛ k + r,v ə z + ˈe r,v ˈo + ɾ e,v ə ts + ˈe r,v ˈɛ d + e + r,v ˈœ ɡ + i
73_seed,s i m ˈi n ts + ə,s m ˈɛ n s,s e m + ˈɛ ŋ θ + a,s ˈɛ mː + i n + i,s m e n z,s e m + ˈɛ j n s + a,ʎ a v ˈo ɾ,s e m + ˈi ʎ + a,s i m + ˈɛ n ts + a,ʎ ə β ˈo,s e m ˈj a n ts,s ə m + ˈe n ts + a,s m + ˈɛ n t,s e m + ˈɛ n tʃ + e,s u m + ˈə n ts + a,s ˈe mː + e,s ˈe m + e,s e m ˈi n ts + ˈæ,s m ˈɛ n s,s ˈe mː + e n + e,ʎ a β ˈo ɾ,s i m ˈi n ts + ə,s i m + ˈɛ n ts + a,ʎ ə v ˈo,s ə mː + ˈɛ n t + ə,ʎ a β ˈo,s i m + ˈj ˈɛ n ts + a,s e m,ɡ ɾ ˈa n + o,s ˈe m + i,s m + ˈẽ n t + a,s m + ˈɛ j n s + a,s ə m ˈɨ n ts + ə,s e m,s i m + ˈɛ n ts + a,s ˈe m + e,s e m + ˈæː ŋ ts + a,s e m,s e m,ʎ a β ˈo ɾ,s e m,s ˈe m + e,s a m n + ˈɛ
74_sit,ʃ ˈe d + u,s t + ˈe + s ˈɛ t + ˈa,s e ŋ t + ˈa + r + s e + d o,s ˈɛ tːs + i,s t ˈe + s e,s ˈe d + e r,s ˈɛ w + ɾ e,e s t + ˈa + ɾ + s e n t + ˈa ð + o,a + sː i tː + ˈa + ɾ i + s i,s ˈɛ w + ɾ ə,s e d + ˈw o r,ˈe s + e r + s e n t + ˈa,s a n t + ˈa r + a s,s t aː + s e n t ˈaː t,v ˈe ʃ t + ə r + s ə n t + ˈa,ˈeː s e + s e t + ˈɔ w,s ˈj ˈɛ d + e,ʃ e d + ˈæ,s t + ˈe,s ˈe d + e + r e,e s t + ˈa + ɾ + a + s e n t + ˈa + t,s o t,s ɨ tː + ˈa + ɾ ɨ + s ɨ,s ˈɛ w + ɾ ə,s t + ˈa + a + sː ə tː + ˈa t + ə,s ˈɛ w + ɾ e,a + sː i tː + ˈa + ɾ i + s i,s e ŋ t + ˈa + r + s e,ˈɛ s t + ɾ e + a + s e t + ˈa,s e tː + ˈa + s e,z d + eː,s ˈeː d + e r,a + ʃ e d + ˈe v a,s ˈe s + ə r,a + sː i tː + ˈa + ɾ i + s i,s e d + ˈe + r e,s e t + ˈɛ,tʃ ə n t + ˈa r,s ˈe s + ə r,s ˈɛ w + ɾ e,s ˈɛ ts + ə r,s e ŋ t + ˈa + r + s e,s a t ˈɛ + s i
75_skin,tʲ ˈe̯a l + e,p ˈɛ l,p ˈɛ l,p ˈɛ dː + i,p ˈɛ l,p ˈɛ l + a,p e ʎ,p j e l,p ˈɛ ɖː + i,p e ʎ,p j a l,p e l,p e l,p j ˈɛ l,p e l,p ˈe lː + e,p ˈɛ lː + e,k ˈo z + e,p ˈɛ l,p ˈe ɖː + e,p e ʎ,k ˈo̯a ʒ + ə,p ˈɛ ɖː + ɨ,p e j,p ˈɛ lː + ə,p e ʎ,p ˈj ˈɛ ɖː + i,p ˈɛ l,p ˈɛ w,p ˈe lː + e,p ˈɛ a l + a,p ˈɛ l + a,p ˈj e l + e,p e l,p ˈɛ ɖː + i,p ˈɛ lː + e,p ˈɛː lː + e,p e l,p j a l,p e ʎ,p e l,p ˈɛ + e,p ˈɛ l
76_sleep,d ˈo r m + u,d ˈœ r m + e,d o r m + ˈi + r,d r ˈo mː + i + r i,d ˈœ r m + e,d u r m + ˈiː r,d o ɾ m + ˈi + ɾ,d o ɾ m + ˈi + ɾ,d ˈɔ ɾ m + i + ɾ i,d u ɾ m + ˈi,d o r m + ˈa r,d o r m + ˈi r,d u r m + ˈi r,d u r m + ˈiː,d u r m + ˈi,d u r m + ˈiː,d o r m + ˈi + r e,d u r m + ˈi,d ˈœ r m + e,d r o mː + ˈi + r e,d o ɾ m + ˈi + ɾ,d o r m,d ˈɔ mː + ɨ + ɾ ɨ,d u ɾ m + ˈi,d u r m + ˈi,d o ɾ m + ˈi,ɾ ˈw ˈɔ ɾ m + i + ɾ i,d r o m + ˈi + r,d u ɾ m + ˈi,d u r m + ˈi,d u r m + ˈi,d u r m + ˈiː r,a + d o r m + ˈi,d u r m + ˈi r,ɾ ˈɔ ɾ m + i + ɾ i,d o r m + ˈi + r e,d u r m + ˈi,d u r m + ˈɛ k r,d u r m + ˈi r,d o ɾ m + ˈe + ɾ,d u r m + ˈi r,d o r m + ˈi + r,d ˈɔː r m + i
77_small,ɲ ˈi k + u,tʃ i t,tʃ e k,p i tː + ˈi k + u,tʃ i t,tʃ i k,m e n ˈu t,p e k + ˈe ɲ + o,n ˈi k + u,p ə t ˈi t,p ˈe l + o,p ˈi k + o l,p ˈi k + u l,p ˈi tʃ + u l,p i t + l,p i tːʃ + ˈi n,p i tːʃ + ˈi n + o,m i k,tʃ i t,m i n ˈu ʒ + u,tʃ i k o t + ˈe t,m i k,p i tːʃ i ɾ i ɖː + u,p ə t ˈi t,p i tːʃ + i r + i lː + ə,p e t ˈi t,n ˈi k + u,p ˈi k + o l,p i tʃ + ˈo t,p i tʃ + ˈi n,ts n + i n,tʃ ˈɛ k,m i k,p ˈi tʃ + ə n,n ˈi k + u,p ˈi kː + o l + o,p i tʃ + ˈiː t + u,p ˈi tʃ + ə n,p i ɲ,tʃ i k o t + ˈe t,p ˈi tʃ + ə n,p ˈi k + o e v + o,p ˈiː tʃ + u
78_smoke,f ˈu m + u,f y m,f u ŋ,f ˈu mː + u,f y m,f u m,f u m,ˈu m + o,f ˈu m + u,f u m,,f u m,f u m,f u m,f u m,f ˈy mː + u,f ˈu m + o,d i m,f y m,f ˈu m + u,f u m,f u m,f ˈu m + u,f u m,f ˈu mː + ə,f u m,f ˈu m + u,f u m,f y m,f ˈy mː + u,f o m,f o m,f u m,f i m,f ˈu m + u,f ˈu m + o,f ˈyː mː + e,f e m,f e m,f u m,f y m,f ˈu m + o,f y m
