Cognate_ID,aromanian,barbaniapiemontese,bellunesevenetian,campidanese,carmagnolapiemontese,carpigianoemiliano,castellodelaplanacatalan,castilianspanish,cataniansicilian,centralcatalan,dalmatian,fassanoladin,ferrareseemiliano,friulian,gardeneseladin,genoeseligurian,grossetoitalian,istroromanian,lanzotorinesepiemontese,logudorese,manisescatalan,meglenoromanian,messinesesicilian,minorcancatalan,neapolitan,northwesterncatalan,palermitansicilian,primierovenetian,provencaloccitan,rapalloligurian,ravennateromagnol,reggianoemiliano,romanian,rumantschgrischun,southeasternsicilian,standarditalian,stellaligurian,surmiranromansh,sursilvanromansh,valenciancatalan,valladerromansh,venicevenetian,vercellesepiemontese
100_yellow,ɡ ˈa l b + i n + u,dʒ a w ŋ,dʒ a l,ɡ r ˈo ɣ + u,dʒ a w ŋ,z aː l,ɡ ɾ ˈɔ k,a m a ɾ + ˈi ʎ + o,dʒ ˈa lː + u,ɡ ɾ ˈɔ k,dz w ˈo l n + o,z a l,dz a l,dʒ aː l,ɡ j ə l,dʒ ˈa n + u,dʒ a lː + o,ʒ u t,dʒ a w ŋ,ɡ r ˈo ɡ + u,ɡ ɾ ˈɔ k,ɡ ˈa l b + i n,dʒ ˈa lː + u,ɡ ɾ ˈɔ k,dʒ ˈa lː + ə,ɡ ɾ ˈɔ k,dʒ ˈa ɾ n + u,dʒ a l,dʒ ˈa w n + e,dʒ ˈa lː + u,dz a l,dz aː l,ɡ ˈa l b + e n,m ˈɛ l ə n,ɡː ˈj a ɾ n + u,dʒ a lː + o,dʒ ˈaː n + u,m ˈɛ l ə n,m ˈɛ l ə n,ɡ ɾ ˈɔ k,ɡ ˈɛ l k,z ˈa e v + o,dʒ a l t
101_far,d i + p ˈa r t + e,l u ŋ t ˈa ŋ,l o ŋ t ˈa ŋ,a + t ˈe z + u,l u ŋ t ˈa ŋ,l u n t ˈa n,ʎ u ɲ,l ˈe x + o s,l u n t ˈa n + u,ʎ u ɲ,l o n t ˈw o ŋ,d a + l ˈo n tʃ,l u n t ˈa n,l o n t ˈa ŋ,l o n tʃ,l u ŋ t ˈa n,l o n t ˈa n + o,l ˈɒ r ɡ + o,l œ ɲ,a + l ˈa r ɡ + u,ʎ u ɲ,d i + p ˈa r t + i,l u n t ˈa n + u,ə n + f ˈɔ ɾ ə,l u n t ˈa n + ə,ʎ u ɲ,l u n t ˈa n + u,l o ŋ t ˈa ŋ,l j e w ˈe ŋ,l u ŋ t ˈa n,l u n t ˈã n,l u n t ˈaː n,d e + p ˈa r t + e,d ə + l ˈu n ʃ,l u n t ˈa n + u,l o n t ˈa n + o,l u ŋ t ˈa n,ʎ ˈu n ʃ,l u n ʃ,ʎ u ɲ,d ə + l ˈœ n tʃ,l o ŋ t ˈa ŋ,l u ŋ t ˈa ŋ
102_heavy,ɡ r e w,ɡ r ˈɛ v,p e z + ˈa ŋ t + e,ɡ r a j,ɡ r ˈɛ v,p eː z,p e z + ˈa t,p e s + ˈa ð + o,p i s + ˈa n t + i,p ə z + ˈa t,p e z + ˈw o n t,p e z + ˈo k,p e s,p e z + ˈa n t,p ə z + ˈɔ k,p e z + ˈa ŋ t + e,p ˈe s + o,ɡ r e v,ɡ r ˈɛ v,ɡ r ˈa v + e,p e z + ˈa t,ɡ r e w,p i s + ˈa n t + ɨ,p ə z + ˈa t,p ə s + ˈa n t + ə,p e z + ˈa t,p i s + ˈa n t + i,ɡ r e w,l u ɾ d,p e z + ˈaː ŋ t + e,p ˈɛ z + ˈã n t,p ˈɛ j z,ɡ r e w,ɡ r e f,p i s + ˈa n t + i,p e s + ˈa n t + e,p e z + ˈaː ŋ t + e,ɡ r e f,ɡ r e f,p e z + ˈa t,ɡ r ˈɛ j f,p e z + ˈa ŋ t + e,p i z + ˈaː ŋ t
103_near,a + p r ˈo̯a p + e,d a + v z ˈi ŋ,v i z ˈi ŋ,b i ʒ i n + u,v z ˈi ŋ,z v ˈɛ j n,a + p ɾ ˈɔ p,θ ˈe ɾ k + a,v i tʃ ˈi n + u,ə + p ɾ ˈɔ p,a + l ˈi tʃ,d a + v e ʒ ˈi ŋ,v s i n,d ˈɔ n dʲ + e,d a + w ʒ ˈi ŋ,v e ʒ ˈiː n,v i tʃ ˈi n + o,p r ˈo p + e,d a + v z ˈi ŋ,a + k ˈa n t + e,p ɾ ˈɔ p,p r ˈo̯a p + i,v ɨ tʃ ˈi n + u,ə + p ɾ ˈɔ p,v i ʃ ˈi n + ə,a + p ɾ ˈɔ p,v i tʃ ˈi n + u,v e z ˈi ŋ,p ɾ ˈɔ tʃ + e,v i ʒ ˈi n,b z ˈẽ n,v z e j n,a + p r ˈo v a p + e,d ə + m ə n + ˈa j v + ə l,v i tʃ ˈi n + u,v i tʃ ˈi n + o,v i ʒ ˈi n,m ə n + ˈe v + ə l,d ə + m ə n + ˈɛ j v + ə l,p ɾ ˈɔ p,d ə + ʃ t r ˈu ʃ,v i s ˈi ŋ,v z iː ŋ
104_salt,s ˈa r + e,s a l,s a l,s ˈa l + i,s a l,s ˈɛː l,s a lˠ,s a l,s ˈa l + i,s a lˠ,s w a l,s ˈɛ l,s a l,s aː l,s ˈɛ l,s aː,s ˈa l + e,s ˈɒ r + e,s a l,s ˈa l + e,s a lˠ,s ˈa r + i,s ˈa l + ɨ,s a lˠ,s ˈa l + ə,s a lˠ,s ˈa l + i,s a l,s a w,s aː,s e a l,s ˈɛː l,s ˈa r + e,s a l,s ˈa l + i,s ˈa l + e,s oː,s a l,s a l,s a lˠ,s a l,s a l,s a l
105_short,s k ˈu r t + u,k y r t,k u r t,k r ˈu tːs + u,k y r t,k u r t,k u ɾ t,k ˈo ɾ t + o,k ˈu ɾ t + u,k u ɾ t,k w a r t,k u r t,k u r t,k u r t,k u r t,k ˈu r t + u,k ˈo r t + o,s k u r t,k y r t,k ˈu r ts + u,k u ɾ t,k u s,k ˈu tː + u,k u ɾ t,k ˈu r t + ə,k u ɾ t,k ˈu ɾ t + u,k u r t,k u ɾ t,k ˈy r t + u,k u r t,k uː r t,s k u r t,k u r t,k ˈu ɾ t + u,k ˈo r t + o,k ˈy r t + u,k u r t,k w o r t,k u ɾ t,k w o r t,k ˈu r t + o,k œ r t
106_snake,ʃ ˈa r p + e,s ˈɛ r p + ˈɛ ŋ t,b ˈi s + a,s ˈɛ r p + i,s ˈɛ r p,s e r p + ˈɛ j n t,s e ɾ p,s e ɾ p + ˈj e n t + e,s k u ɾ s ˈu n + i,s e ɾ p,s e r p ˈj a n t,s e r p + ˈe n t,s e r p + ˈɛ n t,s a r p ˈi n t,b ˈe k + a,s e r p + ˈe n t + e,s ˈɛ r p + e,ʃ ˈɒ r p + e,s ˈɛ r p,k o l ˈo v r i + u,s e ɾ p,ʃ ˈa r p + i,s ˈɛ ɾ p + i,s e ɾ p,s ˈɛ r p + ə,s e ɾ p,s ˈj ˈɛ ɾ p + i,b ˈi s + a,s ˈɛ ɾ p,b ˈi ʒ + a,s a r p + ˈẽ n t,s a r p + ˈɛ j n t,ʃ ˈa r p + e,s ˈɛ r p,ʃ k u sː ˈu n + i,s ˈɛ r p + e,b ˈi ʃː + a,ts ˈɛ r p,s j a r p,s e ɾ p,s ˈɛ r p,s e r p + ˈe ŋ t + e,s a r p + ˈeː ŋ t
107_thin,s u p + ts ˈɨ r + e,s y + t ˈi l,f i ŋ,f ˈi n + i,s y + t ˈi l,m ˈɛ ɡ e r,p r i m,f ˈi n + o,f ˈi n + u,p r i m,,s o + t ˈi l,m ˈa ɡ a r,s u + t ˈiː l,s u + t ˈi l,s u t + ˈiː,f ˈi n + o,s u p + ts ˈi r + e,s y + t ˈi l,l ˈa n dz + u,p r i m,s l a p,f ˈi n + u,p r i m,f ˈi n + ə,p r i m,f ˈi n + u,f i ŋ,f i ŋ,s u tː + ˈi,s + t i l,s u + t ˈiː l,s u b + ts ˈi r + e,f i n,f ˈi n + u,s o + tː ˈi l + e,s ˈɛː t + ˈi,f e ɲ,f i n,p r i m,f i n,f i ŋ,s u + t ˈiː l
108_wind,v ˈi m t + u,v ˈɛ ŋ t,v ˈɛ ŋ t,b ˈe n t + u,ˈa r j + a,v ˈɛ j n t,v e n,b ˈj e n t + o,v ˈɛ n t + u,b e n,v j a n t,v e n t,v e n t,ˈa j a r,v ə n t,v ˈeː ŋ t + u,v ˈɛ n t + o,b ˈo r + ˈæ,v ˈɛ ŋ t,v ˈe n t + u,b e n t,v i n t,v ˈɛ n t + u,v e n t,v ˈj e n t + ə,b e n,v ˈj ˈɛ n t + u,v ˈɛ ŋ t,v ˈɛ n t,v ˈe ŋ t + u,v ˈɛ n t,v ˈɛ j n t,v ɨ n t,v ˈɛ n t,v ˈj ˈɛ n t + u,v ˈɛ n t + o,v ˈæː ŋ t + u,v ˈɛ n t,v ˈɛ n t,b e n t,v ˈɛ n t,v ˈe ŋ t + o,v eː ŋ t
109_worm,ʑ ˈe r m + u,v ˈɛ r m,b u t,b r ˈɛ mː + i n + i,v ˈɛ r m,b eː ɡ,k u k,l o m b ɾ ˈi θ,v ˈɛ ɾ m + i,k u k,v j a r m,v e r m,v ˈɛ r m,v j ˈɛ r,j ə r m,v ˈɛ r m + e,b ˈa k + o,ɣ ʎ ˈe r m + u,v ˈɛ r m,ˈe r m + e,k u k,dʲ ˈa r m + i,v ˈɛ ɾ m + i,k u k,v ˈɛ r m + ə,k u k,v ˈj ˈɛ ɾ m + u,v ˈɛ r m + e n,v ˈɛ ɾ m + e,v ˈeː r m + e,v ˈeː r m + a n,b ˈɛ j ɡ,v ˈj e r m + e,v ˈɛ r m,v ˈɛ ɾ m + i,v ˈɛ r m + e,v ˈæː r m + u,v ˈɛ r m,v j ˈɛ r m,k u k,v ˈɛ r m,v ˈɛ r m + e,v ˈɛ r m
10_bone,ˈo s + u,ˈɔ s,ˈɔ s,ˈo sː + u,ˈɔ s,ɔː s,ˈɔ s,ˈw e s + o,ˈɔ sː + u,ˈɔ s,v w a s,ˈɔ s,ˈɔ s,v ˈw ˈɛ s,ˈɔ s,ˈœ sː + u,ˈɔ sː + o,o s,ˈɔ s,ˈo sː + u,ˈɔ s,w o s,ˈɔ sː + u,ˈɔ s,ˈw o sː + ə,ˈɔ s,ˈw ˈɔ sː + u,ˈɔ s,ˈɔ s,ˈɔ sː + u,ˈɔ s,ɔː s,o s,ˈɔ s,ˈw ˈɔ sː + u,ˈɔ sː + o,ˈo sː + u,ˈɔ s,j e s,ˈɔ s,ˈɔ s,ˈɔ s + o,ɔː s
110_year,ˈa n + u,a n,a n,ˈa nː + u,a n,a n,a ɲ,ˈa ɲ + o,a nː + u,a ɲ,j a j ŋ,a n,a n,a n,a n,ˈa nː + u,ˈa nː + o,ɒ n,a n,ˈa nː + u,a ɲ,a n,a nː + u,a ɲ,ˈa nː + ə,a ɲ,a nː + u,a n,a nː + ˈa d + o,ˈa nː + u,a n,aː n,a n,ˈɔ n,a nː + u,ˈa nː + o,ˈa nː + u,ˈɔ n,ˈɔ n,a ɲ,o n,ˈa n + o,a ŋ
11_breast,tʲ ˈe p t + u,p ˈɛ t,p ˈɛ t,p i tː + ˈu r + a,s t ˈɔ m i,p ˈɛː t,p i t,p ˈe tʃ + o,p ˈɛ tː + u,p i t,p j a t,p j e t,p ˈɛ t,p ˈɛ t,p j e t,p ˈe tː + u,p ˈɛ tː + o,k ʎ e p t,p ˈɛ t,p e tː + ˈo rː + a,p i t,tʲ e p t,p ˈɛ tː + u,p i t,p ˈj e tː + ə,p i t,p ˈj ˈɛ tː + u,t ˈe t + e,p e j t ɾ + ˈi n + o,k a ʃ ˈe tː + a,p ˈɛ a t,s t ˈɔ m e ɡ,p j e p t,p ˈɛ ts,p ˈj ˈɛ tː + u,p ˈɛ tː + o,p ˈæ t + u,p ˈɛ ts,p ˈɛ ts,p i t,p e t,p ˈe t + o,s t ˈɔː m i k
12_burntr,ˈa r d + u,b r y z + ˈe,b r u z + ˈa + r,a + b r u ʒ + ˈa j,b r y z + ˈe,b r u z + ˈɛː r,k ɾ e m + ˈa + ɾ,k e m + ˈa + ɾ,b r u tʃ + ˈa + ɾ i,k ɾ ə m + ˈa,,b r u ʒ + ˈɛ r,b r u z + ˈa r,b r u s + ˈaː,b r u ʒ + ˈɛ,b r y ʒ + ˈaː,b r u tʃ + ˈa + r e,p a l + ˈi,b r y z + ˈe,b r u s j + ˈa + r e,k ɾ e m + ˈa + ɾ,a r t,b a m p + ˈa + ɾ ɨ,k ɾ ə m + ˈa,a + bː r u ʃː + ˈa,k ɾ e m + ˈa,a + bː r u tʃ + ˈa + ɾ i,b r u z + ˈa + r,b r y l + ˈa,b r y ʒ + ˈa,b r u z + ˈe a,b r u z + ˈe r,a + ˈa r d + e,ˈa r d + ə r,a + bː r u ʃ + ˈa + ɾ i,b r u tʃ + ˈa + r e,b r yː ʒ + ˈæ,ˈa r d + ə r,b ə r ʃ + ˈa r,k ɾ e m + ˈa + ɾ,ˈa r d + ə r,b r u z + ˈa + r,b r y z + ˈɛ
13_clawnail,ˈu n ɡ ʎ + e,ˈu ŋ dʒ + a,ˈo ŋ dʒ + a,ˈu ŋ ɡ + a,ˈu ŋ dʒ + a,ˈu ŋ dʒ + a,ˈu ŋ ɡ lˠ + a,ˈu ɲ + a,ˈu ɲː + a,ˈu ŋ ɡ lˠ + ə,ˈo ŋ ɡ l + a,ˈo m b j + a,ˈɔ n dʒ + a,o ŋ ɡ u l + ˈe,ˈo n d l + a,ˈu ŋ dʒ + a,ˈu ŋ ɡ j + a,ˈu ŋ ɡ ʎ + e,ˈu ŋ dʒ + a,ˈu ŋ ɡ r + a,ˈu ŋ ɡ lˠ + a,ˈu n ɡ ʎ + ə,ˈu ɲː + a,ˈu ŋ ɡ lˠ + ə,ˈo ɲː + ə,ˈu ŋ ɡ lˠ + ˈɛ,ˈu ɲː + a,ˈo ŋ dʒ + a,ˈu ŋ ɡ l + o,ˈu ŋ dʒ + a,ˈo n dʒ + a,ˈo n dʒ + a,ˈu ŋ ɡ j + e,ˈu ŋ ɡ l + ə,ˈu ɲː + a,ˈu ŋ ɡ j + a,ˈu ŋ dʒ + a,ˈu ŋ ɡ l + ə,ˈu ŋ ɡ l + ə,ˈu ŋ ɡ lˠ + a,ˈu ŋ ɡ l + ə,ˈo ŋ dʒ + a,ˈoː ŋ dʒ + a
14_cloud,n i ˈo r + u,n ˈi v u l + a,n ˈu v o l + a,n u j,n ˈi v u l + a,n ˈu v l + a,n ˈu v o lˠ,n ˈu β + e,n ˈu v u l + a,n ˈu β u lˠ,n ˈu v o l,n ˈi ɡ o l + a,n ˈu v a l,n uː l,n ˈi b l + a,n ˈy v i + a,n ˈu v o l + a,o b l ˈɒ k,n ˈi v u l + a,n ˈu + e,n ˈu β o lˠ,n o r,n ˈu v u l + a,n i v u lˠ + ˈa t,n ˈu v ə l + ə,n ˈu β o lˠ,n ˈu v u l + a,n ˈu v o l + a,n ˈi v + e,n ˈy vː u + a,n ˈu v l + a,n ˈo v l + a,n o r,n ˈi v ə l,n ˈu v u l + a,n ˈu v o l + a,n ˈiː ɡ ɥ + a,n ˈɛ j v ə l,n ˈi b ə l,n ˈu β o lˠ,n ˈy v l + ə,n ˈu v o e v + a,n ˈiː w l + a
15_cold,a r ˈa ts + e,f r ˈɛ j d,f r e t,f r ˈi ð + u,f r ˈɛ j d,f r ˈɛ d,f ɾ e t,f ɾ ˈi + o,f ɾ ˈi dː + u,f ɾ ˈɛ t,ɡ e l ˈw a t,f r e j t,f r e d,f r eː t,f r ə j t,f r ˈe j d + u,d j a tːʃ + o,r ˈɒ tʃ + e,f r ˈɛ j d,f r ˈi tː + u,f ɾ e t,r ˈa ts + i,f ɾ ˈi dː + u,f ɾ ˈɛ t,f r ˈi dː + ə,f ɾ e t,f ɾ ˈi dː + u,f r e t,f ɾ e,f r ˈe j d + u,dʒ a ts + ˈe a,f r ˈɛ d,r ˈe tʃ + e,f r a j t,f ɾ ˈi dː + u,f r ˈe dː + o,f r ˈe dʒː + u,f r ˈɛ j t,f r ˈɛ j t,f ɾ e t,f r a j t,f r ˈe d + o,f r œ tʃ
16_come,ʑ ˈi n + u,v n + i,v e n j + ˈa + r,b ˈɛ nː + ˈi,v n + i,ɲ + iː r,v ˈi n d + ɾ e,b e n + ˈi + ɾ,v ˈɛ n + i + ɾ i,b ə n + ˈi,v e n + ˈa r,v e ɲ + ˈi r,ɲ + i r,v i ɲ + ˈiː,u n + ˈi,v e ɲ + ˈiː,v e n + ˈi + r e,v e r + ˈi,v n + i,b ˈe nː + e + r e,b ˈi n d + ɾ e,v i n,v ˈɛ n + ɨ + ɾ ɨ,v ə n + ˈi,v ə n + ˈi,b ˈi n d + ɾ e,v ˈj ˈɛ n + i + ɾ i,v ˈɛ ɲ + e + r,v e n + ˈi,v e ɲ + ˈi,v n + i,ɲ + iː r,a + v e n + ˈi,v ə ɲ + ˈi r,v ˈɛ n + i + ɾ i,v e n + ˈi + r e,v eː ɲ + ˈi,n ˈɛ + k r,v ə ɲ + ˈi r,b e n + ˈi + ɾ,ɲ + i r,v e n + ˈi + r,ɲ + iː
17_die,m ˈo r + u,m ˈœ j r + e,m o r + ˈi + r,m ˈɔ rː + ˈi,m ˈœ j r + e,m u r + ˈiː r,m o ɾ + ˈi + ɾ,m o ɾ + ˈi + ɾ,m ˈɔ ɾ + i + ɾ i,m u ɾ + ˈi,m o r + ˈa r,m o r + ˈi r,m u r + ˈi r,m u r + ˈiː,m u r + ˈi,m u + ˈiː,m o r + ˈi + r e,m u r + ˈi,m ˈœ j r + e,m ˈo rː + e + r e,m o ɾ + ˈi + ɾ,m o r,m ˈɔ ɾ + ɨ + ɾ ɨ,m u ɾ + ˈi,m u r + ˈi,m o ɾ + ˈi,m ˈw ˈɔ ɾ + i + ɾ i,m o r + ˈi + r,m u ɾ + ˈi,m u + ˈi,m u r + ˈi,m u r + ˈiː r,a + m u r + ˈi,m u r + ˈi r,m ˈɔ ʐ + i,m o r + ˈi + r e,m i + ˈi,m u r + ˈɛ k r,m u r + ˈi r,m o ɾ + ˈi + ɾ,m u r + ˈi r,m o r + ˈi + r,m ˈœ r + i
18_dog,k ˈɨ n + e,k a ŋ,k a ŋ,k ˈa + i,k a ŋ,k a ŋ,ɡ o s,p ˈe r + o,k ˈa n + i,ɡ o s,k w o ŋ,tɕ a ŋ,k a n,tʲ a ŋ,tɕ a ŋ,k a ŋ,k ˈa n + e,b r e k,k a ŋ,k ˈa n + e,ɡ o s,k ˈɔ j n + i,k ˈa n + ɨ,k a,k ˈa n + ə,ɡ o s,k ˈa n + i,k a ŋ,tʃ i ŋ,k a ŋ,k ˈã n,k aː n,k ˈɨ j n + e,tɕ a w n,k ˈa n + i,k ˈa n + e,k a ŋ,tʲ a ŋ,tɕ a w n,ɡ o s,tɕ a n,k a ŋ,k a ŋ
19_drink,b e v a + w,b ˈɛ j v + e,b ˈe + r e,b u fː + ˈa j,b ˈɛ j v + e,b ˈɛ v + e r,b ˈe w + ɾ e,b e β + ˈe + ɾ,v ˈi v + i + ɾ i,b ˈɛ w + ɾ ə,b + a r,b ˈe j v + e r,b ˈɛ + a r,b ˈɛ v + i,b ˈe v + ə r,b ˈɛ j v + e,b ˈɛ,b ˈæ,b ˈɛ j v + e,b u fː + ˈa + r e,b ˈe w + ɾ e,b ˈe̯a + w,b ˈi v + ɨ + ɾ ɨ,b ˈɛ w + ɾ ə,v ˈɛ β + ə + r ə,b ˈe w + ɾ e,v ˈi v + i + ɾ i,b ˈe v + e + r,b ˈe w + ɾ e,b ˈe j + e,b eː,b ˈɛ v + e r,a + b ˈe v a,b ˈa j v + ə r,v ˈi v + i + ɾ i,b ˈe + r e,b ˈɛ j v + e,b ˈe v + ə r,b ˈɛ j b + ə r,b ˈe w + ɾ e,b ˈa j v + ə r,b ˈɛ v + e + r,b ˈeː v + i
1_all,t ˈu t + u,t y t,t ˈu t + o,t ˈo tː + u,t y j t,t u t,t o t,t ˈo ð + o,t ˈu tː + u,t o t,t o tʃ,d u t,t u t,d u t,d u t,t y tː + u,t ˈu tː + o,t o t,t y t,t ˈo tː + u,t o t,t o t,t ˈu tː + u,t o t,t ˈu tː + ə,t o t,t ˈu tː + u,t u t,t u t,t ˈy tː + u,t o t,t o t,t o t,t u t,t ˈu tː + u,t ˈu tː + o,t ˈy tː + u,t o t,t u t,t o t,t w o t,t ˈu t + o,t y tʃ
20_dry,u s k + ˈa t + u,s ˈɛ k,s e k,s i kː + ˈa w,s ˈɛ k,s u t,s e k,s ˈe k + o,s ˈi kː + u,s ˈɛ k,s w a t,s u t,s u t,s u t,s u t,s ˈe kː + u,s ˈe kː + o,u s k ˈɒ + t,s y j t,s ˈi kː + u,s e k,u s k + ˈa t,s ˈi kː + u,s ˈɛ k,s ˈi kː + ə,s e k,s ˈi kː + u,s u t,s e,s ˈe kː + u,a s ˈo t,s o t,u s k + ˈa t,s i tɕ,s ˈi kː + u,s ˈe kː + o,s ˈe kː + u,s i tʲ,ʃ e tɕ,s e k,s y t,s ˈe k + o,s œ k
21_ear,u r ˈe v a k ʎ + e,u r ˈi j + a,r ˈe tʃ + a,o r ˈi ɣ + a,u r ˈi j + a,u r ˈɛ tʃ + a,o ɾ ˈe ʎ + a,o ɾ ˈe x + a,a ɾ ˈi kː j + u,u ɾ ˈɛ ʎ + ə,o r ˈa k l + a,u r ˈe j + a,u r ˈɛ tʃ + a,o r ˈɛ l + e,u r ˈə d l + a,w ˈɛ dʒ + a,o r ˈe kː j + o,u r ˈæ k ʎ + e,u r ˈi j + a,o r ˈi kː r + a,o ɾ ˈe ʎ + a,u r ˈe̯a k ʎ + ə,ɾ ˈi kː ɨ,u ɾ ˈɛ + ə,r ˈe kː j + ə,a w ɾ ˈe ʎ + ˈɛ,a ɾ ˈi kː j + u,r ˈe tʃ + a,a w r ˈi + o,a w ˈe dʒ + e,u r ˈɛ tʃ + a,u r ˈɛ tʃ + a,u r ˈe k + e,u r ˈe ʎ + ə,a w ɾ ˈi tːʃ + a,o r ˈe kː j + o,w ˈɛ dʒː + a,u r ˈe j + ə,u r ˈe ʎ + ə,o ɾ ˈe ʎ + a,u r ˈa ʎ + ə,r ˈɛ tʃ + a,u r ˈœ dʒ + a
22_earth,ts ˈa r + ə,t ˈɛ r + a,t ˈɛ r + a,t ˈɛ rː + a,t ˈɛ r + a,t ˈɛ r + a,t ˈɛ r + a,t ˈj e r + a,t ˈɛ rː + a,t ˈɛ r + ə,t ˈa r + a,t ˈe r + a,t ˈɛ r + a,t ˈj ˈɛ r + e,t ˈj ə r + a,t ˈɛ r + a,t ˈɛ rː + a,p e m ˈi n t,t ˈɛ r + a,t ˈe rː + a,t ˈɛ r + a,ts ˈa r + ə,t ˈɛ rː + a,t ˈɛ r + ə,t ˈɛ rː + ə,t ˈɛ r + ˈɛ,t ˈj ˈɛ ʐ + a,t ˈɛ r + a,t ˈɛ ʁ + o,t ˈæ r + a,t ˈɛ a r + a,t ˈɛ r + a,p ə m ˈɨ n t,t ˈɛ r + ə,t ˈɛ ʐ + a,t ˈɛ rː + a,t ˈæ r + a,t ˈe r + ə,t ˈj a r + ə,t ˈɛ r + a,t ˈɛ r + ə,t ˈɛ r + a,t ˈɛ r + a
23_eat,m ˈɨ k + u,m a ŋ dʒ + ˈe,m a ɲ + ˈa + r,p a pː + ˈa j,m a ŋ dʒ + ˈe,m a ɲ + ˈɛː r,m e ɲ dʒ + ˈa + ɾ,k o m + ˈe + ɾ,m a n tʃ + ˈa + ɾ i,m ə ɲ ʒ + ˈa,m a n tʃ + ˈu r,m a ɲ + ˈɛ r,m a ɲ + ˈa r,m a n dʲ + ˈaː,m a j + ˈə,m a ŋ dʒ + ˈa,m a n dʒ + ˈa + r e,m ə ŋ k + ˈɒ,m a ŋ dʒ + ˈe,m a n d i ɡ + ˈa + r e,m e ɲ tʃ + ˈa + ɾ,m ə n ˈa n k,m a n tʃ + ˈa + ɾ ɨ,m ə ɲ ʒ + ˈa,m a ɲː + ˈa,m e ɲ dʒ + ˈa,m a n tʃ + ˈa + ɾ i,m a ɲ + ˈa + r,m a n dʒ + ˈa,m a ŋ dʒ + ˈa,m a ɲ + ˈe a,m a ɲ + ˈɛː r,a + m ɨ ŋ k + ˈa,m ə n dʒ + ˈa r,m a n tʃ + ˈa + ɾ i,m a n dʒ + ˈa + r e,m a ŋ dʒ + ˈɛ,m ə ʎ + ˈe r,m ə ʎ + ˈa r,m e ɲ tʃ + ˈa + ɾ,m ə n dʒ + ˈa r,m a ɲ + ˈa + r,m a ŋ dʒ + ˈɛ
24_egg,o w,œ v,ˈo v + o,o w,œ w,oː v,ˈɔ w,ˈw e β + o,ˈɔ v + u,ˈɔ w,j u v,e f,ˈɔ v,uː f,w e f,ˈœ v + u,ˈɔ v + o,o v,œ v,ˈo v + u,ˈɔ w,w o w,ˈɔ v + u,ˈɔ w,ˈw o v + ə,ˈɔ w,ˈw ˈɔ v + u,o w,j ˈɔ w,ˈœ v + u,ˈɔ a v,oː v,o w,o f,ˈw ˈɔ v + u,ˈw ˈɔ v + o,ˈœː v + u,o f,j e f,ˈɔ w,œ f,v ˈɔ v + o,œ f
25_eye,ˈo k ʎ + u,œ j,ˈɔ tʃ + o,ˈo ɣ + u,œ j,ɔː tʃ,u ʎ,ˈo x + o,ˈɔ kː j + u,u ʎ,v ˈa k l + o,ˈe j + e,o tʃ,v ˈoː l + i,w e d l,ˈœ dʒː + u,ˈɔ kː j + o,ˈo k ʎ + u,œ j,ˈo kː r + u,u ʎ,w ˈo k ʎ + u,ˈɔ kː j + u,u j,ˈw o kː j + ə,u ʎ,ˈw ˈɔ kː j + u,ˈɔ tʃ + o,ɥ ˈɛ j,ˈœ dʒː + u,ˈɔ tʃ,ɔː tʃ,o kʲ,e ʎ,ˈw ˈɔ tːʃ + u,ˈɔ kː j + o,ˈœː dʒː + u,i ʎ,e ʎ,u ʎ,œ ʎ,ˈɔ tʃ + o,œ tʃ
26_fatn,ɡ r ə s + ˈi m + e,ɡ r a s,ɡ r a s,ɡ r ˈa sː + u,ɡ r a s,ɡ r aː s,ɡ ɾ e j ʃ,ɡ ɾ ˈa s + a,ɾ ˈa sː + u,ɡ ɾ e ʃ,ɡ r e s,ɡ r a s,ɡ r a s,ɡ r a s,ɡ r a s,ɡ r ˈa sː + u,ɡ r ˈa sː + o,m ɒ s t,ɡ r a s,r ˈa sː + u,ɡ ɾ e j ʃ,ɡ r ə s + ˈi m + i,ɾ ˈa sː + u,s ˈɛ w,ɡ r ˈa sː + ə,ɡ ɾ e j ʃ,ɾ ˈa sː + u,ɡ r a s,ɡ ɾ a s,ɡ r ˈa sː + u,ɡ r a s,ɡ r aː s,ɡ r ə s + ˈi m + e,ɡ r a s,ɾ ˈa sː + u,ɡ r ˈa sː + o,ɡ r ˈa ʃː + a,ɡ r a s,ɡ r a s,ɡ ɾ e j ʃ,ɡ r a s,ɡ r ˈa s + o,ɡ r a s
27_feather,p ˈe̯a n + ə,p ˈj y m + a,p ˈe n + a,p ˈi nː + a,p ˈj y m + a,p ˈɛ n + a,p lˠ ˈo m + a,p l ˈu m + a,p ˈi nː + a,p lˠ ˈo m + ə,p ˈa j n + a,p ˈj u m + a,p ˈɛ n + a,p l ˈu m + e,p l ˈu m + a,p ˈe nː + a,p ˈe nː + a,p ˈæ n a,p ˈj y m + a,p r ˈu mː + a,p lˠ ˈo m + a,p ˈe̯a n + ə,p ˈi nː + a,p lˠ ˈo m + ə,p ˈe nː + ə,p lˠ ˈo m + ˈɛ,p ˈi nː + a,p ˈj u m + a,p l ˈy m + o,p ˈe ŋː + a,p ˈɛ n + a,p ˈj o m + a,p ˈa n + ə,p l ˈi m + ə,p ˈj u m + a,p ˈe nː + a,tʃ ˈy mː + a,p l ˈe m + ə,p l ˈe m + ə,p lˠ ˈo m + a,p ˈɛ n + ə,p ˈe n + a,p ˈj yː m + a
28_fire,f ˈo k + u,f œ,f ˈo ɡ + o,f ˈo ɣ + u,f œ,f oː ɡ,f ˈɔ k,f ˈw e ɣ + o,f ˈɔ k + u,f ˈɔ k,f u k,f e k,f ˈɔ ɡ,f uː k,f w e k,f ˈœ ɡ + u,f ˈɔ k + o,f o k,f œ,f ˈo ɡ + u,f ˈɔ k,f o k,f ˈɔ k + u,f ˈɔ k,f ˈo k + ə,f ˈɔ k,f ˈw ˈɔ k + u,f o k,f j ˈɔ,f ˈœː ɡ + u,f u ɡ,f ɔː ɡ,f o k,f j e w,f ˈw ˈɔ k + u,f ˈw ˈɔ k + o,f œ,f i,f j u k,f ˈɔ k,f œ,f ˈɔ ɡ + o,f œ k
29_fish,p ˈe s k + u,p ə s,p e s,p ˈi ʃː + i,p ˈɛ s,p ˈɛ s,p e j ʃ,p e θ,p ˈi ʃː + i,p e ʃ,p j a s,p e ʃ,p ˈɛ s,p ˈɛ s,p ə ʃ,p ˈe ʃː + u,p ˈe ʃː + e,r ˈi b + ˈæ,p ˈɛ s,p ˈi s k + e,p e j ʃ,p ˈe v a ʃ t + i,p ˈi ʃː + i,p e ʃ,p ˈe ʃː + ə,p e j ʃ,p ˈi ʃː + i,p e s,p ˈɛ j s,p ˈɛ ʃː + u,p ˈɛ s,p ˈɛ s,p ˈe ʃ t + e,p e ʃ,p ˈi ʃː + i,p ˈe ʃː + e,p ˈæ ʃː + u,p e ʃ,p ˈɛ ʃ,p e j ʃ,p e ʃ,p ˈe s + e,p œ s
2_ashes,tʃ i n ˈu ʃ + e,s ˈə n ˈɛ r,θ ˈe ŋ d r + o,tʃ i n ˈi ʒ + u,s ˈə n ˈɛ r,s ˈɛ n d r + a,s ˈɛ n d ɾ + e s,θ e n ˈi θ + a,tʃ ˈi nː i ɾ + i,s ˈɛ n d ɾ + ə s,k a n ˈa j s + a,tʃ ˈe n d ˈɛ r,ts ˈɛ n d a r,tʃ i n ˈi z + e,tʃ ˈə n d ə r,tʃ ˈe n e r + i,tʃ ˈe n e r + e,tʃ e r ˈu ʃ + e,s ˈə n ˈɛ r,k i s ˈi n + a,s ˈɛ n d ɾ + a,tʃ ə n ˈu ʃ + ə,tʃ ˈi n ɨ ɾ + ɨ,s ˈɛ n d ɾ + ə s,ʃ ˈɛ nː ə r + ə,s ˈɛ n d ɾ + e s,tʃ ˈi nː i ɾ + i,θ ˈe ŋ d r + e,s ˈɛ n d ɾ + e,s ˈe ŋ j + e,ts ˈɛ n d r + a,s ˈɛ n d r + a,tʃ e n ˈu ʃ + ə,tʃ ˈɛ n d r + ə,tʃ ˈi nː i ɾ + i,tʃ ˈe n e r + e,s r ˈe nː + e,tʃ ˈɛ n d r + ə,tʃ ˈɛ n d r + ə,s ˈɛ n d ɾ + e s,tʃ ˈɛ n d r + ə,s ˈɛ n e r + i,s ˈœ ŋ d r + i
30_flyv,a s b ˈw ai r + u,v u l + ˈe,v o l + ˈa + r,b o l + ˈa j,v u l + ˈe,v u l + ˈɛː r,v o lˠ + ˈa + ɾ,b o l + ˈa + ɾ,v u l + ˈa + ɾ i,b u lˠ + ˈa,,ʒ ɡ o l + ˈɛ r,v u l + ˈa r,z v o l + ˈaː,ʒ u l + ˈɛ,ʒ o + ˈaː,v o l + ˈa + r e,l e t + ˈi,v u l + ˈe,b o l + ˈa + r e,b o lˠ + ˈa + ɾ,p ə r + ə j + ˈe s,v u l + ˈa + ɾ ɨ,v u lˠ + ˈa,v u l + ˈa,b o lˠ + ˈa,v u l + ˈa + ɾ i,v o l + ˈa + r,v u l + ˈa,ʒ u + ˈa,v u l + ˈe a,v u l + ˈɛː r,a + z b u r + ˈa,ʒ ɡ u l + ˈa r,a + bː u l + ˈa + ɾ i,v o l + ˈa + r e,ʒ v u + ˈɛ,ʒ ɡ u l + ˈa r,ʒ ɡ u l + ˈa r,b o lˠ + ˈa + ɾ,ʒ v ə l + ˈa r,v o l + ˈa + r,v u l + ˈɛ
31_foot,tʃ i tʃ ˈo r + u,p e,p ie,p ˈɛ j,p e,p eː,p ˈɛ w,p j e,p ˈɛ d + i,p ˈɛ w,p i n s,p e,p j ˈɛ,p iː t,p e,p eː,p ˈj ˈɛ d + e,p i tʃ ˈo r,p e,p ˈe d + e,p ˈɛ w,p i tʃ ˈo r,p ˈɛ ɾ + i,p ˈɛ w,p ˈɛ ɾ + ə,p ˈɛ w,p ˈj ˈɛ ɾ + i,p ie,p ˈɛ t,p e,p e,p ˈɛ,p i tʃ ˈo r,p e,p ˈɛ ɾ + i,p ˈj ˈɛ d + e,p e,p e,p e j,p ˈɛ w,p ˈɛ,p ie,p ˈɛ
32_full,p l ˈi n + u,p j ˈɛ ŋ,p j e ŋ,p r ˈe n + u,p j ˈɛ ŋ,p iː n,p lˠ e,ʎ ˈe n + o,k ˈi n + u,p lˠ ˈɛ,p l a j n,p j e ŋ,p i n,p l ˈɛ ŋ,p l ə ŋ,p i ŋ,p ˈj ˈɛ n + o,p ʎ i r,p j ˈɛ ŋ,p r ˈe n + u,p lˠ e,ɐ m + p l ˈi n,k ˈi n + u,p lˠ ˈɛ,k ˈi n + ə,p lˠ e,k ˈi n + u,p j e ŋ,p l e ŋ,p i ŋ,p i n,p iː n,p l i n,p l a j n,tʃ ˈi n + u,p ˈj ˈɛ n + o,tʃ ˈæ ŋ,p l a ɲ,p l ˈɛ j n,p lˠ e,p l a j n,p j ˈɛ ŋ,p iː ŋ
33_give,d a + w,d e,d a + r,d o n + ˈa j,d e,d ˈɛː + r,d o n + ˈa + ɾ,d a + ɾ,d ˈa + ɾ i,d u n + ˈa,d w o + r,d ˈɛ + r,d a + r,d aː,d ˈɛ,d aː,d ˈa + r e,d ɒ,d ˈɛ,d ˈa + r e,d o n + ˈa + ɾ,d a + w,d ˈa + ɾ ɨ,d u n + ˈa,d ˈa,d o n + ˈa,d ˈa + ɾ i,d a + r,d u n + ˈa,d a,d e a,d ˈɛː + r,a + d ˈa,d a + r,d ˈa + ɾ i,d ˈa + r e,d ˈɛ,d a + r,d a + r,d o n + ˈa + ɾ,d a + r,d a + r,d ˈɛ
34_good,b ˈu n + u,b u ŋ,b o ŋ,b ˈo n + u,b u ŋ,b ˈɔ w n,b ˈɔ,b ˈw e n + o,b ˈɔ n + u,b ˈɔ,b u ŋ,b o ŋ,b o n,b ˈɔ ŋ,b o ŋ,b u ŋ,b ˈɔ n + o,b u r,b u ŋ,v ˈo n + u,b ˈɔ n,b u n,b ˈɔ n + u,b ˈɔ,b ˈw o n + ə,b ˈɔ,b ˈw ˈɔ n + u,b ˈɔ ŋ,b o ŋ,b u ŋ,b o w n,b ˈɔ w n,b u n,b u n,b ˈw ˈɔ n + u,b ˈw ˈɔ n + o,b u ŋ,b u ŋ,b j e n,b ˈɔ,b u n,b o ŋ,b oː ŋ
35_green,v ˈe̯a r d + e,v ˈɛ r d,v e r t,b ˈi r d + i,v ˈɛ r d,v e r d,v ˈɛ ɾ t,b ˈe ɾ ð + e,v ˈi ɾ d + i,b ˈɛ ɾ t,v j a r d,v e r t,v e r d,v ˈɛ r t,v ə r t,v ˈɛ r d + e,v ˈe r d + e,z e l ˈe n,v ˈɛ r d,v ˈi r d + e,b ˈɛ ɾ t,v ˈe̯a r d + i,v ˈi dː + ɨ,v ˈɛ ɾ t,v ˈɛ r d + ə,b ˈɛ ɾ t,v ˈi ɾ d + i,v e r t,v e r t,v ˈe r d + e,v eː r,v ˈɛ j r d,v ˈe r d + e,v ˈɛ r t,v ˈi ɾ d + i,v ˈe r d + e,v ˈɛː r d + e,v ˈɛ r t,v ˈɛ r t,b ˈɛ ɾ t,v ˈɛ r t,v ˈe r d + e,v eː r t
36_hair,p ˈe r + u,k a v ˈɛ + j,k a v ˈe + i,p ˈi l u + z u,k a v ˈɛ + j,k a v + ˈiː,k a β ˈe ʎ,p ˈe l + o,k a p ˈi ɖː + i,k ə β ˈɛ ʎ,k a p ˈe + j,tɕ a v ˈe + j,k a v + ˈi,tʲ a v ˈɛ + j,tɕ a v ˈə + j,k a v ˈe lː + i,k a p ˈe lː + i,p e r,k a v ˈɛ + j,p ˈi l + o s,m ˈo ɲ + o,p e r,k a p ˈi ɖː + ɨ,k ə β ˈɛ j,k a p ˈi lː + ə,k a β ˈe ʎ,k a p ˈi ɖː + i,k a v ˈe + i,p ˈɛ w,k a v ˈe lː + i,k a v ˈɛ l,k a v + ˈiː,p ə r,tɕ ə v ˈɛ l + s,k a p ˈi ɖː + i,k a p ˈe lː + o,k a v ˈæː j + i,tʲ ə v ˈɛ l + s,k ə v ˈɛ ʎ + s,k a β ˈe ʎ,tɕ ə v ˈɛ l + s,k a v ˈe + i,k a v ˈœ + j
37_hand,m ˈɨ n + ə,m a ŋ,m a ŋ,m ˈa n + u,m a ŋ,m a ŋ,m a,m ˈa n + o,m ˈa n + u,m a,m w o ŋ,m a ŋ,m a n,m a ŋ,m a ŋ,m a ŋ,m ˈa n + o,m ə r,m a ŋ,m ˈa n + u,m a,m ˈɔ n + ə,m ˈa n + u,m a,m ˈa n + ə,m a,m ˈa n + u,m a ŋ,m a ŋ,m a ŋ,m ˈã n,m aː n,m ˈɨ n + ə,m a w n,m ˈa n + u,m ˈa n + o,m a ŋ,m a ŋ,m a w n,m a,m a n,m a ŋ,m a ŋ
38_head,k ˈa p + u,t ˈɛ s t + a,t ˈɛ s t + a,k ˈɔ ŋ k + a,t ˈe s t + a,t ˈɛ s t + a,k a p,k ɑ β ˈe θ + a,t ˈɛ s t + a,k a p,k u p,tʃ e f,k ˈɔ,tʲ aː f,tʃ ə,t ˈe s t + a,t ˈɛ s t + a,k ɒ p,t ˈɛ s t + a,k ˈo ŋ k + a,k a p,k a p,t ˈɛ s t + a,k a p,k ˈa p + ə,k a p,t ˈj ˈɛ s t + a,t ˈɛ s t + a,t ˈɛ s t + o,t ˈe s t + a,t ˈɛ a s t + a,t ˈɛ s t + a,k a p,tɕ a w,t ˈɛ s t + a,t ˈɛ s t + a,t ˈɛː s t + a,tʲ ˈe + ə,tɕ a w,k a p,tɕ e w,t ˈɛ s t + a,t ˈɛ s t + a
39_hear,ˈa v d + u,s ˈɛ ŋ t + e,s e ŋ t + ˈi + r,i n + t ˈɛ n d + i,s ˈɛ ŋ t + e,s i ŋ t + ˈiː r,s e n t + ˈi + ɾ,o ˈi + ɾ,s ˈɛ n t + i + ɾ i,s ə n t + ˈi,s e n t + ˈa r,s e n t + ˈi r,s i n t + ˈi r,s i n t + ˈiː,a w d + ˈi,s e ŋ t + ˈiː,s e n t + ˈi + r e,a v z + ˈi,s ˈɛ ŋ t + e,i n + t ˈe n d + e + r e,s e n t + ˈi + ɾ,u t,s ˈɛ n t + ɨ + ɾ ɨ,s ə n t + ˈi,s ə n t + ˈi,s e n t + ˈi,s ˈj ˈɛ n t + i + ɾ i,s e ŋ t + ˈi + r,e n + t ˈɛ n d + ɾ e,s e ŋ t + ˈi,s i n t + ˈi,s ˈɛ j n t + eː r,a + a w z + ˈi,u d + ˈi r,s ˈɛ n t + i + ɾ i,s e n t + ˈi + r e,s e ŋ t + ˈi,s a n t + ˈɛ k r,u d + ˈi r,s e n t + ˈi + ɾ,d u d + ˈi r,s e ŋ t + ˈi + r,s ˈeː ŋ t + i
3_bark,k ˈo v a ʒ + e,s k ˈɔ r s + a,s k ˈɔ r θ + a,s k r ˈo ʒ + u,s k ˈɔ r s + a,k u r t ˈɛ s + a,k r ˈɔ s t + a,k o ɾ t ˈe θ + a,s k ˈɔ ɾ tʃ + a,ə s k ˈɔ ɾ s + ə,,ʃ k ˈo r ts + a,k u r t ˈɛ tʃ + a,s k ˈu s + e,ʃ k ˈɔ r ts + a,s k ˈɔ r s + a,b ˈu tːʃ + a,k ˈo r + a,p l ˈœ j + a,k o θ i k + ˈi n + a,k ˈɔ ɾ f + a,,s k ˈɔ tːʃ + a,ə s k ˈɔ ɾ s + ə,ʃ k ˈɔ r ts + ə,a s k ˈɔ ɾ s + ˈɛ,ʃ k ˈw ˈɔ ɾ tʃ + a,s k ˈɔ r θ + a,r ˈy s k + o,s k ˈɔ r s + a,s k ˈɔ a v r ts + a,s k ˈɔː r s + a,s k ˈo v a r ts + ə,ʃ k ˈɔ r s + ə,ʃ k ˈɔ tːʃ + a,k o r t + ˈe tːʃ + a,s k ˈɔː r s + a,ʃ k ˈɔ r s + ə,ʃ k ˈɔ r s + ə,a s k ˈɔ ɾ s + a,ʃ k ˈɔ r ts + ə,s k ˈɔ r s + a,s k ˈɔ r s + a
40_heart,ˈi n i m + ə,k œ r,k ˈɔ r,k ˈɔ r + u,k œ r,k oː r,k ˈɔ ɾ,k o ɾ + a θ ˈo n,k ˈɔ ɾ + i,k ˈɔ ɾ,k w o r,k e r,k ˈɔ r,k uː r,k w e r,k œ,k ˈɔ r + e,j ˈi r i m + ˈæ,k œ r,k ˈo r + o,k ˈɔ ɾ,b u r ˈi k,k ˈɔ ɾ + ɨ,k ˈɔ,k ˈɔ r + ə,k ˈɔ ɾ,k ˈw ˈɔ ɾ + i,k ˈɔ r,k ˈɔ ɾ,k œ,k ˈɔ a r,k oː r,ˈi n i m + ə,k o r,k ˈɔ ɾ + i,k ˈw ˈɔ r + e,k œ,k o r,k o r,k ˈɔ ɾ,k ˈɔ w r,k w ˈɔ r,k œ r
