Cognate_ID	Kokama	Omagua	Tupinamba
1000_macaw		a ɾ a ɾ a	a ɾ a ɾ a
1003_majaspaca		p a k a	p a k a
1005_make	j a w k i		a p ó
1007_makedirty			m o m o ʃ ɨ
1018_man	n j + a p i ts a ɾ a	j + a p ɪ s a ɾ a	a β á
1019_manioc	u w i	j a w i ɾ i	m a nd i ʔ o k a
1020_maniocbeer	k a j ts u m a	k a i s u m a	k a w ĩ
1024_manymuch	tʃ i t a	ʃ i t a	a n a ɴ a t u
1026_marrytrans	t a k a k a	m i ɾ i k u a j a ɾ a	
1035_meat	ts + u	s + u u	o ʔ ó
1037_meetencountercomeacrossfind	ts a w i t i k a	s a w a i t a	j e s u β a
1048_mixtrans	i ɾ w a t a k a	k a m i k i	a p a m o n a n a
1053_monkeysp			mb ɨ ɾ ɨ k i
1056_monkeygeneric	k a j		
1057_month	j a ts ɨ		j a s ɨ
1058_moon	j a ts ɨ	j a s ɨ	j a s ɨ
1059_more	a p ɨ ts e	a p ɨ s a i	β é
105_bebornintr	u w + a ɾ i	u w + a ɾ i	a ɾ a
1060_morning		ɨ p ɨ s a k a t u	k o ʔ e m a
1063_mosquito		j a t i ú	ɲ a t i ʔ ũ
1064_mosquitosp			ɲ e t i ŋ a
1066_mother	m a m a	m a m a	s ɨ
1067_motherinlaw	j + a j tʃ i	j + a i ʃ ɪ	
1070_mourn	ts a p i ɾ u	s a p i ɾ u	s a p i ɾ õ
1071_mouserat	ts a n u j a	k i j a ɾ a	gʷ a β i ɾ u
1072_moustache			a m o t a β a
1073_mouth	j u ɾ u	j u ɾ u	j u ɾ u
1076_mud		ʃ i ɾ i	u ʔ ú m a
1081_naked	tʃ i ɾ u t ɨ	ʃ i ɾ u t i	i k a t u p e
1082_namen	tʃ + i ɾ a	ʃ + i ɾ a	e n õ j nd a β a
1085_napebackofneck		a t u a + kʷ a ɾ a	a j u ɾ u p ɨ
1090_nearnearby	a m u ts e w e	a m u s ɪ w a	i p ɨ p e
1092_neck	j + a tʃ u k a	j + a ʃ u k a	a j u ɾ a
1093_necklace		k a s u ɾ u	mb o ʔ ɨ ɾ a
1098_nephew		m ɪ m ɨ ɾ ɨ a	
1105_new		ɨ p ɨ s a s u	p ɨ s a s u
1107_niece		m ɪ m ɨ ɾ a k u n i a	
1112_nightevening	ɨ + p ɨ ts a	ɨ + p ɨ s a	p u t u n a
1113_no		ɾ u á	a ʔ a n a ɴ á i
1119_none	ts a p u	j u s u k a	k a n i nd é
1120_nose	t i	t i i	t ĩ
1121_nothing			a ʔ a n a ɴ á i
1122_now	a j p u k a	ɪ k u m ɪ	a ŋ a
1124_obeytrans	ts a p j a ɾ i	s a p i a ɾ i	s a p j a ɾ a
1132_old	t u a	w i h u	u m u a n a
1133_oldman	w i ʃ u		t ú j β a ʔ e
1134_oldwoman	n a j		gʷ a j β ĩ
1141_one	w e p e	w i p i	a m ó
1145_open	e + p e k a	ɪ + p ɪ k a	j a β a
1147_opentrans	e p e k a t a	ɪ p ɪ k a k a	a β a
1149_ordercommand	w a n a k a ɾ i	w a n a k a ɾ i	pʷ a j a
114_bedirty	k u ɾ e ɾ e		
1153_other	a m w a	a m u a	a é
1157_ownerbossmaster	j a ɾ a	j a ɾ a	j a ɾ a
1160_paddleintr		j a + p u k u i	p u k u j a
1161_paddlen	j a + p u k i t a	j a + p u k u i t a	p u k u j t a β a
1164_paintintrtrans	k w a t j a ɾ a		kʷ a t i a ɾ a
1173_parakeetsp	a k a n a		t u ʔ í
1177_parrotsp			p a ɾ a g u á
1179_pass	u + k w a + t a		p i k a
1181_passtrans		u + k u a	kʷ a β a
1183_passionfruit		m a ɾ a k u j a	m u ɾ u k u j á
1188_pathroad	p e	p ɪ ɪ	p é
1189_patioporch	u k a ɾ a	u k a ɾ a	
1190_peanut	m u n i	m u n u i	m a nd u β i
1191_peeltrans	p i ɾ u k a	p i ɾ u k a	a p e o k a
1194_penis	ɾ a k u j	w i ɾ a	a kʷ ã j a
1198_personhuman	a w a	a w a	a β á
1200_pestle	t a k a ɾ i	t a k a ɾ i	u ɴ u ʔ à o β a j a ɾ a
1202_piece			a s ɨ k a
1205_piercetrans		j a t ɨ k a	k u t u k a
1208_pineapple	n a n a	n a n a	n a n á
1209_piranha	i + p i ɾ i	i + p i ɾ a i	p i ɾ ã j a
1215_planttrans	j a + t ɨ m a	j a + t ɨ m a	t ɨ m a
1221_playintrtrans	j u m u ts a ɾ i + k a	j u m i s a ɾ i + k a	ɲ e m o s a ɾ a j a
1230_poison	ts u ɾ i m a	s u ɾ ɪ m a	p o s a ŋg i gʷ a β a
1231_poor		p a ɾ i a s u	p o ɾ e a u s u β a
1232_port		j a m i a ɾ a	p e a s a β a
1233_pot	j u k u tʃ i	u w a j u	
1246_promise			k u a β e ʔ e ŋ a
1252_prowbow			t ĩ
1257_pulltrans	ɨ ɾ ɨ ɾ ɨ t a	a u t a t a	s e k ɨ j a
125_befull	t i m i ts a m a		
1262_pulp			a p u t u ʔ u m a
1263_pushtrans		j u + m i a n a	m o a ɲ a n a
1264_putditr	j a + n u k a	j a + n u k a + t a	m o ʔ í n a
1270_question	p i j a t a		p o ɾ a nd u β a
1273_quietcalm	tʃ i n t a	tʃ i n a n i	k ɨ ɾ i ɾ ĩ
1274_rain		a m a n a	a m a n a
1276_rainvintr	a m a n a	a m a n a + u + w + a ɾ i	k ɨ ɾ a
1280_reachtrans			j e e k o s u β a
1284_red	p ɨ t a n i	p ɨ t a n i	p i ɾ a ŋ a
1289_remembertrans	i k w a k a	j a ɴ kʷ a ɾ a ɾ a	m a e nd u ʔ a ɾ a
1294_respondtrans	ts a w i t i	s a w i t i	é
1295_restintr	j a + p ɨ t u	j a + p ɨ t u + k a	p u t u ʔ ú
1296_return			β é
1297_returnintr	i ɾ i w a	ɪ ɾ ɪ w a	j e β ɨ ɾ a
12_after	ɾ a e p e ts u j	i s a k a p ɨ ɾ ɨ	ɾ o i ɾ é
1300_rib		j a ɾ a k a n + u a ɾ a	a ɾ u k a ŋ a
1306_rightnow	i k u m e n a n		k o ĩ
1307_rigid			a t ã
1309_ripe	p ɨ t a n i	p ɨ t a n i	p u β a
130_beheavy	i p u tʃ i		β o s ɨ j a
1311_river	p a ɾ a n a	p a ɾ a n a	t ɨ
1313_roasttrans	m i tʃ i ɾ a	ɨ j ɨ w ɨ t a	e s ɨ ɾ a
1320_rollwrap			pʷ a ɾ a
1321_root	ts + a p w a	s + a p u a	a p ó
1322_rope	p u w a ts a	p u a s a	i n i mb ó
1324_rotten		p a ɴ	j u k a
1325_rough			a ì β u s u
1326_round	j + a p w a	j + a p u a	a j e ɾ e β a
1328_rubtrans		s u m a k a	p i ʃ ɨ β a
1330_runintr	j + a p a n a	j + a p a n a	a pʷ a n a
1333_saliva	j u ɾ u + t ɨ a	j u ɾ u + t ɨ a	e nd ɨ
1334_salt	t e w e	t ɪ w ɪ	j u k ɨ ɾ a
1337_sand	i t i n i	i t i n i	ɨ β ɨ + k u j
1338_sandfly		m a ɾ i w i	m a ɾ i gʷ í
1340_sapresin	k a j	k a i	ɨ s ɨ k a
1342_save			n o ɴ a t u
1343_saytrans	k u m i ts a	k u m ɪ s a	é
1347_scaretrans	a k ɨ tʃ a t a	ɨ s ɨ i t a	m o nd ɨ j a
1349_scrapescratchtrans	k a ɾ i	k a ɾ a i	k a ɾ ã j a
1353_seeintrtrans		u + m a i	e p j a k a
1354_seed	ts + a + j	s + a + i	á
1359_sewtrans	j u	j u	m o β ɨ β ɨ k a
1360_shadowshade			a ŋ a
1362_shakeintr			k o ɾ i
1363_shakeintrtrans		s a + ɾ a k a t a	m o + a gʷ ɨ a gʷ ɨ
1370_sharp		s a i m ɪ	s a e mb e ʔ é
1371_sharpentrans	ts a j m e k a		a e mb e ʔ é
1373_sharpentrans		s a i m ɪ k a	
1375_shell			a j a p é
1379_shine	p e ɾ a + t a	p ɪ ɾ a + t a	
1384_shoottrans		a j u a	ɨ β õ
1387_shorebank	ts + ɨ m a	s + ɨ m a	ɨ ɾ e mb e ɨ β a
1388_short	t u ɾ u	j a t u ɾ u	a p o ʔ a ĩ
1389_shoulder	ɨ k a	j u w a p ɨ k a	a t i ʔ ɨ β a
1391_shoutyellintr	ts a ts a ts ɨ m a	s a s ɨ m a	s a s e m a
1397_sick		a i k u a	m a ɾ a a ɾ a
1399_side	k a k u ɾ a	k a k u ɾ a	o j o ɨ β ɨ́ ɾ i
13_afternoon	k a ɾ u k a	k a ɾ u k a	k a ɾ u k a
1400_sievestrainer	k u m a t a	k u m a t a	u ɾ u p e m a
1403_similar	a ʃ a m i a		a p i ʃ a ɾ a
1406_singintr	i k a ɾ a	i k a ɾ a	ɲ e ʔ e ŋ a ɾ a
1407_sinkintr	j + a p a ɾ a ɾ i	j a + p ɨ m a	
1408_sister		i m u a	
1410_sistermaleego	k u n j a		e nd ɨ ɾ a
1411_sisterinlaw		m i ɾ i k ɨ a	
1420_sitintr	j + a p ɨ k a	j + a p ɨ k a	gʷ a p ɨ k a
1421_skin	p i ɾ w a ɾ a	p i ɾ u a ɾ a	a j a p é
1425_skinnythin	k u j a n a	k u j a n a	a ɴ a í β a
1426_sky	k w a ɾ a tʃ i	kʷ a ɾ a ʃ i	ɨ β a k a
1427_sleepintr	u + k ɨ ɾ ɨ	u + k ɨ ɾ ɨ	k e ɾ a
1429_slipintr		s ɨ ɾ ɨ ɾ ɨ t a	p ɨ í ɾ a
1432_sloth		a ɨ	a ʔ ɨ
1434_slow	j a n u k i	j a n ɨ k ɨ i	mb e gʷ é
1437_small		tʃ u n a n i	a ʔ ɨ ɾ ĩ
1444_smelltrans	ts e t u n i		s e t u n a
1447_smoken	t a t a t i n i	t a t a t i n i	t a t a t i ŋ a
1450_smokefood	m e + m u k i	m ɪ m u k a t a	m o t i mb o ɾ a
1454_smooth		ɨ + s ɨ m a	a + s ɨ m a
1456_snake		m u i	mb o j a
145_beodorousfragrantintr		ʃ a p u n i	t ɨ a pʷ a n a
1469_some		a w ɨ ɾ ɨ k a	a mb o a é
1473_son		m ɪ m ɨ ɾ a	t a ʔ ɨ ɾ a
1476_soninlaw	i tʃ i m a ɾ i	i ʃ i m a ɾ i	
1479_soon	i k u m e n a n		k o ɾ i
147_bepregnantintr	m e m ɨ ɾ a ɾ i	m ɪ m ɨ ɾ a j a ɾ a	p u ɾ u ʔ á
1482_sour		s a i	a j a
1483_spaguajemauritiaflexuosa	m ɨ ɾ ɨ t i	m ɨ ɾ ɨ t i	
1485_speakutterwordsintrans	k u m i ts a	k u m ɪ s a	m o ʔ í n a + ɲ e ʔ e ŋ a
1486_speakclear	j u m a t a		
1487_spear	ɨ w ɨ ɾ a ts u	ɨ w ɨ ɾ a w a s u	i t a m i n a
1492_spicy	t a j	t a i	
1494_spider	j a n u	j a n u	ɲ a nd u ĩ
1495_spidermonkey	k u w a t a	kʷ a t a	
1496_spillpour	i tʃ i n i	i ʃ i n i	e n a
1498_spinthreadtrans	i p a n i		p o β a n a
14_again		u + j a w ɨ ɾ ɨ	β é
1500_spiritsoul	m a j ts a n k a ɾ a	a w a ɾ a	a ŋ a
1501_spitintr		j u ɾ u t ɨ a	m u n a
1503_splittrans		p ɪ s ɪ + k a k a	a s ɨ a β a
1505_splitintopiecestrans			p e s ẽ a ɾ a
1506_splitopentrans			m o β o k a
1515_squeezetrans	k i p e t a	k ɪ p ɪ t a	a m ĩ
1522_standstandupintr	i + p a m a	i + p a m a	β ɨ ɾ a
1523_star	ts e ts u	s ɪ s u	j a s ɨ t a t á
1526_stayintr	t u p a p e	j a + p ɨ t a	p ɨ t á
1528_stealtrans	m u n a	m u n a	m o nd á
152_besadintr	j a m ɨ m a	j a m ɨ m ɨ a	a ɾ u ɾ u
1530_stemstalk			ɨ β a
1535_stick			ɨ β ɨ ɾ á
1539_stomach	ts e w e k a	s ɪ w ɪ k a	
1540_stonerock	i t a k i	i t a	i t á
1541_stop	j a p ɨ t u		p o o k a
1543_stopintrtrans	i p a m a	i p a m a	p e ʔ á
1544_story	ɨ m ɨ n ts a ɾ a	k u m ɪ s a t a	
1545_straight	j u m a t a		a t ã ɲ é
1547_straintrans	j u + m u + k a	j u + m u + k u a	m o gʷ a β a
1549_stream	ɨ j a k u	ɨ a k u a	ɨ e k o a β a
1552_stretch			m o a t ã
1554_strong		w ɨ k a	a t ã
1558_sucktrans	tʃ u tʃ u	s u s u	p ɨ t e ɾ a
1559_suffer	p a ɾ j a ts u	s u + s a n a	ɾ o o + s a ɴ a
1560_sugarcane	u w a k ɨ ɾ a	u w a k ɨ ɾ a	t a kʷ a ɾ e ʔ ẽ
1563_sun	k w a ɾ a tʃ i	kʷ a ɾ a ʃ i	a ɾ a
1564_swallowintrtrans	j u + m u k u n i	j u + m u k u n i	m o k o ɴ a
1566_sweatintr	ts ɨ j i	s ɨ̃ i	s ɨ ʔ a j a
1569_sweepintrtrans	t i + p i ɾ i	t i + p a i ɾ i	p e í ɾ a
1570_sweet	ts e	s ɪ ɪ	
1571_sweetpotato	i t i k a	i t i k a	j e t ɨ k a
1572_swellintr	i + ɾ u ɾ u	ɪ + ɾ u ɾ u	
1577_swimintr	ɨ j a t a	ɨ a t a	ɨ t a β a
1579_tail	ts + u w i	s + ũ i	u a j a
1580_takealongtrans	e + ɾ u k w a	ɪ + ɾ u s u	ɾ a s ó
1584_takeoutremovetrans	u tʃ i m a t a	u ʃ i m a t a	o k a
1589_tamboshelter	t e j u p a	t a p ɨ	e ɨ j u p a β a
1590_tapir		t a p i ɾ a	t a p i ʔ í ɾ a
1593_tasty	tʃ a p u n i		é
1597_teethtooth	ts + a j	s + a i	ã j a
1598_tellastorytrans		k u m ɪ s a t a	m o mb e ʔ ú
15_agouti		a k u t i	a k u t i
1600_termite	k u p e a	k u p i a	k u p i ʔ í
1601_testicles	ts + a p j a	s + a p i a	a p i ʔ á
1603_thick	j a n a m a	n u a j a ʃ i	k u a gʷ a s u
1607_thigh	ts + u t ɨ m a	s + ɪ t ɨ m a	u β a
160_bestinkysmellbadintr	t ɨ w ɨ t i	t ɨ w ɨ t i	
1611_thing	m a ɾ i	m a ɾ a i	m a ɾ ã
1613_thinkintrtrans	i j a ɾ a	j a ɴ kʷ a ɾ a ɾ a	gʷ a s e m a
1617_thorn	j u w a	j u a	j u
1618_thread	i n i m u	i n i m u	i n i mb ó
1620_three	m u ts a p ɨ ɾ ɨ k a	m u s a p ɨ ɾ ɨ k a	m o s a p ɨ t
1622_throat	j a tʃ u k a k w a ɾ a	u ɾ u ɾ u	a s e o k a
1624_throwthrowawaytrans	i t i k a	a t i k a	i t ɨ k a
1625_thunder	t u p a	t u p a	a m ã s u n u ŋ a
1627_tick		p ɪ ɾ a t a	j a t e β u k a
1630_tietrans	t ɨ k ɨ t a	t ɨ k ɨ t a	a p ɨ t ĩ
1635_tired		u kʷ a ɾ i	p i t u β a ɾ a
1636_tissueoftheposteriorsuperiorpartofthethigh			a n a gʷ ɨ k ɨ t i ɴ a
1651_today	i k u n	ɪ k u m ɪ	o j e í
1654_toe	p ɨ t a + t a ɨ ɾ a	p ɨ t a	p ɨ s ã
1656_together			m e m é
1657_tomorrow	k a m u t u + n i	k a m u t u + n i	o i ɾ ã
1658_tongue	k u + m ɨ ɾ a	k u + m ɨ ɾ a	a p e + k ũ
165_bethirstyintr	a n a t i	ɪ j u s ɪ	u s e j a
1660_touch			m o nd ó
1661_touchtrans	k a m a t a	k a m a t a	a t õ j a
1665_tree		ɨ w ɨ ɾ a	ɨ β ɨ ɾ á
1672_trunk	ɨ w a	ɨ w a	o p ɨ t á
1677_turnintrtrans		ɪ ɾ ɪ w a + k a	β a β a k a
1678_turnoffextinguish			m o m e m u ã
1684_turtletortoise		p u k a	j u ɾ u k u gʷ á
1685_turtletortoisesp			u n u a n ã
1687_twistintrtrans		p ɨ ɾ ɨ ɾ ɨ t a	a p a ɾ a
1690_two	m u k u j + k a	m u k u i + k a	m o k õ j
1692_typeofbasket	ts + a p a ɾ u		
1698_ugly		a i s ɪ	p o ʃ ɨ
1699_uncle		p a p a k ɨ ɾ a	i ʔ ɨ ɾ a
1703_unripe	ɨ k ɨ ɾ a	ʃ u ɾ a	k ɨ ɾ a
1704_untietrans		j u + ɾ a w a	ɾ a β a
1706_urinateintr	k w a ɾ u k a	kʷ a ɾ u k a	k a ɾ u k a
1711_vagina	p i ʃ a	p i ʃ a + kʷ a ɾ a	t a m a t i ʔ á
1715_veinartery	ts + a j k a	s + a j ɨ k a	a j ɨ k a
1718_village	ɾ i t a m a	ɾ i t a m a	t a β a
1719_vine	i tʃ i p u	i ʃ i p u	ɨ s ɨ p ó
1721_vomitintr	u + w e n e	w ɪ n a	gʷ e ʔ e n a
1723_vulture		u ɾ u p u	u ɾ u β u
1724_vulva		p i ʃ a	
1725_wakeupintr	u + p a k a	u + p a k a	p a k a
1726_walkintr	u + w a t a	u + w a t a	gʷ a t á
1728_wallfence	j u t a	j u t a	
1730_want	i j a ɾ a	s ɪ + t a	
1731_wanttrans	ts e + t a		p o t a ɾ a
1732_wantlikelove		s a ʃ i t a	
1736_washtrans	ts u k u t a	s u k u t a	e j a
1739_wasp	k a w a	k a w a	k a β a
1740_water	u n i	u n i	t ɨ
1741_weakfeeble		k a n i ú	m e mb e k a
1743_weave	j u + p i	j u + p ɪ	p e m a
1749_wet		t ɨ a	a k ɨ m a
1750_wetdampentrans	t ɨ j a t a	t ɨ a t a	a m õ
1758_white		t i n i	m o ɾ o t i ŋ a
1759_whitepersonnonindian		m a i	k a ɾ a j β a
175_bewith			ɾ e k ó
1761_whitelippedpeccarytayassupecari	t a j a ts u	t a j a s u	t a j a s u
1763_wide		ɪ + p ɪ w a s u	p ɨ gʷ a s u
1764_wife	m i ɾ i k w a	m i ɾ i k u a	a t ɨ
1766_wind	ɨ w ɨ t u	ɨ w ɨ t u	ɨ β ɨ t u
1771_wing	p e p u	p ɪ p u	p e p ó
1773_witchshamanhealer	p a j u + n	m u s a n a k a s u ɾ i	p a j
1774_woman	w a j n a	w a i n ú	k u ɲ ã
1778_workintr		k a m a t a	t e k ó + m a ɾ ã
1779_workn	k a m a t a	k a m a t a m a i	m a ɾ a t e k ó
1784_wound	j a w		j u ɾ u j a β a
1788_wraptrans	a n a ɾ u k a	j + u a n a	k u a m a n a
1793_yawnintr		ɪ p ɪ k a t a + j u ɾ u	j e j u ɾ u p i ɾ a ɾ a
1794_year	w a t a	w a t a	a k a j u
1795_yellow	i + j u	i + j u	j u β a
1796_yes			a j é
179_beach	i t i n i	i t i n i	ɨ e mb i j e j a
1801_yesterday	i k w a tʃ i	i kʷ a ʃ i	kʷ e i s é
1802_youngman	k u n u m i	k u n u m i	k u n u m ĩ gʷ a s u
1803_youngwoman	k u n j a t i	k u n i a t a i	k u ɲ ã m u k u
181_beak	ts a j	s a i	t ĩ
182_beardmoustachefacialhair	m u t a	m u t a	
184_beathittrans	i n u p a	a + j u k a	n u p ã
18_ajipepper		ɨ k ɨ i	ɲ a nd ɨ
193_bed			k e s a β a
197_bee		k a w i	e i ɾ u β a
198_before	a n a n	a i ɾ a ʃ i	ɾ a ɲ é
199_beginvtranscomp	j u p u n i	j u p u n i	ɨ p ɨ ɾ u ɴ a
200_beginning			ɨ p ɨ
206_believetranscomp		s a p i a ɾ i	ɾ o β i a ɾ a
207_belly	ts e w e k a	s ɪ w ɪ k a	a k a p é
209_bellybutton	m ɨ ɾ w a	m ɨ ɾ u a	p u ɾ u ʔ ã
20_all	u p i	u p a	m e m é
213_benttwisted		j + a p a ɾ a	a p a ɾ a
216_bigandthick			u ɾ u s u
217_biglarge	n u a	n u a	u β i ʃ a β a
221_bird		w ɨ ɾ a	gʷ ɨ ɾ á
224_bitetrans	k a ɾ u + t a	k a ɾ u + t a	s u ʔ ú
225_bitter		i + ɾ a w a	a k a
227_black	ts + u n i	s + u n i	u n a
22_already	a j	a w i	é + ɲ é
230_blind	tʃ ɨ tʃ ɨ m a	s i s a ɨ m a	
231_blood	ts + u w ɨ	s + u ɨ	u gʷ ɨ
233_blowtrans	ts a p u	ɪ + p ɪ u	p e j u
23_also		a j a ɴ p a i	n o
241_boiltrans	a + p a p u ɾ i	a + p u p u ɾ i	m o p u p u ɾ a
242_bone	k a n w a ɾ a	k a n u a ɾ a	k a ŋ a
244_borrow	ɨ p ɨ ɾ u	ɨ p ɨ ɾ u	p o ɾ u
247_bow	k a n u t i	k a n u t i	gʷ ɨ ɾ a p a ɾ a
248_boymalechild	ɨ k ɨ ɾ a ts e n		k u n u m ĩ
249_brain	a p e t ú m a	a p ɪ t u m a	a p u t u ʔ u m a
250_branch	ts + a k a m ɨ	s + a k a m a	a k ã
257_breaktrans	ts a k a ɾ i	a j u k a	j u k á
262_breast	k a m a	k a m a	k a m a
266_breatheintr		s ɪ k ɨ i + ĩ j a	p ɨ t u
269_bringtrans	e + ɾ u ɾ a	ɪ + ɾ u ɾ a	ɾ u ɾ a
26_always			j e p i
273_broom	t i p i ts a	t i p a i s a	
275_brother		i m u a	
276_brotherfemaleego	k i w i		k ɨ β ɨ ɾ a
280_brotherinlaw		a j u m a	
288_bubblev			β u β u ɾ a
294_burn	u + k i	u + k a i	a p ɨ
297_burstbreakopen	u + p u k a	u + p u k a	p o k a
298_burytrans	j a + t ɨ m a	j a + t ɨ m a	a t ɨ β a
299_butterfly	p a n a m a	p a n a m a	p a n a m a
29_angrymadbeangryintr	j u m ɨ ɾ a	j u m ɨ ɾ a	j e a s e j a
300_buttocks	tʃ + i + k w a ɾ a + ts u	p u n i	e mb ɨ k a j a p é
302_caiman	j a k a ɾ i	j a k a ɾ i	j a k a ɾ é
304_calltrans	ts a p u k i	s a p u k u i	e n õ j a
307_canoe	ɨ ɾ a ɾ a	ɨ a ɾ a	ɨ g a ɾ a
309_capturetrans	j a p i tʃ i k a		m o m i a u s u β a
30_animal			mb a ʔ é
312_carrytrans		w a k u t a	m o β o s ɨ j a
319_caterpillarsp	m e ɾ a		p u ɾ u k e ɾ é
31_ankle	p ɨ t a + m u tʃ u ɾ i	t u t u n a	p ɨ ɲ u ã k a ŋ a
323_centipede	m a t a ɾ u	m a t a ɾ u	a mb u ʔ á
328_chacrafarm	k u		ɨ β a p a ʔ a ɾ a
335_cheek	k a k u	k a k u	a t ɨ p ɨ
336_chest		p u t i a	p o t i ʔ á
340_chiefleader	a p u	k u ɾ a k a	m o ɾ e ɾ e k o a ɾ a
344_child		w a w a ɴ k ɨ ɾ a	p i t a ŋ a
345_chin			a j ɨ β a
347_cicada	j a k ɨ ɾ a n a	j a k ɨ ɾ a n a	j a k ɨ ɾ a n a
352_clean			k a t u
355_cleanvtrans		t i u t a	s ɨ β a
358_climbtrans	w a ɾ i k a	w a ɾ i k a	j e u p i ɾ a
35_antsp	t a ɾ a p e n a	s a ɾ a s a ɾ a	t a s ɨ β a
363_cloth		j a n u k a t a m a i	a o β a
364_clothes	tʃ i ɾ u	ʃ i ɾ u	a o β a
365_cloud	ɨ w ɨ t i n i	ɨ w ɨ t i n i	a m a n a
367_cockroach	a ɾ a w i	a ɾ a w ɪ	a ɾ a β é
368_cold	ts ɨ ɾ i	s ɨ ɾ a i	ɾ o ʔ ɨ
369_collaredpeccarypecaritajacu		t a i t a t u	t a j t e t u
373_comeintr	u ɾ i	u ɾ i	u ɾ a
374_companion	i ɾ w a	ɪ ɾ u a	i ɾ ũ
377_conservedwellkept			k a t u
380_conversetrans		k u m ɪ s a k a	m o ŋg e t á
383_cookintrtrans		a p u p u ɾ i	m o a p ɨ k a
387_copulatehavesexwith	m e n u + k a	m ɪ n u + k a	m e n õ
389_corn	a w a t i	a w a t i	a β a t i
38_anteater		s a s ɨ w a w a ɾ a	t a m a nd u á
393_cotton	a m a n j u	a m a n i ú	a m a n i j u
396_coughintr	m a k a n u ɾ i	m a k a n u ɾ i	
397_cousinfemale		i m u a	
398_cousinmale		i m u a	i ʔ ɨ ɾ a
39_anus	tʃ + i k a + k u a ɾ a	ʃ + i + kʷ a ɾ a	e i + kʷ a ɾ a
400_cousinmalefemaleego	k i w i		k ɨ β ɨ ɾ a
401_covertrans	j + a ts e	j + a s a i	a s o ʔ í
404_cricket	tʃ i ɾ i ɾ i	ʃ i ɾ i ɾ i	gʷ ɨ j u
405_cricketsp	a n a w a j u		
406_crockearthenware	m a w t a	m a u t a	k a m u s i
409_crossgoacross	ts a ts a w a	s a s a w a	s a s a β a
411_cryintr	j a tʃ u	j a ʃ u a	e s a ɨ
413_cultivatetrans	k u p e	k u p ɪ	k o p i ɾ a
417_curemedicine	m u ts a n a	m u s a n a	p o s a ŋ a
41_appearintr	k a t u p e	k a k a t u p ɪ	j e kʷ a β a
420_cut	ts a k ɨ t a		a β a
429_cutcutdownfelltreetrans		ɨ p ɨ k a	a s ɨ a β a
430_cutbankcliffbluff	ɨ w a m a	ɨ w a m a	ɨ β ɨ ʔ a m a
433_danceintr	j a + p u ɾ a tʃ i	j a + p u ɾ a ʃ i	
435_dancen	ɾ a ts a n t i		p o ɾ a s e j a
437_dark		t a m i a	p u t u m a
439_daughter		m ɪ m ɨ ɾ a k u n i a	t a j ɨ ɾ a
43_arm	j ɨ w a	j ɨ w a	j ɨ β á
442_daughterinlaw	j u w a m a	j u a m a	
445_dawn	k a n a t a	kʷ ɪ m a	k a ʔ a m u t u
447_day	k u a ʃ i	kʷ a ɾ a ʃ i	a ɾ a
448_deaf	u p a t u	u p a	a p ɨ s à e ɨ m a
451_deep	t ɨ p ɨ	t ɨ p ɨ	t ɨ p ɨ
452_deer		ɨ s ɨ w a s u	s u gʷ a s u
454_defecateintr	k a p e	k a p i	k a ʔ a β a
45_armadillo		t a t u	t a t u
460_destroy			m o k a ɲ e m a
463_dieintr	u + m a n u	u + m a n u	j e k ɨ j a
466_digtrans	tʃ i w i k i	ʃ u k a i	s ɨ β ɨ k o j a
470_dirt	t u j u k a	t u j u k a	k ɨ ʔ á
472_dirty	tʃ a ɾ u	ɨ k ɨ a	k ɨ ʔ á
474_disappearintr	u k a j m a	u k a j ɨ m a	k a ɲ e m a
485_divideseparate	u p e n a		j a ʔ ó k a
486_dotrans		i + p u ɾ a k a	m o ɲ a ɴ a
492_dog	j a w a ɾ a		j a gʷ a ɾ a
494_domesticatedanimalpet	m ɨ m a	m ɨ m a	e m i mb a β a
495_door	j + a k i n a	j + a k i n a	o k e n a
496_drag	ɨ ɾ a ɾ a k i		
500_drinkintrtrans	k u ɾ a t a	k u ɾ a t a	ú
502_dripintr	a + t ɨ k ɨ ɾ ɨ	t u p i t a	
506_drunk	ts a j p u ɾ a	s a i p u ɾ a	s a β e ɨ p o ɾ a
507_dry	i + k a n a	i + k a n a	a k u ʔ í
510_dryintrtrans		i k a n a t a	m o a k u ʔ í
518_dust		k u i	t i mb o ɾ a
51_arriveintr	j a + w a tʃ i m a	j a + u ʃ i m a	gʷ a s e m a
521_ear		n a m i	a p ɨ s á
524_earthworm	ts ɨ w ɨ i	s ɨ w ɨ i	
526_eatintrtrans	e j + u	ɪ + u	mb a e ʔ ú
529_egg	ts + u p j a	s + u p i a	u p i ʔ á
52_arrow	u w a	u w a	u ʔ ú β a
530_elbow	j ɨ w a + m u tʃ u ɾ i		u ɴ á
533_embracehugtrans	j u + k u k a	j u + k u k a	a ɲ u β a n a
535_emitnoisesound	i + p u	i + p u	p u
541_enemy	ts + a w a j a l a	s + a w a j a ɾ a	o β a j a ɾ a
543_enterintr	a k i	a k i	
545_escapeintr	u ts w e p e	u s u ɪ p ɪ	k a ɲ e m a
552_excrement	t e + p u t i	t ɪ + p u t i	
553_excrementfeces			k a ʔ a β a
556_exterior			a j a p é
557_eye	ts + i ts a + ts + i	s + i s a + s + a + i	
55_ashes	t a n i m u k a	t a n i m u k a	t a n i mb u k a
560_eyebrow	ts a p ɨ k a	s i s a + s + a w a	t ɨ β ɨ t a β a
562_face	ts + i ts a	s + i s a	e t o β a p é
567_fallfromaheightintr	u + k u + k i	u + k u + k u i	k u j a
568_fallintowater	u + p u ɾ i	u + p u ɾ i	
569_falloverfalldownintr		u + w + a ɾ i	a p a k u j a
572_fan	m a ɾ a w e	w a u t a	gʷ ɨ ɾ ɨ ɾ ɨ m a
573_far	a m u ts e	a m u s ɪ	a m õ
576_fast	i p u ɾ a p a n i	i p u ɾ a p a n i	k o ɾ i t e ĩ
577_fat		ɨ k ɨ ɾ ɨ + w a s u	k ɨ ɾ á
578_fatlard	i k a w a	i k a w a	k a β a
579_father	p a p a	p a p a	u β a
582_fatherinlaw	t u t ɨ ɾ a	t u t i	
585_fearnbescaredv	a + k ɨ tʃ a	a + k s ɨ a	k ɨ s ɨ j é
587_feather	ts + a	s + a w a	a β a
590_feedofferfoodtrans	ts e m u t a	s ɪ m u t a	m o ɴ a ɾ u
59_askforrequest			m o ŋg e t á
601_fewalittle	a j ts e w a n a n	m i m i + k a t u	m o k o ɲ ó
602_fiberthread			p ó
603_fibrous			j ɨ k a
607_fighttrans	a j u k a k a	a j u k a k a	m a ɾ a m o ɲ a ɴ a
610_filltrans		t i m i s a m a t a	m o p o ɾ a
612_find	p u ɾ a ɾ a	p u ɾ a ɾ a	
614_finger		p u a	pʷ ã
617_fingernail	p ɨ ts a p e	p ɨ s a p i	p o a p ẽ
618_finishtrans	u + tʃ i k a	u + p a + t a	
622_fire	t a t a		t a t á
623_firefly		m a i s i s a k w a ɾ a	m a m u ã
626_firewood	i p j a	ɪ p ɪ a	
627_first	ɨ j a t i ɾ a	ɨ a n t i ɾ a	e n o nd e s u a ɾ a
629_fish	i + p i ɾ a	i + p i ɾ a	p i ɾ á
630_fishtrans	i p i ɾ a j a ɾ a	s ɪ k ɨ i	s e k ɨ j a
631_fishhook	m a n i n p j a ɾ a	m a n i p i a ɾ a	p i nd á
632_fishpoison		t i m u	t i mb ó
634_fishscales	p i ɾ w a ɾ a		p é
635_fishsp	w a k u p a		m a nd i ʔ í
63_attachadherestickto	u + j a ɾ i	u + j a ɾ i	j a ɾ a
642_fishwithfishpoison	t i n j a ɾ i		t i ŋg ɨ j a ɾ a
646_fish		a k a ɾ a	
648_fishingnet		p ɨ s a	p ɨ s á
650_five	p i tʃ k a	p i tʃ k a	a mb ó
653_flamevshineasingivingofflight		s ɪ n ɪ	s e nd ɨ
659_float	a ɾ ɨ w i	p u t u	β e β u j a
662_flourmaniocflour		u i	u ʔ í
665_flower	ts e ts a	s ɪ s a	p o t ɨ ɾ a
667_flute		t i a m a	m i mb ɨ
668_fly		m ɪ ɾ u	mb e ɾ u
669_flyintr	u + w e	u + w ɪ w ɪ	β e β é
670_flysp			mb e ɾ u ã i a
672_fog	ɨ w ɨ t i n i		ɨ β ɨ t i ŋ a
673_followtrans	tʃ i k w a ɾ a t a	ʃ i kʷ a ɾ a t a	
676_food	e j u n	ɪ u m a i	e mb i ʔ ú
677_foot	p ɨ t a	p ɨ t a	p ɨ
680_forestjungle	ɨ w ɨ ɾ a t i	ɨ w a t a	k a ʔ á
683_forgettrans	ts i ts a ɾ i	s ɨ s a ɾ a i	s e s a ɾ a j a
684_four	i ɾ w + a k a	ɪ ɾ u + a k a	i ɾ u + nd ɨ k
688_friend	i ɾ w a		a u s u p a ɾ a
68_aunt	m a m a k ɨ ɾ a	m a m a k ɨ ɾ a	s ɨ ʔ ɨ ɾ a
693_frogtoad		k u ɾ u ɾ u	k u ɾ u ɾ u
694_frogtoadsp			gʷ a ɾ a ɾ ɨ e ɨ
698_fruit	i j a	i a	á
69_awaittrans	k a w k i	s a ɾ a	s a ɾ õ
6_achiote		ɾ u k u	u ɾ u k u
701_frytrans	ts ɨ ɨ t a	s ɨ t a	m o s ɨ ɾ ɨ k a
704_full		i t a ɾ u	p u ɴ á
70_axe	j ɨ	j ɨ ɨ	j ɨ
713_gatherharvesttrans	i p u	j a t ɨ ɾ ɨ t a	a p u a p ɨ k a
718_getdressedintr		a ɾ i	a o β a
71_back	j + a t u k u p e	j + a t u k u p ɪ	a k u p é
722_getusedtotrans	i + p u k w a	i + p u k u a	p o k u gʷ a β a
726_giveditr	j u + m i	j u + m i	m e ʔ e ŋ a
728_givebirthtotrans		u w a ɾ i t a	mb o ʔ a ɾ a
733_go	u + ts u	u + s u	s ó
734_goimp		i kʷ a n i	e kʷ ã i
736_godownintr	u j e p e	ɨ w ɨ p ɪ	gʷ e j ɨ β a
738_godownriverintr	a + ts ɨ ɾ ɨ k a	a + s ɨ ɾ ɨ k a	
739_goupriverintr	j a j a k a t i	j a j k a t i	
743_godfather		w a k u t a ɾ a	m o ɾ e ɾ o k a ɾ a
744_godmother		w a k u t a ɾ a	m o ɾ e ɾ o k a ɾ a
745_good		ɪ ɾ á	a ɴ a t u ɾ a m a
749_gourdpumpkinsquash		k u j a	ɨ ʔ á
751_grabtrans	j a + p i tʃ i k a	j a + p i ʃ i k a	o k a
755_grandfather	a m w i	a m u i	a m ũ j a
756_grandmother	n a j	ã i	a ɾ ɨ j a
758_grass		k a p i	k a ʔ á
75_bad		a i s ɪ	a í β a
766_grillbarbeque		p a ɾ i	j u ɾ á
767_grillbarbequen			m o k a ʔ ẽ
769_grindtrans	k ɨ ɾ ɨ k a	k ɨ ɾ ɨ k a	
773_groin	t a ɾ a k w a ɾ a	t a ɾ a k u	t a k ó
776_growintrtrans	a j p a	t u a	k a k u gʷ a β a
787_hair	ts + a	j + a k ɨ + s + a	
789_hammock	t u k + i n i	t u kʷ + i n i	i n ĩ
78_badspirit	m a t i		mb a ʔ é
790_hand	p u w a	p u a	p ó
794_happy	ts + a ɾ ɨ w a	s + a ɾ ɨ w a	o ɾ ɨ β a
796_hard		k a ɾ a k a ɾ a	a t ã
800_harden	k a ɾ a k a ɾ a		m o a t ã
804_havetrans		a m i t i	ɾ e k ó
816_head	j + a k ɨ	j + a k ɨ	a k a ŋ a
820_healintrtrans	j u p i t a	m u s a n a k a	
826_heartrans	ts e n u	s ɪ n u	a p ɨ s á
827_heart	i j a	ĩ j a	ɲ ɨ ʔ ã
828_heat	ts a k u		a k u β a
831_heel	p ɨ t a + ts + a p ɨ t a		p ɨ t á
833_helptrans	j u m u j a ɾ i	j u m i a w ɨ ɾ a	p ɨ t ɨ β õ
835_hideintrtrans	j a + m i m i	j a + m i m i	k u a k u β a
836_highupadv	ɨ w a t i	ɨ w a t i	ɨ β a t é
837_hightall		i p u k u	j e ɨ s a p u k u
838_hill	ɨ w a t a	ɨ w a t a	
83_bananasp			p a k o β a
841_hips	ts u m a k a n a		e mb ɨ k a j a p é
843_hole		k a kʷ a ɾ a m a i	kʷ a ɾ a
845_honey	k a w i	m i ʃ k i	e í ɾ a
846_honeybee		m a p a + k a w i	
847_horn	i + j + a k a	i + j + a k a	a k a
848_horsefly	m u t u k a	m u t u k a	m u t u k a
849_hot		s + a k u	a k u β a
851_house	u k a	u k a	o k a
853_howlermonkey		a k ɨ k ɨ	a k ɨ k ɨ
854_howlermonkeysp			gʷ a ɾ i β a
858_hungry	j + a m a tʃ i	j + a m a ʃ i	a mb ɨ a s ɨ
862_hurtbepainful	ts + a tʃ i		mb a ʔ e ɾ a s ɨ
863_hurtwound		s + a ʃ i	a p i
866_husband	m e n a	m ɪ n a	m e n a
868_illuminateshinelighton		k a n ɨ ɾ a t a	e s a p é
86_bark		p i ɾ u a ɾ a	a j a p é
876_indian			a β á
