Cognate_ID	Kokama	Omagua	Tupinamba
882_intestinesguts	t i p i ʃ i ɾ u	t ɪ p u t i ʃ i ɾ u	ɲ ɨ ʔ ã
884_invitetrans	p a ɾ i ts a ɾ a	p a ɾ i s a ɾ a	s o ʔ ó
888_island	ɨ p w a	ɨ p a u	ɨ p a ʔ ũ
891_jaguar	a ɨ m a n t a	j a w a ɾ a + w a s u	j a gʷ a ɾ a
892_jaw	ts + a j w a	s + a j ɨ w a	
894_joinputtogetherattachtrans	j + a t ɨ ɾ ɨ	j + a t ɨ ɾ ɨ	j e s e ʔ a ɾ a
895_jumpintr	k a ɾ ɨ t a	k a ɾ ɨ t a	p o ɾ a
89_basket		s + a p a ɾ u	u ɾ u
900_killtrans	u m a n u t a	u m a n u t a	j u k á
905_knee	ts + e n e p j a	s + ɪ n u p u a	e nd ɨ p ɨ ʔ ã
907_knife	k ɨ tʃ i k ɨ ɾ a	k ɨ ʃ i	k ɨ s é
913_knowtrans	i + k u a	i + k u a	k u gʷ a β a
916_lake	ɨ p a ts u	ɨ p a s u	u p a β a
917_landgroundearth	t u j u k a	t u j u k a	a u p a β a
91_bat	a n ɨ ɾ a	a n ɨ ɾ a	a nd ɨ ɾ á
921_larvamaggotgrub	u ɾ a	m u t u t u	s a s o k a
922_larvamaggotgrubsp	m u t u t u		t a p u ɾ u
926_latelyrecently	a j p u k a		ɾ a m ó
929_laughintr	a + p u k a	a + p u k a	p u k á
92_batheintr	j a ts u k a	j a s u k a	j a s u k a
932_lazy		m a p ɨ ɾ ɨ	a t e ʔ ɨ m a
934_leaf	ts a	s a w a	k a ʔ á
936_leavetrans	i + tʃ a ɾ i	i + ʃ a ɾ i	s e j a ɾ a
937_leavefromintr	u + tʃ i m a	u + ʃ i m a	p o í ɾ a
941_leg			k u p ɨ
948_lieonasurfaceintr		j + a p a ɾ a ɾ i	j e p ɨ s ó
950_lietodeceivetrans	ɨ ɾ a	w i ʃ a n i k a	e m o ʔ e m a
952_lifttrans	ɨ w a t i + t a	ɨ w a t i + t a	m o p u ʔ a m a
955_lightv		s ɪ n ɪ t a	m o e nd ɨ
965_liveintr	k a k ɨ ɾ ɨ	k a k ɨ ɾ ɨ	
966_liver	p ɨ j a	p ɨ a	
968_lizardsp			s a ɾ a p o p e β a
970_lizardgeckosp			t e j u ɲ a ɲ a
971_lizardgeckoiguana	t e w e k u ɾ u	j u k u ɾ u a ɾ u	t a ɾ a gʷ ɨ ɾ a
975_long	i + p u k u	i + p u k u	p u k u
978_longtimeago	ɨ m ɨ n w a	ɨ m ɨ n u a	a kʷ é i m e
979_lookintr		u + m a i	m a ʔ ẽ
97_beabletotrans	a m a ts ɨ k a	a m i a s k a	é + k a t u
980_lookfortrans	tʃ i k a ɾ i	ʃ i k a ɾ i	s e k a ɾ a
984_loseoneselfintr	u + k a j m a	u + k a j ɨ m a	k a ɲ e m a
987_loseway	ts u p a ɾ a	s u p a ɾ a	
989_louse	k ɨ w a	k ɨ w a	k ɨ β a
990_love	ts a tʃ i t a	s ɪ t a	a m o t a k a t u
997_lumpbecomelumpy			m o a p a j u gʷ á
999_lung	p u t u	p u t u	ɲ ɨ ʔ ã β e β u j a
9_adorndecorate	w a ɾ i m a t a	w a ɾ i m a t a	j e gʷ a k a
