Cognate_ID,abui,adang,blagar,kaera,kamang,klon,kui,nedebang,protoalorpantar,sawila,teiwa,wersing,westernpantar
74_dayaftertomorrow,a j o k u,aː l u,t i a ŋ + a r u,t ə r a ħ o,,,a j o k a,g ə t a g u,,,t i ʔ i r a q,j a l + j o k u,t i a l a k u
75_daybeforeyesterday,,ʔ o t a r i ŋ + a l u m i,e d a ŋ + a r u,g e t r a ħ o,,,a t a i n + j o k,g ə t r a k u,,,g a t r a q,g a t e ŋ + j o k u,j e n a r p a ŋ
76_deaf,k u r i,p a l a ʔ a,k ə m u k e,q o l u s,u h,g ə w ɛ r k ə k ʊ i,g e w e l + k a k u i l,g o l a + k w a ŋ a,,m u k o,g u w a r + q u l u s,n e w e r i + m o k o l,k u l l u
77_deer,a dʒ u t i,aː l u,r u i ŋ,r u s i,a u u h,,a r u s,r a tʃ i,,,r u u s,a r u s + p e i,l u s
78_dibblestick,,,dʒ a k a t,j a g,,,s u l i n,d a d a,,,j a ħ,l a l a,j a g g a s
79_diggingstick,a h a t i ŋ,,n o r u k,,,,p s o r + t e k a n,m u r u,,,,a t o k u + t e i,d a l i a
7_animal,b i l e l,,n a ʔ w a l,,i s e i,k e e k,g o r + g e w e l,,,,,p e i + k u t u,b a ʔ a
80_dirty,d a k u ŋ,k a r o ʔ o,k ə r i t a k,q a a s i,t i n i,m ʊ ʊ k,m a a k a n,b l a q q a s,,m a k a ŋ,b l a q a s,m a k a ŋ,a n a
81_dog,k a i,b ɛ l,dʒ a b a r,i b a r,k u i,k ʊ r,k u r,b a r,,k a t u,j i f a r,k u t u w a l,j a b b e
82_dolphin,k a s u w a i,u s a h a,k u dʒ a,ħ a l a a r u,a n e e,b e ʔ e b i,s i s i p i l,p a a r u,,,b a i + ħ a f,a k o l i ŋ + a n a i,l a u r l a g a
83_door,l u ŋ,s a ʔ a r,t u n i,t u u n i,l u b u i,h e k,n a b a t,w a l a g g a,,d a a m a t,w e e g,d a m a t,w a i j a
84_dream,p i e i l a,p e i,j i p a r,i p a r,f o i,e p e r,p u n e i,v a,h i p a r,,a j i v a r,w o r m a i,h i p p e
85_dry,t a k a t a,t a ʔ a t a,t a t a,s i s o,a u k a,t ə k ɑ t,t a k a t a,tʃ i tʃ i,,a r u k o,s i i s,a r u k,s i s a
86_dryinsun,t e k,f ɛ d + p o i,p o r i ŋ,p o r i ŋ,s a k,ʊ p u r,b e r + g a r a i n,w a d o r a,p o r,p oː p ɒ r ɔ,m a w u d a n,l e w i d i l e i,p u a r i ŋ
87_dustfineearth,t a b w o ŋ,m a l u,b u t u ŋ + b o n i,b r a a m,k i n i i,ə d µ/u r,p l a k + t a b o n,m a l a w,,b u t i ŋ,d i ʔ + b ə r a a m,m a + p u n a k a,b r o
88_ear,t a w e i,a w ɛ b ɛ h ɛ,t ə v e l i,t u w a r + w a,w a i,g ə w ɛ r,t a w e l,g o w w a ʔ a,u a r i,w a r i,u w a r + w a ʔ,n e w e r i + l a k,n a u w e
89_earth,b u k u,,p o r,p a r,b u k,b u l j a,b u ŋ u n,q o k a,,,i i d,,p o r
8_ant,f i k e i,l ɛ ʔ i l i ŋ,k ə r e,i r i k i ŋ,k a k i s i ŋ,i q i l i n,b u t u r,m u r,,k l a ŋ l a ŋ u r,t a r e ħ e n,k u s i ŋ,k a r e
90_earthquake,t a i dʒ o k a,t a i + w ɛ ʔ ɛ,p o r + ʔ o t a ʔ,i t i j o q u ŋ,k o m e e,d a i,k u m e + a w a r,i l a ʔ a b,,,i t o j a n,k o m e i d a i,t a ŋ + a b b a ŋ
91_earthworm,a n e i + t a k o i,iː b + ʔ w o r m ʔ,d u k a l a l i ŋ,d u ŋ k a l a i ŋ,a s i ŋ k u a i,d ə l ɪ k w ɛ i,i + p a l a,t u n i g a s i,,k i s p a a k,o t a r,k e s p a k,a r a t i
92_egg,r u o + b i r a,d o,e ʔ d u a,g o t o q i,w a a,ə d ɑ ŋ,r o,g a t a j,,w a a l a,g ə t o v,s o a l,r i a k u
93_eight,j e t i + s u o,t u r l o ʔ,t u a ʔ a r u,j e n t u g,i s i ŋ s u,t ɪ d ə r ʊ k,t a d + u s a,s t a g u,,j o o t i ŋ t u o,j e s n e r i g,w e t i ŋ + t u,b e a t i g a
94_eleven,k a r + n u k + w a l + n u k u,a i r n u + w a l i ŋ u,a r + n u + b e t a l + n u,ħ a r + n u k + b e t i + n u k o,w a a l,u p + k a r + n u k + w a + n u k,k a r n u k + w a i l + n u k u,,,,q a a r + n u k + r u g + n u k,a d a j o k u + w e r e s i ŋ + n o,k e a n u k u + w a l i + j e
95_empty,t a k a,,o s i ŋ,i s i k,s a k a,i k ʊ h,m a r e s,,h a s a k,s i i r a,h a s a k,,h a k k a s
96_excrement,a s i,h a h a ʔ,a a s,,a s i,ǝ h i,e s,,h a s,ɑ t ʊ,ħ a s,a t u,h a s
97_eye,t i e ŋ + b i k a,ʔ ɛ ŋ w a i,t e ŋ k u l u,t e e t + g w a q,ŋ,g ɛ ɛ n,t e n,g a t a b a g a,,g a n i i r i,t e t + b a a g,n i n i r k o,n a i t i
98_fallfromabove,d i t a h a i,m u d i,b a + h e r a,b a + s e r o,m u ʔ t a n,m ʊ ŋ,m u k + s e i,b a ʔ a,,t a a n i,b a ʔ,t a i ŋ,t a s i ŋ
99_fallover,d a k u i l a,o l o ʔ,b e l i,t a ħ a,k o k,t k o s,t a k o k i,a ħ o ħ i,,,t a ħ a ʔ,p o d o,b a u l u ŋ
9_arm,t a t a ŋ,n a t a ŋ,t a t a ŋ,t a t a ŋ,t a ŋ,g t a n,t a t a n,g a t a ŋ,t a ŋ,g a t a ŋ,g ə t a n,n e t e ŋ,n a t t a ŋ
