Cognate_ID	alak	bahnargolar	bahnarkontum	bahnarpleiku	brao	bunong	cheng	chrau	cua	halang	jeh	jrulaven	kasseng	khaonh	mel	mnongrlm	nyaheun	ramam	rengao	sapuan	sedang	sre	stieng	tampuan
23_chickenfowl	ʔ ɛː r	ʔ j ɛ r	ʔ j ɛ r	ʔ j ɛ r	ʔ j i a r	j a r	ʔ i a r	ʔ i e r	ʔ iː l	ʔ i ə r	ʔ i a l	ʔ i a r	ʔ i ə r	ʔ e ɵ	ʔ iː ɨ	ʔ i e r	ʔ i a n	ʔ a i ɺ	ʔ iː r	ʔ i a r	ʔ ḭ	ʔ i a r	ʔ i e r	ʔ j ɛ r
24_childson	k ɔː n	k ɔː n	k ɔː n	k ɔː n	k u a n	k ɔː n	m ɛː + t r k u a n	k ɔː n	k ɔː t	k o a n	k ɔː n	k u a n	ʔ a n + k ɔː n	k ɑ w n	k ɔː n	k u o n	k u a n	k ɔː n	k ɔː n	k u a n	k ɔ n	k o n	k ɔː n	k oː n
25_cloud	m m uː k	h ə m ə l	h ə m ə l	h ə m ə l	j uː k	p j ṳ t		t u ʔ		s i k s u k	k ə s o̤ k	h m ə l		b ə b ɔː k	b ə ɓ ɔ̤ː k	ɲ u e	j u o k	h ə m ɯ l	j ṳ k	s ɔː k + j u o k	s ɔ k	mʰ w a l	t o k	k a m ɔ l
26_cold	t a k a t	t ə ŋ j ɛ t	t ə ŋ j ɛ t	t ə ŋ j ɛ t	ɡ ɑː	n ɨ ʔ ɨ k	h a d ɛ h	l ə ʔ iː ʔ	ɟ a l ɛː k	h ə ʔ ŋ i ə t	s i ʔ ŋ aː m	ʔ d ɛ h	ŋ k a t	l ɑ ʔ ɑː k	l ə ʔ aː k	k a t	n t ɛ h	t ə ŋ a i t	t ə ŋ ɛ t	n d ɛ h	ŋ e	ŋ i t	l ŋ eː t	l a ʔ ɑ t
27_dog	c ɔː	k ɔ ʔ	k ɔ ʔ	k ɔ ʔ	c ɑː	s ɔː	c ɔː	s ɔː	s ɔ	c o u	c ɔ w	c ɔː	c ɔː	s a w	s ɔː	s a w	c ɔː	c ɔː	c ɔː	c ɔː	c ɔ̰	s ɔ	s oː	ç oː
28_dry	h a k ɔ h	h r ɛ ŋ	h r ɛ ŋ	s r ɛ ŋ	cʰ r a k	s əː h		r ɔː	h r a k	s r a m	r a ŋ	c r a m	l ə ɡ ɔ h	s ə h	s ʊ h	k r ɔː	s r a ŋ	k w ɔ ʔ	ts r iː ŋ	t r a m	ʂ ḭ ŋ	s ə h	p r a ŋ	cʰ w a t
29_ear	n t oː	ɗ ɔː n	ɗ ɔː n	ɗ ɔː n	t r ə p i t	t oː r	t r p i t	t oː r	t oː l	p əː t	p a̤ t	h p iː t	t oː r	t a ɵ	t o w	t oː r	p p i t	p a t	d ɔː n	t a p i t	t ṵ ə n	t o u r	t oː r	t a o r
2_alivelive	pʼ r oː s	h ə d r i h	ʔ a d r i h	ʔ a d r i h	ɲ i w	r eː h		r i h	r i lʰ	p e̤ː n	p e̤ː n	d ɛ j				b r e h	ɲ i w		h ə r i̤ h		r ɛ h	r i s	r e h	ʔ ŋ r ə i s
30_earthsoil	t ə n ɛ h	t ɛ h	t ɛ h	t ɛ h	p ə d e h	n eː h	t ɛ ʔ	n t ɛ h	b ə r i	t ə ʔ n e h	ʔ n ɛ h	p ə t ɛ h	ʔ ə n ɛ h	ɗ̥ a e ç	t ɛ h	t ɛ h	b r ɛ h	k ə n ɛ̃ h	t ə ʔ n i h	p a d ɛ h	t ə n ɛ j	ʔ uː	s ə t ɛ h	t ɛ h
31_egg	k a n t a p	k ə t a p	k ə t a p	k ə t a p	k ə l eː	t a p	k l ɛː	c a p	k a t a p	k ə t a p	t ə t a p	k l ɛː	l ɛ h	k ə t a p + ʔ e ɵ	k ə t a p + ʔ i ɨ	t a p	k l ɛː	k ə t a p	k ə t a p	k a l ɛː	k ə t a	t a p	t a p	k ə t a p
32_eight	t a ŋʰ aː m	t ə h ŋ a m	t ə h ŋ a m	t ə h ŋ aː m	tʰ aː m	pʰ aː m	tʰ aː m	pʰ aː m	tʰ əː m	t ə h aː m	t ə h aː m	tʰ aː m	t ə ŋʰ aː m	pʰ ɑː m	pʰ aː m	pʰ aː m	tʰ aː m	t ə h aː m	t ə h aː m	tʰ aː m	t ə h ɛ̰ ə m	pʰ a m	pʰ aː m	t ə ŋʰ aː m
33_eye	m a t	m a t	m a t	m a t	m a t	m a t	m a t	m a t	m a t	m a t	m a t	m a t	m a t	m ɑ t	m a t	m a t	m a t	m a t	m a t	m a t	m a	m a t	m a t	m a t
34_fardistant	c ə ŋ aː j	h ə t ɔ l	ʔ a t a jʰ	ʔ a t a jʰ	c ɨ ŋ aː j	ŋ aː j	t r ŋ aː j	ŋ aː j	s a ŋ ɨː j	h ə ʔ ŋ aː j	s i ʔ ŋ aː j	h ŋ aː j	w aː c	ŋ ɑː j	ŋ aː j	m əː ɲ + m aː ɲ	ŋ j ɛː	t ə h ãː j	h ə ʔ ŋ aː j	s a ŋ aː j	h ə ŋ ḛ	ŋ a j	ŋ aː j	c a ŋʰ aː j ʔ
35_fatoilgrease	pʼ a ŋʰ uː				p uː ŋ	ŋ iː	r iː k		k a p ə ʔ	b ə d r ɛ a ŋ	p ə d r ɛː ŋ	p u k	b o k	kʰ l ɑ ɲ	b ə d r i ə ŋ	n d r i e ŋ	p u k	p o ŋ	b iː k	p u k		d ə ŋ i	p r iː ŋ	p o ŋ
36_fearafraid	k ɛː c	h l iː	ʔ j u ʔ	h l iː	d uː ŋ				ʔ j o ʔ	h ə m ɔ h	ʔ j u ʔ	h m o ʔ				kʰ iː r	h m o ʔ	ʔ j u ʔ	j ṳ ʔ	k a m a m	r e	c u	pʰ o ŋ	ʔ j o u ʔ
37_fecesexcrementshit	ʔ ɔː ʔ	ʔ i c	ʔ i c	ʔ i c	t r a c		ʔ i c			ʔ i k	ʔ ɛ k	ʔ i c	ʔ i c	ʔ a c	ʔ a c		ʔ i c	ʔ ʌ t	ʔ i̤ k		ʔ e ə k	ʔ e	ʔ a c	ʔ ɔ c
38_fieldirrigated	tʼ a l aː	c u n	m iː r	m iː r	m ɨː r				ɟ i a k	ɟ i̤ ə k		m ɨ ə r				m iː r	m ɨ ə n			m ɨ ə l	c i ə k	s r e	s r e j	s r ɛː
39_fieldswiddenhill		m iː r	m iː r	m iː r	m əː l		m ɨː r	m iː r			ɟ i̤ a k	m ɨː r	m i ə r			m iː r	m ɨ ə n		ɟ e̤ː k	p a m ɨː j	c i e k	m i r	m i r	m ə i r
3_ant	m b oː c	h m oː c	h m o c	h m oː c	m oː c		s a m oː c		r a m uː t	m uː t	m u t	h m oː c	n uː r			s aː m	h m oː c	h aː ŋ		s a m ɔː c	h m u j	ŋ ɔ ɲ	cʰ i a m	ʔ mʰ m a o c
40_finger	r aː s	a ŋ l o	a ŋ l o	a ŋ l o	t ɨ r p u a c		t r a p u ɛ c		l o k	h ə d r ɛ ŋ	k ə ʔ n ɔː j + t i̤ː	h p u a c	ʔ ə c aː s			k u o n + t iː	p p u a c		h ə d iː ŋ	t a p u a c	h ə ʔ r a̰ ŋ	n a w	l a w	r a ŋ ʔ j aː
41_fire	ʔ uː ɲ	ʔ u ɲ	ʔ u ɲ	ʔ u ɲ	ʔ u ɲ	ʔ u ɲ	ʔ u ɲ	ʔ u ɲ	ʔ o lʰ	ʔ u n	ʔ o̤ n	ʔ u ɲ	ʔ uː ɲ	ʔ o ɲ	ʔ o ɲ	ʔ ɨ ɲ	ʔ u ɲ	ʔ a u n	ʔ ṳ n	ʔ u ɲ	ʔ ɔ n	ʔ o u s	ʔ o ɲ	ʔ o ɲ
42_fish	k aː	k aː	k aː	k aː	t r ɨː	k aː	t r ɨː	k aː	k aː	k aː	k aː	k aː		k ɑː	k aː	k aː	b l aː k	k aː	k aː		k a̰	k a	k aː	k aː
43_five	pʼ a r tʼ a m	p ə ɗ a m	p ə ɗ a m	p ə ɗ a m					p a ɗ a p	b ə d a m	p ə d a m		t ə d a m					c ɛ m̥	p ə d a m		p ə t a̰ m			p a t a̤ m
44_fleshmeat	s a c	ʔ ɲ ɛ m	s ɛ c	ʔ ɲ ɛ m	m aː t	j a m	m aː t		h l ɛ c	r o̤ ʔ	t e̤ː h	t r a w	ɟ eː c	p aː j	ɓ aː j	l a w	m aː t	h l ɔː ŋ	h ə ʔ n i̤ h	t r aː n	c a̰ m	p o a c	p aː j	p ə ŋ l a j
45_flower	p a ŋ k aː w	p ə k aː w	r aː ŋ	p ə k aː w		k aː w		ŋ k aː w	ʔ a r aː k	r aː ŋ	r aː ŋ		ʔ ə r aː ŋ	p ə k a w + s iː	p ə k a w	k aː w		p ə k aː w	r aː ŋ		r ɛ̰ ə ŋ	b ə k aː w	k aː w	p ə k aː w
46_foot	cʼ ɨ ŋ	k ə p aː j + ɟ ə ŋ	k ə p aː j + ɟ ə ŋ	k ə p aː j + ɟ ə ŋ	ɟ ɨ ŋ	c ə̤ː ŋ	ɟ i ŋ	ɟ ə ŋ	p l aː + ɟ oː k	k ə ɡ a ŋ + ɟ o̤ː ŋ	ɟ o̤ː ŋ	ɟ ɨ ŋ	ʔ ə k ɔː ŋ	p aː ŋ + ɟ ə ŋ	k ɔː j + ɟ ə ŋ	p aː ŋ + ɟ ɔː ŋ	ɟ i ŋ		ɟ e̤ː ŋ	ɟ i ŋ	c e ə ŋ	ɟ ə ŋ	ɟ ə ŋ	c i̤ ŋ
47_four	p oː n	p w a n	p w a n	p w a n	p u a n	p w aː n	p u ə n	p u o n	p ɔː t	p u a n	p u a n	p u a n	p u ə n	p o a n	ɓ u ə n	p u o n	p u a n	p ɔ n̥	p uː n	p u a n	p ṵ n	p u a n	p u o n	p w a n
48_frog	k iː t	k iː t	k i t	k ɨː t	k iː t		k iː t	k ɨ t	ʔ oː + ɟ iː	k iː t	k i̤ a t	ʔ k i e t	k iː t	k ə t	k ə t	k ɨ t	k i e t	k ʌ t	k i̤ t + d r ɔ k	k i e t	k ɛ t	k i t	k ɨ t	k ə t
49_fruit	p a l a j	p l ɛː j	p l ɛː j	p l ɛː j	p l a j	p l aː j	p l a j	p l a j	p l a j	p l a j	p l a j	p l a j	p l a j	p l a j + s iː	p l ɛ j	p l ɛː	p l eː	p l a j	p l i̤ː	p l a j	p l a j	p l a j	p l a j	p l a j
4_arrow	p l aː	m r ɔ m	m r ɔ m	ɓ r ə m	d r a ŋ	h a r	s r aː	k a m	r ʌ ŋ	s ɔ a r	p l aː	t ɔ ŋ		h ɑ ɵ	h a ɨ	k a m + t l a k	t ɔː ŋ	k a m̥	r a ŋ	t ɔː ŋ	r a̰ ŋ	k a m		k a m
50_full	pʼ iː ŋ	ɓ e ɲ	ɓ e ɲ	ɓ e ɲ	b i ŋ	ʔ a p + t ɔ ŋ		v eː ɲ	v iː k	b iː ŋ	b i ŋ	b iː ŋ	b iː ŋ	b e̤ː ɲ	ɓ eː ɲ	b iː ŋ	b i ŋ	p ɯ k ŋ	b i ŋ	b i ŋ	p ɛ ŋ	b eː ŋ	b eː ŋ	p a̤ ɲ
51_grandchild	c a w	s ɔ w	s ɔ w	s ɔ w	c a w		c a w	s a w	s a w	c a w	c a w	c a w	c a w			s ɔː	c oː	c a w	c a w	c a w	c a̰ w	s a w	s a w	s a o
52_grass	pʼ a t	ʔ ɲ ɛ t	ʔ ɲ ɛ t	ʔ ɲ ɛ t	b a t	h e p	b a t	ɲ e t		ɲ a t	s ɛ t	b a t	ʔ ə w a t	k ɑ ʔ ɑː ŋ	k a ʔ aː ŋ	b a t	b a t	ɲ ə ɲ a t	ɲ a t	b a t	ɲ a	ɲʰ ə t		s a m a o ŋ
53_green	s iː w	ɟ əː k		ɟ əː k	ɲ əː t	n t r e̤ː h	k a j ɛ ʔ			d r i h	d r i h	k c ɛ ʔ	ɲ iː l	c ə ŋ + ʔ eː ɲ		s ɛː	ɡ j ɛ ʔ	c a t	h ə d r i̤ h		d r ɛ h	t ə l i r	t i a w	p l ɨ̤ː t
54_hairhead	s ɔ k	s ɔ k	s ɔ k	s ɔ k	cʰ o k	s ɔ k	s ɔ k	s ɔ ʔ	h l oː k	s ɔ k	s u k	s o k	s o k	s ɔ k	s ɔ k	s ɔ k	s ɔ k	ts a k	ts ə̤ k	s ɔ k	s a k	s ɔ ʔ	s ɔ k	s ɔ k
55_hand	t iː	t ə p aː j + t iː	k ə p aː j + t iː	t ə p aː j + t iː	t iː	t iː	t iː	t iː	t iː	t i̤ː	t i̤ː	t ə j	t iː	p a ŋ + t e i	t iː	t iː	t iː	t ʌ j	t i̤ː	t iː	t a j	t e	t iː	t ə j
56_head	kʼ ɨː	k ə l	k ə l	k ə l	t uː x	p o̤ː k	t uː ç	v oː ʔ	ɡ ɨ l	k əː l	k a̤ l	t uː s	t uː ç	ɓ o̤ː k	ɓ o̤ː k	b oː k	t u jʰ	k u o ɺ	ɡ ə̤ l	t u i h	k ɔ	b o u	b oː k	k ɔ l
57_heart	k l əː m	n u jʰ	n u jʰ	n u jʰ	t ɨ r b ɨ n	p l a j + n uː ç	p l a j + t uː ŋ	p l a j + n uː s	s uː m	ʔ n o̤ jʰ	ʔ n o̤ː ç		k l ɔː m + l o ʔ			nʰ a m	n u a jʰ		p l i̤ː + ɡ ə̤ l	ɟ a h əː m	ʔ i h i ə m	n u s	n u s	n o u s
58_heavy	kʼ a cʼ ɨ k	t r a p	h ŋ a m	h ŋ a m	k ə j ɨ k	c ə̤ː k		k ə n ɟ ə ʔ	p a r e ʔ	ʔ a k	k l a̤ ŋ	k ɟ ɨ k	k l eː ŋ	k ə ɟ ə k	k ə ɟ ə k	ɟ ɔː k	ɡ j ɨ k	h ŋ a m	h ŋ a m	k ə j ɨ k	h ŋ a̰ m	k ə n ɟ ə	ɟ ə k	k l a ŋ
59_horn	ŋ k a j	h ə k ɛː	ʔ a k ɛː	ʔ a k ɛː		n k eː		ŋ k ɛː	ʔ a k eː	h ə k ɛː					k æː	k aː j		ʔ ɔ ŋ + k ʌ j			k a̰ j	ŋ k e	ŋ k e	ʔ ŋ k ɛː
5_ashes	pʼ uː h	t ə n u h	t ə n u h	t ə n u h + ʔ u ɲ	k r ə ʔ ɨ h	p ṳː h	t u h	v uː h				b r u k	b l ɔː	n ɑ k	b u h ə n a k	d o ʔ + b u h	b r u k	p u ɺ	b l ɔː	t u h	c ɔ j	b uː h	b u h	
60_hotwarm	t o ʔ	t ɔ ʔ	t ɔ ʔ	t ɔ ʔ	d u ʔ	t ṳː h	d o ʔ	d u h	t o ʔ	t u ʔ	t u ʔ	ʔ t o ʔ	p uː ç	t ɑ ɲ	t a ɲ	d o h	d o ʔ	k ə n ɔ ʔ	t u ʔ	d o ʔ	t o	d u h	d o h	t o ʔ
61_house	ɲ ɲ iː	h n a m	h n a m	h n aː m	h n aː m	ŋ iː h	s r aː m	ɲ iː	h ɲ ɨː	ɲ i̤ ə	ɲ i̤ a h	h n əː m	s uː	ɓ a w n	ɲ ɯː	h i h	ɲ̊ r aː m	h u j	h ɲ e̤ː	s əː m	h n ɛ̰ ə m	h i w	ɲ iː	h ə i
62_hundred	k l a m	h r ɛ ŋ	h r ɛ ŋ	h r ɛ ŋ		rʰ j a ŋ	k l a m	r ə j ɛ ŋ	h r ɛː k	r ɛ a ŋ	r ɛː ŋ	k l a m	r i ə ŋ			h i e ŋ	k l a m	h ɣ ɛ k ŋ	h r iː ŋ	m uː j + k l a m	h r ḭ ŋ	rʰ i a ŋ	rʰ i a ŋ	r a j a ŋ
63_ime	ʔ a l	ʔ i ɲ	ʔ i ɲ	ʔ i ɲ	ʔ a j	k ə̤ p	ʔ a ɨ	ʔ a ɲ	ɡ o	ʔ a u	ʔ a w	ʔ aː j	ʔ a ɯ	ʔ ɡ ə p	ʔ ɡ ə p	ʔ a ɲ	ʔ aː	ʔ a j	ʔ a w	ʔ a j	ʔ a w	ʔ a ɲ	h e j	ʔ a ɲ
64_intestinegut	k l aː k	k l aː k	k l aː k	k l aː k	k l aː k	p r ɔː c	k l aː k + ʔ i c	t ə l aː ʔ	k l aː k	k l aː k	k l aː k	k l aː k	k l aː k	p ʀ a w c	p ɾ ɔː c	p r u e c	k l aː k	k l aː k	k l aː k	k l aː k	k l e ə	p r ɔ c	p r ɔː c	k l aː k
65_iron	m aː m	m aː m	m aː m	m aː m	m aː m		m aː m	l ɔː s		m aː m	m aː m	m əː m	m aː m			d r a p	m aː m		m aː m	m aː m	m ɛ̰ ə m	l ɔ s		pʰ c ɔ j
66_leaf	cʼ ɔ k	h l aː	h l aː	h l aː	cʰ l aː	nʰ aː	h l aː + l ɔː ŋ	l aː	h l aː	l aː	l aː	l aː	ʔ ə l aː	l ɑː + s iː	l aː	h aː	h l a	h l aː	h l aː	kʰ aː + l ɔː ŋ	h l a	nʰ a	l aː	h l aː
67_leechland	p l əː m	p l əː m	p l əː m	p l əː m	p l əː m			p l əː m	p l əː p	p l e̤ː m	p l e̤ː m	p l ʌː m	p l ɤː m	ɡ l uː	ɡ ə l uː	p l əː m	p l ɐː m		p l e̤ː m		p l i ə m	p l ɔ m	p l əː m	p l a ə m
68_leftside	p a h + w i a r	ŋ i ã ɔ	ŋ i ã ɔ	ɡ a h + ʔ ŋ j ɛ w	c ə ʔ i a w	c j aː w	p a w + c a ʔ i a w	ɡ i a w	ʔ j a w	ʔ ŋ i ə w	n a h + ʔ i w	h ʔ i a w	ʔ ə ʔ i ə w	kʰ ɑ ŋ + ɡ e o	ɡ i u	k i e w	ʔ i a w	h ə ʔ ɛː w	ʔ ɛː w	s a ʔ i a w	h ə ʔ e o̰	k i a w	ɡ i e w	s a ŋ ʔ j a o
69_lightweight	h a cʼ əː c	h j əː c	h j əː c	h ə ʔ j əː c	j oː c			n kʰ əː c	ʔ a h j əː l	h ə ʔ ẽ̤ː k	ŋ e̤ː k	h ɟ ʌː c	ɲ ɟ ɤː c			ŋʰ əː c		ŋʰ u ə ɺ	h e̤ː l		h i a	ŋ ɡ ɔ c	ŋ ɡ əː c	c ɨ̤ ɨ c
6_bamboo	ʔ l ɔː ŋ + k o ʔ	p ə l ɛː	p ə l ɛː	p ə l ɛː	r cʰ ɨː		n s ɨː	k ə l aː	k l a j	k r aː m	k l aː	ʔ l ɔː ŋ + l o ʔ		k ə n aː m	k ə n aː m	n aː m	n t ɛː	l ɔː ŋ + p l ʌ j	l ɔː ŋ + p ə l iː	l ɔː ŋ + ʔ a n s ɨ ə	h ə d r ɛ̰ ə	ɡ l e	k ə ʃ ɔ p	p a ʔ oː
70_liver	k l əː m	k l əː m	k l əː m	k l əː m	k l əː m	k l əː m	k l əː m	kʰ l əː m	p l əː p	k l e̤ː m	k l e̤ː m	k l ʌː m	k l ɔː m	ʔ ɡ l a ə m	ʔ ɡ l əː m	t l əː m	k l ʌː m	k l uː m̥	k l e̤ː m	k l əː m	k l i a m	k l əː m	k l əː m	k l a ə m
71_long	cʼ r oː ŋ	k ə ɟ uː ŋ	k ə ɟ uː ŋ	k ə ɟ uː ŋ	ɡ o h	c ɔ̤	ɡ o h	ɟ ɔː ŋ	k iː l	ʔ ɲ e̤ ʔ	p r o̤ː ç	ʔ ɡ o h	ʔ ə r ɯː ç	ɟ ɔː ŋ	ɟ ɔː ŋ	n uː r	ɡ o h	ʔ ɔ ŋ + h a w	r ə n ɔ h	ʔ ɡ ɔ h	s ɔ̰ n	ɟ ɔ ŋ	ɟ ɔː ŋ	ʔ l ə ŋ
72_louse	ɲ c a j	s iː	s iː	s iː	c a j	s iː	c a j	s iː	s a j	c iː	k ə c a j	c e j	c a j	s iː	s iː	s iː	c e	c a j	c i̤ː	c a j	c a j	s a j	s iː	s ə j
73_manmalehuman	k oː ɲ	d r ɔ ʔ ŋ l ɔː	d r ɔ ʔ ŋ l ɔː	d r ɔ ʔ ŋ l ɔː	k l ɑː	p ṳ + k l oː	m ɛː + k l ɔː	k l oː	k a n a w	b u n + k ə l oː	k l ɔ w	k l ɔː	k oː ɲ			k l ə w	t r o i h	k ə n a w	k ə d r a ŋ	k l ɔː	k ə n o̰ w	k l a w	k l a w	k a m a̤ k
74_many	j aː w				ʔ əː n	ʔ əː k	ʔ əː n	v əː n	ʔ ŋ ɨ n	k r əː m	k ə d r a̤ m	d ɨ ʔ	ɟ ɤ ʔ	ʔ ə k	ʔ ɔ k	ʔ əː k	ʔ uː	t ə t a u h	h m ə n	l a j	h ɛ n	ʔ u r	ʔ m ə k	ʔ i̤ ə ŋ
75_medicinejuice	t a n a m	p ə ɡ aː ŋ	p ə ɡ aː ŋ	p ə ɡ aː ŋ			h ɨ t			p ə ɡ aː ŋ	p ə ɡ aː ŋ	t n a m	n s ɤ k	ŋ a h a m	tʰ n a m	ɡ ɨ n	n a m	p ə k aː ŋ	p ə ɡ aː ŋ	t r a m	p ə k ɛ̰ ə ŋ	s ə n ə m	t ə n aː m	ʔ nʰ n a m
76_monkeyape	m əː w	ɗ ɔ k	ɗ ɔ k	ɗ ɔ k	n i w	t o̤ː k	n i w	d oː ʔ	d ʌ k	d ɔ k	d ɔ k	ŋ oː k	ʔ a n m aː w	ɗ o̤ː k	ɗ o̤ː k	d oː k	n i w	t u ɔ k	d ɔ k	n iː w	t ɔ	d o u	d oː k	t ɔ̤ k
77_moon	k a h a j	kʰ ɛː j	kʰ ɛː j	kʰ ɛː j	kʰ a j	kʰ əː j	kʰ a j	kʰ a j	s i a k	kʰ a j	kʰ ɛː j	kʰ a j	ʔ ə h a j	kʰ ɑ ɛ	kʰ ə j	kʰ ɛː	kʰ eː	kʰ ʌ j	kʰ ɛ j	c a k əː t	kʰ ḛ	k ə nʰ a j	kʰ a j	kʰ a j
78_mortar	t a p a ɯ	t ə p a l	h a p a l	t ə p a l	t ə w aː w	m p a l	t v aː w	l ə p a l	ʔ a p a l	h ə p a l	ʔ a p a l	t p a l	ʔ ə p a l	t ə p aː l	t ə p a l + ɟ u h	p a l	d w a w	p a l	h ə p a l	t w aː w		m p a l	p a l	t a p a l
79_mountain	kʼ ɔː r	k oː ŋ	k oː ŋ	k oː ŋ	c ɨ n d uː	j oː k	c a n d uː	ɡ u ŋ	d ɔː t	ŋ ɔ k	ŋ u k		ɡ ɔː r	p ə n ə m	p ə n ə m	j oː k	n u o	p a u ŋ̊	ŋ ɔ k	k ɔː ŋ	ŋ ɔ	b ə n ə m	b ə n ə m	p a n ɨ̤ m
7_banana	p r iː t	p r iː t	p r iː t	p r iː t	p r ɨː t	p r iː t	p r ɨː t	p r iː t	p a r eː t	p r i̤ ə t	p r i̤ a t	p r ɨ ə t	p r i ə t	p ʀ iː t	p r i t	p r iː t	p r ɨ ə t	p ɣ o t	p r e t	p r ɨ a t	p r i ə t	p r iː t	p r iː t	p r ə i t
80_mouth	k aː ŋ	ɓ ə r	ɓ ə r	ɓ ə r	b u a r	m p ṳː ŋ	ɲ aː k	m i ɲ	h u j	t ə m uː n	t ə m u n	t m aː ŋ	b u ə r	ɓ ə ɨ	s ə d oː j	b a r + j u e	m r u e ɲ		b ə̤ r	m aː ŋ	r ə k ɔ ŋ	b ə r	w i e m	p ɨ̤ r
81_mushroomfungus	n n ɔː n				p ə cʰ eː t		p a s eː t	n s eː t		p ə s i̤ː t	p ə s i t	pˢ eː t	ʔ ə s oː m	pˢ eː t	pˢ e t	s eː t	pʰ eː t	p ə ts e t	b ə ts i̤ t	p a s eː t	k ə s e t	b ə s i t	s eː t	
82_nailclaw	k a n e h	t ə ʔ ŋ j ə h	k ə ɗ iː ɲ	t ə ʔ ŋ j ə h	k a r n i a h	nʰ eː h	k r n i ɛ h	k ə nʰ i e s	k a n i ə h	k ə ʔ n i a jʰ	k ə ʔ n i a ç	k ə n i a h	ʔ ə r i ə ç	k ə ɲ e a h	k ə n i ə h	n i e h + t iː	n n i a h	t a j + k ə n e h	k ə ʔ n i h	k a n i a h	k ə n e j	n ɗ i a s	k ə n i e h	h ɲ a h
83_name	c a n ɔ ʔ	h ə n a n	m a t	ʔ a n a n	m a t	m ɔː h		s a ʔ	ʔ a l	ɟ i ə ŋ	t ə l i ʔ	m ɔ h	ʔ ə l oː m			n a n		m a t	m a t		ʔ i n a j	t ə m ɔ h	t ə m ɔ h	s ɛ c
84_navel	k l ɔ k	k l ɔ k	k l ɔ k	k l ɔ k			k l ɔ k	k l ɔ ʔ	k l oː k	k l ɔ k	k l ɔ k	k l ɔ k	k l o k	p o u	p uː	t l ɔ k	k l ɔ k	c i a t	k l ɔ k		k l ɔ	k l ɔ	k l ɔ ʔ	k l ɔ k
85_near	tʼ i a p	ɟ e ʔ	ɟ ɛ ʔ	ɟ e ʔ	k ə l a m	t a c			ɟ ɛ ʔ	d ɛ ŋ	ɟ e̤ ʔ	t iː t	ʔ ə s iː t	d a̤ c	ɗ ə c	d a c	tʰ aː p	k e m̥	t ɛ n	d i a p	ʔ a c ɛ	r i p	ɟ ə ŋ ɔː	k j a̤ m
86_neck	ŋ ɔː k	h ə k ɔː	ʔ a k ɔː	ʔ a k ɔː	d ɑ ŋ	t a k ɔː	h r ɔ ŋ	n k ɔː	r a n ʌ ŋ	t ə k u ə j	t ə k u a j	h l ɔ ŋ	n d ɔ ŋ	k aː w	k ɔː	k a w	h l ɔ ŋ	t ə k o ŋ	c ə k ɔː j	h a r ɔː	r ə n ɔ ŋ	ŋ k ɔ	k ɔː	ŋ k oː
87_needle	ɡ a j ɔː				k e h							h n oː c		ŋ l a i	ŋ l a i	n aː j					k ə ɲ ɔ̰		ŋ l əː j	ʔ ŋ l ɛ h
88_new	t a m a j	ʔ n aː w	ʔ n aː w	h l ɛː	n d aː m	mʰ ɛː		m ɛː	ʔ n ə w	ʔ n aː w	ʔ n aː w	ʔ n aː w	n aː w	m ə h a e	m ə h æː	mʰ aː j	ʔ n aː w	n aː w	ʔ n aː w		n e o	t ə m e	ʔ m e	n aː w
89_night	m a ŋ	m a ŋ	m a ŋ	m a ŋ	m a ŋ	m a ŋ	m a ŋ	m a ŋ	k a m ɨ ŋ	m a ŋ	m a ŋ	m a ŋ	m a ŋ	m ɑ ŋ	m a ŋ	m a ŋ	m a ŋ	m aː m a ŋ	m a ŋ	m a ŋ	m a ŋ	m a ŋ	m a ŋ	m a ŋ
8_beanspeas	n t aː k	t ə h	t ə h	t ə h	n t aː k		n t aː k	t uː h	t u a h	t o h	t ɔ h	h t aː k	n t u ə ŋ	t o h	t u h		t t aː k	k ə t ɔ h	t ɔ h	n t aː k	t ɔ	kʰ o a h	t o h	t ɔ h
90_nine	t a ŋ c iː n	t ə s i n	t ə s i n	t ə s i n	c eː n	cʰ i n	c i n	s ɨ n	k a s iː t	c ə c i n	t ə c e̤ n	c iː n	k ə c eː n	s ɛ n	s ɨ n	s ɨ n	c i n	c ə c u n	c ə c i̤ n	c i n	t ə c e n	s i n	s e n	ʔ nʲ s ə n
91_nose	m u h	m u h	m u h	m u h	m u h	m uː h	m u h	m u h	m u h	m ṳ h	m ṳ h	m u h	m o h	m a w x	m o h	m o h	m u h	m a u h	m ṳ h	m u h	m o h	m u h	m o h	m o u h
92_old	k r a ʔ	k r a ʔ	k r a ʔ	k r a ʔ	k r a ʔ	r aː ɲ	k r a ʔ		ɗ uː t	k r a ʔ	r ə ʔ i h	k r a ʔ	k r a ʔ			j a w	k r a ʔ	k ɣ a ʔ	k r a ʔ	k r a ʔ	k r a	k r a	k ə m r aː	k r a ʔ
93_one	m oː j	m oː ɲ	m oː ɲ	m oː ɲ	m uː j	m u aː j	m uː j	m u o j	m u j	m o̤ j ʔ	m ṳː j	m uː j	m uː j	m ɔː j	m ʊ j	m u e	m u e	m ɔ j ʔ	m o̤ j	m uː j	m o j		m u o j	m a o ɲ
94_palmofhand	c a p aː ŋ	p ə l a ʔ	p ə l a ʔ	p ə l a ʔ		m p aː ŋ	k l aː k + t iː	l ə p aː ŋ	p l aː		k ə p aː ŋ + t i̤ː	h p aː ŋ	ʔ ə p aː ŋ	p a ŋ + t iː	p a ŋ + t iː	p aː ŋ + t iː	p aː ŋ	p l a ʔ + t a j	k ə p aː ŋ + t i̤ː	t a p a ŋ	k ə p ɛ̰ ə ŋ	p a ŋ	p aː ŋ	t a m p aː ŋ
95_penis	l ɔ ʔ	l ɔː	l ɔː	l ɔː	l ɑ ʔ		l ɔ ʔ	k l aː w	k l aː w	k ə ʔ w ə l	m ɛː n	k l a j	k l aː w				l ɔ ʔ		m ɛ̤ m		k ə t a	l ɔ c	k l aː w	k ə p l ɔ h
96_person	pʼ a r ŋ aː j	b ə ŋ aː j	b ə ŋ aː j	b ə ŋ aː j	b ə n i h	p ṳː	m a n i h	t a m u n	m ə n i h	b ə ŋ a j	m ə ŋ aː j	p n u s	ʔ ə ŋ aː j	p ə n u ç	ɓ ə n u ç	n a w	n n uː jʰ	m ə n u j ç	m ə n u jʰ	b r u i h	ŋ ḛ	c a u	b n e h	p a n o u s
97_pig	c uː r	ɲ u ŋ	ɲ u ŋ	ɲ u ŋ	c u r	s u r	c u r	s ɨ r	s uː l	c u r	c o̤ l	c u r	ʔ oː k	s uː	s uː	s ɨ r	c u n	ʔ u t	c ṳː r	ɲ əː k	c u	s u r	s o r	s a k ɛː
98_pigeondove	kʼ a kʼ uː	k ə t əː p	k ə t əː p	k ə t əː p	k u r			ɡ ə t əː p			k ə t r a̤ w	k ə r	ʔ ə k uː r			t əː p	k u n	t əː p	t r ṳː		ɟ a ŋ	k ə t ə p	n t əː p	ʔ n t a ə p
99_rain	b iː	m iː	ʔ m iː	ʔ m iː	m ɨː	m iː h	b ɨː	m iː	j i t	ʔ m i̤ ə	ʔ m r i̤ a h	ʔ m ɨ ə	m i ə	m i u	m i u	m i h	ʔ m ɨ ə	m ɯ j	m e̤ː	m m ɨ ə	m ɛ j	m i w	m iː	b ə j
9_bear	c a k a w	ɟ ə k ø u	h ə ɡ ø u	c ə ɡ ə w				s i k a w	s a ɡ ə w		k ə t a̤ m	h k a w	ʔ a k a w	s ə k a w	s ə k o w	k ɔː + kʰ aː ŋ	n aː + k l aː ŋ		h ə k ə w	c a k a w	r ə k o̰ w	ɟ i r k a w	k a u	
