Cognate_ID,Badga,Betta_Kurumba,Brahui,Gondi,Kannada,Kodava,Kolami,Kota,Koya,Kurukh,Kuwi,Malayalam,Malto,Ollari_Gadba,Parji,Tamil,Telugu,Toda,Tulu,Yeruva
100_yellow,m a n dʒ e,m a n dʒ ə l aː n g i,p uː ʃ k u n,p i v aː dʱ,h a l a d i,m a n dʒ a,p i j u d a,m a n dʒ ə,p a s a p,b aː l k a,h i n g e ɾ i,m a ɲ a,b a l k e,,,m a n dʒ a ɭ,p a s u p u,a ɾ dʒ i n,m a n dʒ a l u,m a n dʒ e
10_blood,r a tː ə,n ə tː ə ɾ ə,d i t a ɾ,n e tː u ɾ,ɾ a k t a,tʃ oː ɾ ə,n e tː u ɾ,n eː t u ɾ u,n e tː u ɾ,kʰ eː n s,n e tː i r,ɾ e k t a m,ɾ a s a d u,n e tː i ɾ,n e t i r,ɾ a tː a m,ɾ a k t a m u,p oː kʰ ə,n e tː a r ə,tʃ oː ɾ e
11_bone,i l ə,j a l ə ʋ ə,a ɖː ə,b o kː a,j e l u b u,m uː ɭ e,b o kː a,j e l u ʋ ə,b uː l aː,kʰ o tʃ o l,,e lː ə,oː tʃ u l d iː,,b uː l a,e l u m b ə,j e m u k a,e l f,e lː ə,m uː ɭ e
12_breast,m aː ɾ ə,k u j n d i g i,x a d,d u d o,e d e,m e l e,s aː tː i,m eː l,e d d a m,j e ʋ a kʰ,s i p a d a k i,m aː r̪ u,d a i b u k u,p a l g i l,e d r a m,m aː ɾ b ə,g u n d e,n i dʒ i k u ɖ i,t i g a l a,m e l e
13_burn,k i tʃ iː k d ə,b j aː ɭ,x aː x a ɾ + t i nː i n g,n i ɾ u s,s u ɖ u,tʃ uː ɖ ə,g o n ɖ k a,k aː t o,m a ɳ ɖ u,o l n a,,k a t i kː u g a,m eː d a,,,e ɾ i,k aː l u,t iː kː u + k aː tː i t i,p o tː a ʋ a ɾ a,tʃ uː ɖ ə
14_claw,u g i l ə,k iː j ə gː ə ɾ ə,h o ɾ + a d,g o ɾ k,u g a ɾ u,ʋ o j i,g oː ɾ,k a i j oː ɾ u,g oː ɾ k,o ɾ o kʰ,g a ɾ k a,n a kʰ a m,o ɾ u g d u,k a ʂ ʋ a n ɖ e,g eː r i,n a g a m,g oː ɾ u,j uː r,u g u ɾ u,u mː i
15_cloud,m a n dʒ u,m oː ɖ ə,dʒ a mː a ɾ,m a bː u,m eː g h a,m oː ɖ a,aː b a r,m eː g a m,m a bː u,b a d aː l i,h aː g u,m e kʰ a m,b a d l iː,,m a l g u r,m eː g a m,m eː gʱ a m u,m eː g a m,m oː ɖ a,m oː ɖ a
16_cold,k o ɾ u ʋ ə,s ə j l i j ə,j a kʰ,s a lː a g,t a ɳ ɳ i g e,t a l i n dʒ a d ə,p a n i,k o ɾ ʋ ə,s a lː aː,k iː ɾ n a,,t a ɳ u pː ə,p a n i j aː,,p a ɲ i l,k u ɭ i ɾ tʃ i,tʃ a lː a,k o ɾ t i,tʃ a pː a,t a ɳ i dʒ e
17_come,p a pː a,b aː ɾ,b a nː i n g,ʋ a,b a r u,b aː,ʋ a,,ʋ a,b a ɾ n a,,ʋ a ɾ u g a,b a ɾ ə aː,ʋ a,v e r,ʋ aː,ʋ a tʃː u,p aː ɾ t i,b a ɾ a ɾ a,b aː
18_die,s aː ʋ a d ə,m a ɾ d oː g,k a h i n g,h aː,s aː j i,tʃː ɭ a,t i g t eː n,t aː ʋ ə,ɖ o lː a t a m,kʰ e n a,,m a ɾ i kː u g a,k e ə aː n aː k e ə i d aː h,,c a y,tʃ aː,tʃ a tʃː i p oː ʋ u,k e ɖ u o i s i,s a j j a ɾ a,tʃ aː ɭ a
19_dog,n e,n aː j ə,k u tʃ a k,n e j,n aː j i,n aː j i,aː t e,n aː j i,n e j,a lː a,,n aː j a,k u tʃː o,n e,n e tː a,n aː j i,k u kː a,n o i,n aː j i,n aː j i
1_i,n a,n aː ʋ ə,iː,n a nː a,n aː n u,n aː n ə,n eː n u,aː n,n a nː a,a eː n,n aː n u,ɲ aː n,h eː n u,aː n,aː n,n aː n,n eː n u,oː n,j aː n u,n aː n
20_drink,k u ɖ a p ə,k u ɖ i,k u n i n g,u n,k u ɖ i,k u ɖ i p a,a n i ɾ u s aː t,u n a t u k ə,u nː u,o nː a,,k u ʈ i,h oː n aː,u n,u n,k u ɖ i,t aː g u,u ʈː u d i,p a ɾ i j a ɾ a,k u ɖ i p ə
21_dry,o ɳ i k i l a d ə,a j n g ə n u + i p ə d ə,b aː ɾ u n,ʋ a ʈː a,b a tː i d a,o ɳ a n g i n a,aː t i ɾ,k a n ʈ i k o,a ɾ t aː d,kʰ a j k a,,v a r a ɳ ʈ a,aː i k aː,,,u l a r n t a,e ɳ ɖ u,o ɳ i k i s i,n u n g u d u n a,u n a k u
22_ear,k i ʋ i,k i ʋ i j a,x a f,k e ʋ u,k i ʋ i,k e m i,k e ʋ,k e ʋ ə,k e ʋ,kʰ e b d a,k i ɾ i j u,tʃ e ʋ i,d a ɾ t iː,k e k a l,k e k o l,k aː d ə,tʃ e ʋ i,k i l i,k e b i,k e m i
23_earth,,b uː m i,ɖ a g aː ɾ,m a nː ə,m a ɳ ɳ u,m a nː ə,bʱ uː m i,bʱ u l oː g a m,m a ʈː i,kʰ e kʰ e l,bʱ u m i,m a nː ə,bʱ u m i,t u k u d,t uː k,m a nː ə,m a nː u,k o ɖ ə,m a nː ə,
24_eat,t i m b ə,t i nː,k u n i n g,dʒ e ʋ i,t i nː u,t i n ə,aː n t i s a t u n,t i n + a t e j,t i nː u,m o kʰ n a,t i n u,t i nː u g a,dʒ aː g oː l p a h,t i n,t i n,s aː p ə d ə,t i n u,t o ɾ t i n,u ɳ aː ɾ a,t i nː oː
25_egg,m o ʈː e,m u j ɾ g i,x u a h a e,m iː n dʒ,m o ʈː e,m u ʈː e,s a n k u,m o o ʈ ə,g a ɾ b a m,b iː,t a l a,m u ʈː a,ɾ a ɾ a p aː n d u,k a ɾ b ə,,m u ʈː e,g u ɖː u,m u ʈː e,k e tː i,m u ʈː e
26_eye,k a ɳ ɳ ə,k a ɳ ɳ u,x a n,k ə ɖ ə,k a ɳ ɳ ə,k a ɳ ɳ ə,k a n,k a ɳ ɳ ə,k o ɳ ɖ,kʰ a nː,k a n u,k a ɳ ɳ ə,aː n d u,k a ɳ u l,k a n,k a ɳ ɳ ə,k a nː u,k a ɳ,k a ɳ ɳ u,k a ɳ ɳ ə
27_fat,k o ɭ ə pː ə,t a nː i ʋ i,tʃ a ɾ p iː,k o ɾ o n dʒ,k o bː u,tʃ e ɾ a b i,,k o ɭ u p u,k o d o ʋ oː s,n e ʈ a,,k o ɻ u pː ə,n e dʒː a,m eː n,k o ɽ u k u ɖ,k o ɻ u pː ə,k o ʋː u,k o ɻ ə pː ə,tʃ e ɾ a b i,tʃ i ɾ a b i
28_feather,ɾ a kː e,t i ʋ i j a,p a ɾ ɾ ɛ,b u ɾ a,g a r i,t o p a ʈ a,b u lː,ɾ eː k ə,g e ɾ k,p e n tʃ o,,t uː ʋ a l ə,p a k iː,,,ɾ e kː e,iː k a,i ɾ a kː e,h u ʋ i,t oː p ə ʈ aː
29_fire,k i tʃː ə,t i sː ə,x aː x a ɾ,t a ɖ m i,b e n k i,t i tː a,k i sː,n i pː u,k i s,tʃ i tʃː,d a n k e ɾ e,t eː,tʃ i tʃ a d u,,k i c,n e r u pː u,n i pː u,t iː tː ə,t u ʋ u,t iː
2_all,e lː a,oː ʈ ə j a,k u lː,b o tː i g,e lː a,e lː a,m aː k,e lː aː m,a n t aː,m a j i n,h a r a,e lː a,g oː ʈ a h iː,,,e lː aː m,a n t a,o ʋː o ɖ i m o,m aː t a,n a n g aː ɭ ə
30_fish,m iː n ə,m iː n u,m a tʃː iː,m iː n,m iː n ə,m iː n ə,g u ɖː i,m iː n ə,k iː k e,i n dʒ o,,m iː n,m iː n d u,m iː n,k e y,m iː n ə,tʃ eː p a,m iː n,m iː n ə,m iː n ə
31_fly,p a ɾ a pː ə,p aː ɾ,b aː l + k a nː i n g,p a ɾ i,h aː ɾ u,p aː ɾ a,t u l s aː d,p aː ɾ ʋ u,t u lː a,u ɖ i j a ɾ n a,,p a ɾ a kː u g a,u ɖ aː ɾ i,,,p a ɾ ə,e g u ɾ u,p oː ɾ tʃ,ɾ aː p a ɾ a,m a nː ə
32_foot,a n g aː l ə,k aː l ə,n a t,k aː l,a ɖ i,a n g aː l,dʒ e ʈː a,t a p a ɖ,a ɖ u g u,kʰ e ɖ,p aː d a m i,a ʈ i,ɾ a ɖ a d u,p aː d a m,,a ɖ i,a ɖ u g u,k oː l,k aː l ə,k aː l ə
33_full,tʰ u m b e,f u lː ə,p u ɾ,n i ɳ ɖ,t u m b i d u,d u m b a,n i n ɖ u,,n i n ɖ aː,n i n d k a,g u ɾ a,n i ɾ a ɲ a,n i n d p aː,p u n e ʈ,,n i r̪ a i n t a,n i n ɖ u,s oː kː a i j e,d i n dʒ i d u n ɖ u,d u m b a
34_give,k o ɖ u,k o ɖ,t i nː i n g,h i,k o ɖ u,k o ɖ i,s iː t aː n,t e j,iː m,tʃ i h n a,t a a,k o ɖ u kː u g a,tʃ i b aː h,tʃ i,c iː,k u ɖ ə,i tʃː u,i tː ʃ a d t a,k o ɾ o,k o ɖ u
35_good,o ɭː a j a d ə,n a lː,dʒ u aː n,a sː a l,o ɭː i j a d u,n a lː a,s o b h a t a n,o l u d ə,m a n tʃ i d,d aː ʋ,n e j u n,n a lː a,h eː ɖ u,,,n a lː a,m a n tʃ i,u l t i,e ɖː e d a n a,n a lː ə
36_green,p a tʃː e,p a sː l aː n g i,g u a n a kː i,p a tʃː a d,h a s i r u,p a tʃː e,n i g u ɾ,p a tʃː ə,p a tʃː a,h a ɾ i j aː ɾ,aː k u p a tʃː a,p a tʃː a,ɾ a n a l o,,p a y,p a tʃː ə,p a tʃː a,p a tʃː a i,p a tʃː e,p a tʃː e
37_hair,o ɾ a m e,t aː k ə ɾ ə,p u ʒ ʒ ɛ,k e l,k uː d a l u,t e l a m i,t iː ɾ u,m a n ɖ ə + m iː ɾ ə,dʒ u ʈː u l,tʃ u ʈː i,b a n a,m u ɖ i,t aː l i,tʃ e n d i,,m u ɖ i,v e ɳ ʈ ɾ u k a l u,m iː ɾ s,k uː dʒ a l,t i l a m i
38_hand,k a j,k iː j a,ɖ uː,k a j,k a j,k a j,k e j u,k a i j,k a j,kʰ e kʰː a,k e j u,k a j,ʈ e ʈ u,k iː,k e y,k a j,tʃ e j j i,k o i,k a i,k a j
39_head,m a n ɖ e,m a ɳ ɖ i,k aː ʈ u m,t a lː a,t a l e,m a ɳ ɖ e,t a l,m a n ɖ ə,t a l a k aː j,k u k,t ɾ a j u n,t a l a,k u k u d u,t aː l,t e l,t a l ə,t a l a,m a ʈː ə,m a n ɖ a,t i l e
3_ashes,k o l a b uː d i,p iː d i,h i s,n iː ɾ,b uː d i,b uː d i,b u gː i,p oː d u + a t u k ə,b uː ɖ i d a,tʃ i n d,,tʃ aː m b a l,,n i ɖ,n iː d,s aː m b a l,b uː ɖ i d a,p uː d i,tʃ uː n j a,b uː d i
40_hear,k eː p ə,k əː ɭ,b i n i n g,k e n dʒ,k eː ɭ u,k eː ɭ ə,ʋ i n t i,k eː l ə,k eː dʒ a,m e nː a,,k e l k u g a,m eː n a,,v e n,k eː ɭ ə,ʋ i n u,k eː l,k e ɳ a ɾ a,k eː ɭ u
41_heart,,j a d d i,u s t,g u ɳ ɖ e,h r u d a y a,h r u d a j a,g u n ɖ e,n e n dʒ u,g u ɳ ɖ e k aː j a,b u k a,,h ɾ u d a j a m,h u g l iː,dʒ i b e,,i d a j a m,h ɾ u d a j a m u,m a n a s ə,,n e n dʒ i
42_horn,k o m b ə,k o m bː ə,m a ɾ gʱ,k o ɾ,k o m b u,k o m b ə,k o mː u,,k o mː,m a ɾ a g,,k o m p ə,m a ɾ g a d u,k a ɾ + g u tʃ u l,,k o m b ə,k o mː u,k uː ɾ,k o m b u,k o m b ə
43_kill,k o pː ə,k e n g aː ɭ,k a s f i n g,h a ʋ k a,k o lː u,k o lː ə,a l a n g ʈ aː n,t aː ʋ i ɾ,a ʋ a k aː,e ɖ a b n a,,k o lː u g a,b a dʒ p o,,,k o lː ə,tʃ a m p u,k e ɖ u k i s t i,k e ɾ i j a ɾ a,k o lː ə
44_knee,m u ʈː i,m a nː g aː l ə,g oː ɖ,t o n g ɾ a,m u ɳ a k aː l o,m a ɳ ɖ i,m u ɖ s u,m oː g aː l,m oː k aː l,m u k a,m e n d a j a,m u l̪ a ŋ k aː l,m uː k a,ʋ a n g u l,,m u l̪ a ŋ k aː l,m oː k aː l u,m u ʈː i,m e ɳ a k aː l ə g a n ʈ u,m uː l e k aː l ə
45_know,a ɾ a ʋ ə,g o tː + u ɳ ɖ i,tʃ aː i n g,j e ɾ p a ʈ,a r i,a ɾ i,u ɾ t a n ɖ aː t,a s uː b e j,t e l u s eː,a kʰ n a,,a ɾ a j u g a,h aː h p o,s u n,p u n,a r̪ i,e r̪ aː g u,a ɾ s p i n i,t e ɾ i j a ɾ a,a ɾ i ʋ o
46_leaf,e l ə,j a l i,p a nː,aː k i,j e l e,e l a k a ɳ ɖ a,aː k,eː l u,aː k iː,a t kʰ a,p a t ɾ a,i l a,h aː tʰ a,ʈ u n ɖ e,e v,e l e,aː k u,e ɾ s,i ɾ a,e l e
47_lie,h a ɖ a ʋ ə,b aː ɖ,d ɾ o gʱ + t a ɖ i n g,m i ɳ ɖ s i,m a l a g u,b u d d a,l a b aː ɖ + m u ɖ s a t i,,u n dʒ a,p a i h a,,k i ɖ a kː u g a,k oː ɖ p o,,m a ɖ,k e ɖ ə,p a ɖ u k o n u,p o a ʈ tʃ iː,b u ɾ oː n a ɾ a,b iː n d o
48_liver,,t ə d l ə,dʒ a g a ɾ,t a ɾ k i,h iː r i,t o m b e,k a l e j a,iː r u,k aː dʒ a m,u m b a l kʰ o,,iː r a l,tʃ e d ɾ o,t a ɖ i n g,t a r u ŋ g,iː ɾ a ɭ,k aː l e j a m u,k u ɖ aː l,,t o m b e
49_long,u tː a,u d d u,m u ɾ g u n,l aː m,u d d a,u d d ə,p o ɖ aː m,n iː t a m,p o ɖ a ʋ u ʈ aː d u,d i g aː h,,n iː n ɖ a,d i g a ɖ o,,,n iː ɳ ʈ a,p o ɖ a ʋ u,n e ɾ t i,u d a,n iː ʈ a
4_bark,p a ʈː e,m e ɾ t oː l ə,b u n d,t oː l,n aː r u,a ʈː e,ɖ a n ɖ i + m a ɖː a,k o lː u tʃ o,b e ɾ a ɖ u,oː ɖ a k,,p a ʈː a,,,,p a ʈː e,p a ʈː a,p u ʈ k o ɾ i,k e tː a,t oː l u
50_louse,i l i,p j aː n u,b oː dʱ,p o ɾ k i,h eː n u,p eː n ə,p aː n u,p a i j i,p o ɾ i k i,p eː n,,p eː n,,,p eː n i,p eː n ə,p eː n u,i ɾ s,p eː n,p eː n ə
51_man,k a n ɖ u m u g a,g ə ɳ ɖ a ɭ ə,n a ɾ e e n ə,m a n k a l,p u r u ʂ a,aː n a a ɭ ə,m a n i ʂ aː n,g a n m a g u,m a g a ʋ aː ɳ ɖ,m eː t,k a k a s i,aː ɳ ə,m u ɖ s aː,,,aː ɳ ə,p u ɾ u ʂ u ɖ u,aː l o m,aː n dʒ ʋ u,p a n i j a
52_many,a pː a ɾ a,k a j ɾ i j ə,b aː z,dʒ aː s t a,h a l a ʋ u,d u m b a,p e ɾ e,iː dʒ oː ɖ,tʃ aː l a,b a gː e,,p a l a,d iː k e h i,,,p a l ə,n aː n aː,u pː uː m,b aː ɾ i,t u m b a
53_meat,p aː ɖ ə,ə ɾ s i,s uː,h a ʋː i,b aː ɖ u,e ɾ a tʃ i,m u ɾ i j a,p o d u,a n g iː,a h ɖ aː,,i ɾ a tʃ i,m aː k ɖ u,,,i r̪ a i c c i,m aː m s a m u,p iː t,m aː s a,i ɾ a tʃ i
54_moon,t i n g u ʋ a,p ə ɾ i,ʈ uː b e,dʒ a n g o,c a n d r a,tʃ e n d ɾ a,n e l a,n e l a v ə,s a n ɖ a m aː m a,tʃ a n d o,l e n dʒ u,tʃ e n d ɾ a n,b i l p d u,n e l i n g,n e l i ɲ,c a n t i r a n̪,tʃ e n d ɾ u ɖ u,n i l a,tʃ e n d ɾ e,n i l a tʃ i
55_mountain,m a l e,b ə ʈː ə,m a ʃ,m e ʈː a,b e ʈː a,k u n d ə,d a n ɖ i m eː ʈ,ʋ eː ʈ u m e,g u b a l,p a ɾ t a,,m a l a,b eː ɖ o + p a h aː ɖ i,k a pː e,,m a l a i,k o n ɖ a,t i ʈː ə,d aː ɾ i,k u n d ə
56_mouth,p e,b aː j ə,b aː,t o ɖː i,b aː j i,b aː j i,m uː t i,ʋ aː j i,p a v uː ɾ,b a j i,g u ʈ i,ʋ aː j a,t o ɾ o,tʃ aː l u,v aː y,ʋ aː j i,n oː ɾ u,p oː i,b aː j i,b aː j i
57_name,e s a ɾ ə,p j aː ɾ ə,p i n,p o ɾ o l,h e s a r u,p e d a,p eː ɾ,p eː ɾ,p e d e ɾ,n aː m e,d o r u,p e ɾ ə,n aː m i,,p i d i r,p eː ɾ ə,p eː ɾ u,p eː ɾ,p u d a ɾ ə,p eː ɾ u
58_neck,k a t ə,k pː m aː ɭ i,l e x,g u ɖ u n g a,k u tʰ i g e,b oː ɭ e,m a k,k a ɖ a t eː l,m e ɖ a k aː j a,kʰ e s i r,,k a ɻ u t ə,a s a ɾ d u,k a n ɖ,,k a ɭ u tː ə,m e ɖ a,m a ɾ,k e kː i l ə,b oː ɭ e
59_new,o s t ə,p ə j j m ə n,p uː s k u n,p u n a,h o s a d u,p u d i j a,k o t a,p u d i j a d ə,k o tː a d,p uː n a,p u n i,p u d i j a,p uː n a,n i a,p u n,p u d u s ə,k o tː a,p u d uː n,p o s a tː a,p u d i j a i
5_belly,o ʈː e,p o ʈː i,p e ɖʰ,p iː ɾ,h o ʈː e,p o ʈː e,ʈ e ʈː e,n a ɖ p eː ʈ g u,ɖ o kː a,k uː l,b a n ɖ i,ʋ a j a ɾ ə,p u ɖ aː,p u d u g,p o ʈː a,v a y i r̪ u,p o ʈː a,p i ɾ,b a n dʒ i,b a i ɾ u
60_night,i ɾ ə,ə d l ə,n a m,n a ɾ k a ɖ,ɾ aː t ɾ i,b a j i ʈ ə,s i ɾ b e d i n,eː l u m a ɾ a m,m u l i p e,m aː h a,l aː n,ɾ aː t ɾ i,ɾ aː t i,,,i ɾ aː ʋ ə,ɾ aː t ɾ i,e kː aː ɖ ə,ɾ aː t ɾ e,a n d i
61_nose,m uː k ə,m uː kː ə,b aː m u s,m o s o ɾ,m uː g ə,m uː kː ə,m uː kː,m uː k ə,m o sː oː ɾ,m uː j i,m u n g e l i,m uː k ə,m u s oː,m u n g a n,m u v ã ɖ,m uː k ə,m u kː u,m i tː uː p,m uː g u,m uː kː ə
62_not,k u lː e,i l a,aː x a,h e lː e,a lː a,i lː e,k aː d u,i lː a,i lː e,m a l a,,i lː a,m a l aː,,,i lː e,l eː d u,aː ɖ u d i,aː t u,i lː e
63_one,o n d ə,ʋ a n d ə,a s i t,o n d i,o n d u,o n d ə,o kː oː t,oː d i t,o ɾ ɾ oː ʈ,oː n d,r a n ɖ i,o nː ə,oː n d,o k u ʈ i,o k,o nː ə,o k a ʈ i,u tː ə,o n dʒ i,o n dʒ u
64_person,k a n ɖ ə,aː ɭ ə,b a n d a g,l o k u ɾ,m a n u s a,m a n a s a,m a n i ʂ aː n,,m a n s uː ɳ ɖ,aː l,,m a n u ʂ a n,m a l a h,,,m a n̪ i t a n̪,m a n i ʂ i,k i nː uː ɖ ə,m a n u ʂ eː,m a n u tʃ e
65_rain,m e,m a ɭ i,p ɛ ɾ,p i ɾ,m a ɭ e,m a ɭ e,ʋ aː n a,m a i,ʋ aː n a,tʃ eː p,b e l a,m a ɻ a,dʒ a ɖ aː,,v aː n i,m a ɻ a i,ʋ a r ʂ a m,m e ɖ u tː i,b a ɾ s a,m a ɭ e
66_red,k e pː ə,t i sː ə g a ɳ ɖ aː n g i,x iː s u n,e ɾ ɾ a g,k e m p u,tʃ oː p ə,j e r u ɖ i,n e t i ɾ,e ɾ ɾ a,k h e s o,n e t u ɾ i,tʃ u m a pː ə,eː s o,,k e y,c e + m,e ɾ u p u,k e pː ə,k e m p u,tʃ oː p ə
67_road,t aː ɾ i,b a ʈː i,s a ɖ a k,h a ɾ ɾ i,m aː r g a,b aː t e,d a a ɾ,t aː ɾ i,a ɾ ɾ i,ɖ a h a ɾ e,,ʋ a ɻ i,p aː o d u,r a s t a,p aː v,v a l̪ i,m aː ɾ g a m u,aː l a ɾ,p a ɾ v a t a,r a s t e
68_root,p eː ɾ ə,b j aː ɾ ə,ɾ oː t ɛ,h iː ɾ,b eː ɾ u,b eː ɾ ə,ʋ eː ɾ k a m,,ʋ eː ɾ,p aː d a,ʋ e ɾ,ʋ eː ɾ ə,b a n d aː,k u ɾ e,v aː r,ʋ eː ɾ ə,ʋ eː ɾ u,ʋ e ɾ,b eː ɾ u,b eː ɾ ə
69_round,,b ə j n s a k ɾ a n g uː d ə,g oː l + p e ɾ i,g u ɳ ɖ ɾ a l,b a ʈː a,u ɾ u ʈ a,b u bː a ɾ i,ʋ a ʈ a m,g u ɳ ɖ ɾ aː n,g u ʈ i ɳ ɖ a,,v a ʈː a,g u ɖ m e,,,ʋ a ʈː a m,g u ɳ ɖ ɾ a n i,u ʈː i,u ɾ u ʈ ə,u ɾ u ʈ u
6_big,d o ɖː a d ə,d a pː u,b a lː u n,p e d d a,d o ɖː a d u,b a l j a d ə,,t o ɖ u t,b e ɾ ɾ a,k o h a,b eː ɾ,ʋ a l u d ə,b eː ɖ o,m u ɾ e,b e r t o,p e ɾ i j a,p e d d a,i tː uː ɖ ə,m a lː a,b a l e j i
70_sand,p a kː e,m a ɳ a l ə,ɾ eː k,u s k e,m a r a ɭ u,m a ɳ a,u s u k a,,i s i k e,tʃ a l k u ɾ u,b a l i,m a ɳ a l,b aː l i,m aː n,m a n,m a ɳ a l,i s u k a,m a n a l,p o j j a,m a ɳ ə
71_say,e g ə ʋ ə,p əː ɭ,p aː n i n g,i n,h e ɭ u,a nː ə,,p a i d u,k e lː a,b a kʰ n a,,p a ɾ a j u g a,h a u ɖ p o,,e n,tʃ o lː ə,tʃ e pː u,aː ʋ a ɖ ə,p a ɳ a ɾ a,p a ɾ e
72_see,n oː ɖ ə,n oː ɖ,u nː i n g,h u ɖ a,n oː ɖ u,n oː ʈ ə,t aː n a,n oː ʈ ə,uː ɖ a,j eː ɾ n a,,k aː ɳ u k a,ʈ u n ɖ p o,tʃ u,,k aː ɳ,tʃ uː ɖ u,n uː ʈ,t u ʋ aː ɾ a,n oː k u
73_seed,p i tː ə,b i sː ə,b e dʒː,v i dʒː a,b e d e,k u ɾ u,ʋ i tː a n a m,ʋ i t u,p eː ɳ ɖ k u,b iː,,v i t a,,,v i tː i d,ʋ e d ə,ʋ i tː a n a m,p i tː ə,b iː dʒ a,k u ɾ u
74_sit,k u ɭ ə ʋ ə,k uː ɾ s u,t uː l i n g,u d d a,k u ɭ i t i k o,a ɭ e,u d ə,,k u d d aː,o kʰ n a,,i ɾ i kː u g a,h o k p o,u n d u,,u kː aː ɾ ə,k uː ɾ tʃ o,e ɾ a kː a ɾ,k u lː a ɾ a,i ɾ a i k u
75_skin,t oː l ə,t oː l ə,s i l,t oː l,t o g a l u,t oː l ə,t oː l,t oː l u,t oː l,tʃ a p ʈ a,,t o l i,tʃ aː n a,t a l,t oː l,t oː l ə,t oː l u,t uː ɾ s,tʃ e ɾ m a,t oː l u
76_sleep,o ɾ ə g ə d ə,a ɾ g u,x a tʃ i n g,m iː ɳ ɖ a,m a l a g u,o ɾ a,iː m a n g s a t i,o ɾ ə g ə,u n dʒ a ʈ a m,k h a n d a ɾ n a,,u ɾ a n g u g a,a n d a ɾ p o + k oː ɖ a,,m a ɖ,u r̪ a ŋ k u,n i d ɾ a p o ʋ u,o ɾ kʰ ə,dʒ i pː a ɾ a,o ɾ a
77_small,k u nː a d ə,k i ɾ i,tʃ u n a k,tʃ i nː a,tʃ i kː a d u,tʃ e ɾ i j a d ə,s i nː a,g u n t ə,tʃ i nː a d,s a nː i,,tʃ e ɾ i j a,ɾ i k ʋ aː d i,k a n d eː k,c i n,c i r̪ i y a,tʃ i nː a,k eː ɾ uː ɖ ə,k i ɲ a,tʃ e ɾ i j a
78_smoke,h o g e,p ə gː i,m oː ʃ,p o j a,h o g e,p o g e,p o g,p e g u,k u m p oː ɖ,m o s a g a,,p u k a,m oː h a,p o aː g,,p u k a i,p o g a,p u k u ɖ t i,p o g a,p o g e
79_stand,n i pː ə,əː ɭ,s a l i n g,n i l,n i n t i k o,n i n d ə,n iː m aː n,n i nː a t u k ə,n i lː a,i dʒː n a,,n i l k u g a,h i l p o,,n i l p,n i l,n i l tʃ o n u,m u kː a ɖ u ɾ i l,u n t a ɾ a,n i n dʒ o
7_bird,,p i kː i,tʃ o k,p i ʈː ə,h a kː i,p a k ʂ i,p i ʈː a,p a kː i g a ɭ,p i ʈː eː k u,o ɖ a,m i n u,p a k ʂ i,p u dʒ u d u,t i t ə,,p a ɾ a ʋ a i,p a k ʂ i,p a ɾ a ʋ a i,p a kː i,p a k tʃ i
80_star,n a tʃː a t ɾ a,m iː n u,i s ʈ aː ɾ,s u kː u,n a k ʂ a t ɾ,n a k ʂ a t ɾ a,s u kː a,n a k ʂ a ʈ i ɾ a m,u kː a,b iː n k o,h u k a,n a k ʂ a t ɾ a m,b iː n k a,p u ʈ,c u kː a,m iː n̪,n a k ʂ a t ɾ a m u,n a ʈ tʃ a t i ɾ a m,n a k ʂ a t ɾ e,n a tʃː a t i ɾ a
81_stone,k a lː ə,k a lː ə,x a l,b a ɳ ɖ a,k a lː u,k a lː ə,g u n ɖ ə,k a l,ɾ aː j,p a kʰ n a,ʋ a l i,k a lː ə,g u g a,k a n ɖ,k e l,k a lː ə,ɾ aː j i,k a ɾ s,k a lː u,k a lː u
82_sun,o tː ə,p o tː ə,d e,p o ɾ ə,s uː r j a,s uː ɾ j a,s u ɾ i j a,s uː r i j a n,p o ɖ u d u,b iː ɖ i,ʋ e d a,s uː ɾ j a n,b eː ɾ d u,ʋ e l e,,s uː ɾ j a n,s uː ɾ j u ɖ u,s uː ɾ i j a n,s uː ɾ j e,tʃ uː r j a
83_swim,n iː n d ə,n iː n ɖ ʒ u,b e ʂ o l i n g,p o h e m,iː dʒ o,m iː ɾ o d u,p oː n i m,n iː tʃ a l,iː t a,oː g n a,,n e e n t u g a,h oː g p o,,,n e e n t ə,iː d u,n iː tʃ a l,m iː n d a ɾ a,m a ɳ a
84_tail,p aː l ə,b aː l ə,l i ʈː i k,t o k o ɾ,b aː l a,b aː l ə,t oː k a,ʋ aː l ə,t o k aː ɾ,kʰ o l a,,ʋ aː l ə,o l i,k i n d i ɾ,t oː k a,ʋ aː l ə,v aː l a m u,p oː ɾ s a m,b iː l a,b aː l u
85_that,a d ə,a d ə,a e,a d u,aː,a d ə,a d,a dʱ ə,a d d u,h uː,e t,aː,aː d u,a d ə,aː,a n t a,aː,a d ə,a ʋ u,a ʋ eː
86_this,i d ə,i d ə,d aː,i d,i dʱ u,i d ə,i d,i dʱ ə,i d d u,iː d,i d u,iː,iː d u,i d ə,iː,i n t a,iː,i d ə,u n d u,i ʋ eː
87_thou,n i,n iː j ə,n iː,n i mː e,n iː n u,n iː n ə,n iː n u,n iː j a,n i mː a,n iː n,n i n u,n i,n iː n,i n,iː n,n i,n iː ʋ u,n i,i,n i
88_tongue,n aː l a n g e,n e l g i,d u ʋ iː,ʋ e n dʒ e ɾ,n aː l i g e,n aː ʋ u,n aː l k a,n aː l g ə,n aː l i k e,t a kː h a,ʋ e n ɖ aː ɾ u,n aː k ə,t a ɖ t a,n aː n g,n e v ã ɖ,n aː kː ə,n aː l u k a,n oː f,n aː l aː j i,n aː ʋ u
89_tooth,h a lː ə,p a lː ə,d a n d aː n,p a l,h a lː u,p a lː ə,p a l k u,p a l,p a l k,p a lː,p a l u,p a lː ə,p aː l d u,p aː l k i lː,p e l,p a lː ə,p a nː u,p a ɾ s e,k uː l i,p a lː u
8_bite,k a tʃː ə,k a ɖ i,k a a t + k a nː i n g,k a s k,k a ɖ i,k a ɖ i,a t e k a ʂ i n,k a ɖ ə,k o ɾ a k a,kʰ a tʃː n a,k a tʃ i n e,k a d i kː u g a,k oː h i,,k o r k,k a ɖ i,k o ɾ u k u,p a ɾ tʃ i ʈ tʃ i,t i n aː ɾ a,k a ɖ i
90_tree,m o ɾ a,m e ɾ i,d ɾ a h kʰ t,m a ɾ a,m a r a,m a ɾ a,m aː k,m a ɾ a m,m aː ɾ a,m a nː,p a ʈ a,m a ɾ a m,,,m e r i,m a ɾ a m,tʃ e ʈː u,m eː n,m a ɾ a,m a ɾ a
91_two,e ɾ a ɖ ə,ə d d u,i ɾ a t,ɾ e ɳ ɖ u,j e ɾ a ɖ u,d a ɳ ɖ ə,d u ɖ ə,e ɖ u,ɾ e ɳ ɖ,iː r ə b,r i n ɖ a,ɾ e n d ə,p aː n ɖ a,i ɾ u ɖ u,i r,ɾ e n ɖ ə,ɾ e ɳ ɖ u,eː ɖ ə,ɾ a ɖː u,i ɾ a n d ə
92_walk,n a ɖ ə ʋ a d ə,n a ɖ i,tʃ e ɾ ɾ i n g,t a k a,n a ɖ ə,n a ɖ a,n a ɖ u s,n a ɖ ʋ u,n a ɖ a m,eː kʰ n a,,n a ɖ a kː u g a,h eː k p o,,,n a ɖ ə,n a ɖ u tʃ u,n a ɖ a ɾ ɾ ə,n a ɖ a p a ɾ a,n a ɖ a
93_warm,u pː e kː e,s uː ɖ ə,b aː s u n,k aː s t a,b e tʃː a g e,b e kː e,ʋ e kː a,,ʋ eː ɖ,u d u m,,u ʂ ɳ a,k u ɖ n i,ʋ e ʈ a l,,ʋ e d ə ʋ e d ə pː ə,ʋ e tʃː a,k o r t i l i j e,b e tʃː a,b e kː i
94_water,n iː ɾ ə,n iː ɾ ə,d iː r,j e ɾ,n iː ɾ u,n iː ɾ ə,iː ɾ,n iː ɾ,eː ɾ u,a mː,e j u,ʋ e lː a m,h a m d u,n iː r,n iː r,t a ɳ ɳ i,n iː ɾ u,n iː ɾ,n iː ɾ ə,n iː ɾ u
95_we,n a n g a,n a ɳ g ə,n a n,m a mː o ʈ,n aː ʋ u,n a n g a,a m d ə,a mː e,m a n aː ɖ u,n aː m,m a m b u,n aː m,n aː m u,aː m,aː m,n aː m,m a n a m u,oː m,j a n k u l u,n a n g a
96_what,eː n ə,a j i n d i,a n t ə,b a ʈː a l,j eː n u,j e n t ə,e m,e t aː n ə,b aː t a,j eː n d r a,e n a,e n d ə,i n d i ɾ d u,e nː aː ʈ,n aː t o,e nː e,eː m i,i nː o,e n tʃ i n a,e n t a i
97_white,ʋ e ɭː e,b ə ɭː u,p iː u n,t e lː a g,b i ɭ i,b o l t a d ə,t e lː u ɖ i,ʋ e lː ə,t e l u p,p a ɳ ɖ ɾ u,p a n d i,ʋ e ɭ u pː ə,s a d aː,,v i l,v e ɭː ə,v e lː a,p e l t i,b o l d u,b o l t a j i
98_who,t aː ɾ a,d aː ɾ ə,d eː ɾ,b o ɾ,j aː ɾ u,d aː ɾ ə,,d aː ɾ ə,b eː n o n ɖ u,n e,d a a t,aː ɾ ə,n eː d u,,e d,j a a r ə,e v a r u,o ɾ i,j eː ɾ u,j aː ɾ u
99_woman,e mː aː t i,p ə ɳ a kː ə n,n j a a ɽ i,m u ɾ t a d,h e n g a s u,p o nː aː ɭ ə,b aː j i,p e m a g u,n aː t a ʋ aː d,m u kː a,ɖ o l i,p e ɳ ɳ ə,t e l d u,,,p e ɳ,s t ɾ iː,t u s m oː g ə,p o n dʒ a,p a n i tʃ i
9_black,k a pː ə,k a ɾ t ə n u + i p ə d ə,m aː o n,k a ɾ ə,k a pː u,k a ɾ t a d ə,ɖ aː ɾ i a t e,k a ɾ u pː ə,k aː ʈ e,m o kʰ a ɾ o,k a d i a,k a ɾ u pː ə,m a ɖ h a ɾ o,,,k a ɾ ə pː ə,n a l u p u,k a pː ə,k a pː u,k a ɾ t a j i
