Cognate_ID,Anonimo,Apuri,Apurimac,Arma,Atalla,Ayacucho,Azuay,Bobonaza,Cacra-Hongos,Chachapoyas,Chacpar,Chetilla,Chipaya,Curva,Cuzco,CuzquenoAntiguo,Huallaga,Huanca,Huancane,Huangascar,HuarazHuailas,Imbabura,Inkawasi,Iruhito,Jaqaru,Jauja,Kawki,Lamas,Laraos,Lincha-Tana,Maragua,Napo,Pacaraos,Pastaza,Pocona,Puki,Puno,Putumayo,Raimondi,SanPedro,Santiagueno,SantoTomas,Serena,Sullkatiti,Taquile,Tarma,Troje,Tsimu,Wari,Yanac
844_137_sleepto,p u ɲ u + n i,p u ɲ u,p u ɲ u,p u ɲ u,p u ɲ u,p u ɲ u,p u ɲ u + n a,p u ɲ u + n a,p u ɲ u,p u ɲ u,p u n u,p u ɲ u,,p u ɲ u,p u ɲ u,p u ɲ u + n i,p u ɲ u,p u ɲ u,,p u ɲ u,p u ɲ u,p u ɲ u + n a,p u n u,,,p u ɲ u,,p u ɲ u,p u ɲ u,p u ɲ u,p u ɲ u,p u ɲ u + n a,p u ɲ u,p u ɲ u + n a,p u ɲ u,,p u ɲ u,p u ɲ u,p u ɲ u,p u ɲ u,p u ɲ u,p u ɲ u + k u + n i,p u ɲ u,,p u ɲ u,p u n u,p u ɲ u,,p u ɲ u,p u ɲ u
845_137_sleepto,,,,,,,,,,,,,,,,,,,i k i,,,,,,i k i,,i k i,,,,,,,,,i k i,,,,,,,,i k i,,,,,,
848_104_small,,,,,,,,,,,,,,,,,,,h i s kʼ a,,,,,,,,,,,,,,,,,s i kʼ a,,,,,,,,h i s kʼ a,,,,,,
849_76_smoke,k ɔ !s̺/s n i,,q o s ɲ i,χ u s n i,χ u s ɲ i,χ o s n i,k u s n i,k u ʃ n i,,k u s n i,q u ʃ ɲ i,,,qʼ u s ɲ i,qʼ u s ɲ i,k u s n i,,,,,q o s n i,k u ʃ n i,,,,,,k u s n i,q u ʃ n i,,qʼ u s ɲ i,k u ʃ n i,,k u ʃ n i,qʼ u ʃ ɲ i,,qʼ u ʃ ɲ i,k u s n i,q o s n i,,q o s n i,k o s i,k u ʃ ɲ i,,qʼ u s n i,,k u ʃ n i,,q o s n i,
850_76_smoke,,,,,,,,,,,,,,,,,,,h u qʼ i,,,,,,,,,,,,,,,,,h i qʼ i,,,,,,,,h i qʼ i,,,,,,
852_76_smoke,,,,,,,,,,,,,,,,,,,,,,,,,tsʼ u s q i,,ʈʂʼ u s q i,,,,,,,,,,,,,,,,,,,,,,,
855_144_speakto,r i m a + n i,ɾ i m a,r i m a,ɾ i m a,,ɾ i m a,ɾ i m a + n a,r i m a + n a,l i m a,r i m a,,r i m a,,r i m a,r i m a,r i m a + n i,,l i m a,,ɾ i m a,,ɾ i m a + n a,r i m a,,,l i m a,,r i m a,r i m a,l i m a,,r i m a + n a,,ɾ i m a + n a,,,r i m a,r i m a,,ɾ i m a,ɾ i m a,r i m a + n i,r i m a,,r i m a,!ʐ/r i m a,!r̝/r i m a,,,
857_45_breast,k i n tʃ ui,,,,,,q i n ʒ u,,,,,,,,,χ i n tʃ ui,,,,,,,,,,,,,,,,,,,,,,,,,,,,,,,,,,
858_144_speakto,,,,,,,,,,,,,,,,,,,,,,,,,a r u,,a r u,,,,,,,,,,,,,,,,,,,,,,,
859_134_suckto,,,,,,,tʃ u tʃ u + n a,,,,,,,,,,,,,,,,,,,,,,,,,,,tʃ u tʃ u + n a,,,,tʃ u tʃ u + r i,,,,,,,,,tʃ u tʃ u,,,
859_45_breast,,tʃ i tʃ i,,tʃ i tʃ i,,,,tʃ u tʃ u,tʃ i tʃ i,tʃ u tʃ u,tʃ u tʃ u,tʃ u tʃ u,,,,,tʃ u tʃ u,tʃ i tʃ i,,tʃ i tʃ i,,tʃ u tʃ u,,,,tʃ u tʃ u,,tʃ u tʃ u,,tʃ i tʃ i,,tʃ u tʃ u,tʃ u tʃ u,tʃ u tʃ u,,,,tʃ u tʃ u,,tʃ i tʃ i,,,tʃ u tʃ u,,,tʃ u tʃ u,tʃ u tʃ u,,,
860_134_suckto,,,,,,,,,,,,ɲ u ɲ u,,,,,,ɲ u ɲ u,,,,,,,,ɲ u ɲ u,,,,,,,,,,,,,,,ɲ u ɲ u,,,,,,,,,
860_45_breast,,ɲ u ɲ u,ɲ u ɲ u,ɲ u ɲ u,ɲ u ɲ u,ɲ u ɲ u,,,ɲ u ɲ u,ɲ u ɲ u,,,,ɲ u ɲ u,ɲ u ɲ u,,,ɲ u ɲ u,,ɲ u ɲ u,ɳ u ɳ u,,ɲ u ɲ u,,,,,ɲ u ɲ u,ɲ u ɲ u,ɲ u ɲ u,ɲ u ɲ u,,,,ɲ u ɲ u,,ɲ u ɲ u,,ɳ u ɳ u,ɲ u ɲ u,ɲ u ɲ u,ɲ o ɲ o,,,ɲ u ɲ u,,,,ɳ u ɳ u,
863_136_spitto,t ɔ k a + n i,t o q a,,t u χ a,t u χ a,t o χ a,t u k a + n a,,t o q a,t u k a,t u q a,t u ʁ a,,tʰ u q a,tʰ u q a,t u χ a + n i,t u q a,t u ʔ a,,t o q a,t o q a,t u k a + n a,t u ʁ a,,,t u ʔ a,,t u k a,t u q a,t o q a,tʰ u q a,,t o χ a,,tʰ u ʁ a,,tʰ u q a,t u k a,t o q a,t o q a,t o χ a,t u k a + n i,,,tʰ u q a,t o χ a,tʃ u k a,,t o q a,t u q a
864_126_standto,ʃ a j a + k u + n i,ʃ a j a,ʃ a j a,ʃ a j a,ʃ a j a,s a j a,ʃ a j a + n a,ʃ a j a + r i + n a,h a j a,ʃ a j a,ʃ eː,ʃ a j a,,ʃ a j a,ʃ a j a,ʃ a j a + k u + n i,ʃ a j a,s aː,,ʃ a j a + ɾ i,ʃ aː,ʃ a j a + ɾ i + n a,ʃ a j a,,,,,ʃ a j a,ʃ a j a,ʃ a j a + ɾ i,ʃ a j a,ʃ a j a + r i + n a,,ʃ a j a,ʃ a j a,,ʃ a j a,ʃ a j a + k u,ʃ aː + k u,ʃ a j a + ɾ i,ʃ a j a,ʃ a j a + k u + n i,ʃ a j a,,ʃ a j a,ʃ a j a,ʃ a j a,,ʃ aː + k u,ʃ aː
866_43_bellystomach,,,,,,,,,,,,,,,,,,,,,,,,t o χ s i,,,,,,,,,,,,,,,,,,,,,,,,t o χ s i,,
867_70_star,k oi ʎ u r,q oi ʎ u ɾ,,χ ui ʎ u ɾ,,χ oi ʎ u ɾ,k ui ʎ u ɾ,,q oi ʎ u l,,q ui ʎ a !r̥/r,,,q ui ʎ u r,,k ui ʎ u r,q ui ʎ a r,h ui ʎ u r,,,q ai ʎ u ɾ,,,,,h ui ʎ u r,,,q ui ʎ u r,q oi ʎ u ɾ,,,,,,,,,q ai ʎ u ɾ,,q o ʒ u ɾ,k ui ʎ o r,,,q ui ʎ u r,χ oi ʎ a !ʐ/r,,,q ai ʎ u ɾ,
867_80_gold,,,,,,,,,,,,,,,,,,,,,,,,,,,,,,,,,,,,,,,,,,,,,,χ oi ʎ u !ʐ/r,,,,
869_70_star,,,,,,,,,,,,,w a r a + w a r a,,,,,,w a r a + w a r a,,,,,,w a r a + x a,,w a r a + x a,,,,,,,,,w a r a + w a r a,,,,,,,,w a r a + w a r a,,,,,,
86_113_empty,,,,,,,,,,,,,,,,,,,tʃʼ u s a,,,,,,,,,,,,,,,,,tʃʼ u s a,,,,,,,,tʃʼ u s a,,,,,,
870_70_star,,,,,,,,,,,,,,,tʃʼ a s k a,,,,,,,,,,,,,,,,tʃʼ a s k a,,,,tʃʼ a s k a,,tʃʼ a s k a,,,,,,,,,,,,,
871_78_stone,r u m i,ɾ u m i,r u m i,ɾ u m i,r u m i,ɾ u m i,ɾ u m i,r u m i,l u m i,r u m i,r u m i,r u m i,,r u m i,r u m i,r u m i,r u m i,l u m i,,ɾ u m i,ɾ u m i,ɾ u m i,!r̝/r u m i,,,l u m i,,r u m i,r u m i,l u m i,!r̝/r u m i,r u m i,r u m !ai/i,ɾ u m i,r u m i,,r u m i,r u m i,ɾ u m i,ɾ u m i,ɾ u m i,r u m i,r u m i,,r u m i,!ʐ/r u m i,r u m i,,ɾ u m i,r u m i
872_78_stone,,,,,,,,,,,,,m a z,,,,,,,,,,,m a s i,,,,,,,,,,,,,,,,,,,,,,,,m aː s i,,
873_78_stone,,,,,,,,,,,,,,,,,,,q a l a,,,,,,q a l a,,q a l a,,,,,,,,,q a l a,,,,,,,,q a l a,,,,,,
874_31_tooth,,,,,,,,,,,,,i z h q i,,,,,,,,,,,iː s k i,,,,,,,,,,,,,,,,,,,,,,,,iː s k eː,,
875_134_suckto,,ʃ o q u,,s u χ u,s u χ u,s o χ o,,,ʃ o q u,ç u k u,ʃ u q u,,,,,,ʃ u q u,ʃ o q u,,ʃ o q u,ʃ o q u,,ʃ u ʁ u,,,ʃ o q u,,ç u k u,ʃ u q u,ʃ o q u,,,ç o χ u,,,,,,ʃ o q u,ʃ o q u,,s u qʼ u + n i,,,,ç o χ u,,,ʃ o q u,ʃ u q u
876_134_suckto,,,,,,,,,,,,,,,,,,,tʃʼ u m u,,,,,,,,,,,,,,,,,tʃʼ u m a,,,,,,,,tʃʼ a m u,,,,,,
878_43_bellystomach,,,,,,,,,,,,,,,,,,,p u r a + k a,,,,,,pʰ u ʈʂ a + k a,,pʰ u ʈʂ a + k a,,,,,,,,,p u r a + k a,,,,,,,,p u r a + k a,,,,,,
879_68_sun,i n t i,i n t i,i n t i,i n t i,i n t i,i n t i,i n t i,i n d i,i n t i,i n d i,i n t i,,,i n t i,i n t i,i n t i,i n t i,i n t i,,i n t i,i ɲ t i,i n t i,,,,i n t i,,i n d i,i n t i,i n t i,i n t i,i n d i,,i n d i,i n t i,,i n t i,i n d i,i ɲ t i,i n t i,i n t i,i n d i,i n d i,,i n t i,i n t i,i n t i,,i ɲ t i,
87_119_dry,,,,,,,,,,,,,,,,,,,w a ɲ a,,,,,,,,,,,,,,,,,w a ɲ a,,,,,,,,w a ɲ a,,,,w a ɲ a,,
880_68_sun,,,,,,,,,,,,r u p ai,,,,,,,,,,,r u p ai,,,,,,,,,,r u p ai,,,,,,,,,,,,,,,,,r u p eː
881_68_sun,,,,,,,,,,,,,tʰ u ɲ i,,,,,,,,,,,t h uː ɲ i,,,,,,,,,,,,,,,,,,,,,,,,t uː n i,,
883_120_sweet,m i !s̺/s k i,m i ʃ k i,m i s k i,m i s k i,m i s k i,m i s k i,m i ʃ k i,m i ʃ k i,m i ʃ k i,m i s k i,m i ʃ k i,m i ʃ k i,,m i s kʼ i,m i s kʼ i,m i s χ i,m i ʃ k i,m i ʃ k i,,m i ʃ k i,m i ʃ k i,m i ʃ k i,,,,m i ʃ k i,,m i s k i,m i ʃ k i,m i ʃ k i,m i s kʼ i,m i ʃ k i,m i ç k i,m i ʃ k i,m i s kʼ i,,m i s kʼ i,m i s x i,m i ʃ k i,m i ʃ k i,m i ʃ k i,m i s k i,m i ʃ k i,,m i s kʼ i,m i ç g i,m i ʃ k i,,m i ʃ k i,m i ʃ k i
884_120_sweet,ɲ u k ɲ u,,,,,,,,,,,,,,,ɲ u k ɲ u,,,,,,,ɲ u k ɲ u,,,,,,,,,,,,,,,,,,,,,,,,,,,
885_43_bellystomach,,,,,,,,,,,,,,,,,,,,,,,,tʃ eː r i,,,,,,,,,,,,,,,,,,,,,,,,tʃ iː r i,,
886_128_swimto,w ai t a + n i,,,,,,,w ai t a + n a,,w ai t a,,,,,w ai t a,w ai t a + n i,,,,,,,,,,,,w ai t a,,,w ai tʼ a,w ai t a + n a,,w ai t a + n a,w ai tʼ a,,,w ai t a,,,w ai t a,w ai t a + n i,w ai t a,,,,,,,
887_128_swimto,,,,,,,w a m b u + n a,,,,,,,,,,,,,,,w a m b u + n a,,,,,,,,,,,,,,,,,,,,,,,,,w a m b u,,,
887_129_flyto,,,,,,,,w a m b u + r i + n a,,,,,,,,,,,,,,,,,,,,,,,,w a m b u + r i + n a,,,,,,,,,,,w a m b u + r i,,,,,,,
888_128_swimto,,,,,,,,,,,,,,,,,,,,,,,,,,,,,,,,,,,,t ui t u,t u j u,,,,,,,t u j u,,,,,,
891_55_tail,tʃ u p a,ʈ u p a,tʃ u p a,tʃ u p a,tʃ u p a,tʃ u p a,tʃ u p a,tʃ u p a,ʈ u p a,ʈʂ u p a,tʃ u p a,ʈʂ u p a,,tʃ u p a,tʃ u p a,tʃ u p a,tʃ u p a,ʈʂ u p a,,ʈ u p a,tʃ u p a,tʃ u p a,ʈʂ u p a,,,ʈʂ u p a,,tʃ u p a,ʈʂ u p a,ʈ u p a,tʃ u p a,tʃ u p a,ʈʂ u p a,tʃ u p a,tʃ u p a,,tʃ u p a,tʃ u p a,tʃ u p a,ʈ u p a,tʃ u p a,tʃ u p a,tʃ u p a,,tʃ u p a,ʈʂ u b a,tʃ u p a,,tʃ u p a,ʈʂ u p a
892_55_tail,,,,,,,,,,,,,kʰ u r z,,,,,,,,,,,k u r s,,,,,,,,,,,,,,,,,,,,,,,,k u r s,,
893_55_tail,,,,,,,,,,,,,,,,,,,w i tʃʼ i n k a,,,,,,w i tʃʼ a n k u,,w i ʈʂʼ i n g a,,,,,,,,,w i tʃʼ i n kʰ a,,,,,,,,w i tʃʼ i n kʰ a,,,,,,
895_10_ten,tʃ u n k a,ʈ u n k a,tʃ u n k a,tʃ u n k a,tʃ u n k a,tʃ u n k a,tʃ u n g a,tʃ u n g a,ʈ u n k a,ʈʂ u n g a,tʃ u n k a,ʈʂ u n g a,,tʃ u n k a,tʃ u n k a,tʃ u n k a,tʃ u n k a,ʈʂ u n k a,,ʈ u n k a,tʃ u ɲ k a,tʃ u n g a,,,,ʈʂ u n k a,,tʃ u n g a,ʈʂ u n k a,ʈ u n k a,tʃ u n k a,tʃ u n g a,ʈʂ u ŋ k a,tʃ i n g u,tʃ u n k a,,tʃ u n k a,tʃ u n g a,tʃ u ɲ k a,ʈ u n k a,tʃ u ŋ k a,tʃ u n k a,tʃ u n g a,,tʃ u n k a,ʈʂ u ŋ k a,tʃ u n g a,,tʃ u ɲ k a,ʈʂ u n k a
897_10_ten,,,,,,,,,,,,,,,,,,,,,,,,k aː l oː,,,,,,,,,,,,,,,,,,,,,,,,kʰ aː r o,,
898_143_thinkoveraboutto,,,,,,,,,,,,,,,,,,,a m ui + tʼ a,,,,,,,,,,,,,,,,,a m ui + tʼ a,,,,,,,,a m ui + tʼ a,,,,,,
899_143_thinkoveraboutto,j u j a + n i,j u j a,j u j a,j u j a,j u j a,j u j a,j u j a + n a,j u j a + n a,j u j a,j u j a,,j u j a,,,j u j a,j u j a + n i,,,,j u j a,,j u j a + n a,,,,,,j u j a,,j u j a,,j u j a + n a,,j u j a + r i + n a,,,j u j a,j u j a,,j u j a,,j u j a + n i,j u j a,,j u j a,,j u j a,,,
89_43_bellystomach,w i k s a,w i k s a,w i k s a,w i k s a,w i k s a,w i k s a,w i χ a,w i k s a,w i k s a,w i k s a,,,,w i x s a,w i x s a,w i k s a,,,,w i k s a,,w i k s a,,,,,,w i k s a,w i k s a,w i k s a,w i x s a,w i k s a,,w i k s a,w i s a,,w i k s a,w i x s a,,w i k s a,w i x s a,w i k s a,i k s a,,w i s a,,w i x s a,,,
900_143_thinkoveraboutto,,,,,,,,,,,j a r p a,,,j a r p a,,,j a r p a,,,,j a ɾ p a,,j a r p a,,,j a l p a,,,j a r p a,,,,j a ɾ p a,,,,,,j a ɾ p a,,,,,,,j a ɾ b a,,,j a ɾ p a,j a r p a
902_61_brothermans,w au k e,w au q i,w au q e,w au χ i,w au χ i,w au χ e,w au k i,w au k i,w au q i,w au k i,w au q i,,,w au q i,w ai q i,w au χ i,w au q i,w au ʔ i,,w au q i,w au q i,w au k i,,,,w au ʔ i,,w au k i,w au q i,w au q i,,w au k i,w au χ e,w au k i,,,,w au x i,w au q i,w au q e,w au q ɪ,w au q i,w au k i,,w ai q i,w au χ e,w au k i,,w au q i,
902_62_brotherwomans,,,,,,,,,,,,,,,,,,,,,,w au k i,,,,,,,,,,,,,,,,,,,,,,,,,,,,
903_143_thinkoveraboutto,,,,,,,,,,,,,,,,,,,,,,,,,,,,,,,tʼ u k u,,,,tʼ u k u,,,,,,,,,,,,,,,
904_61_brothermans,,,,,,,,,,,,,,,,,,,h i l a,,,,,,,,,,,,,,,,,h i l a,,,,,,,,h i l a,,,,,,
904_62_brotherwomans,,,,,,,,,,,,,,,,,,,h i l a,,,,,,,,,,,,,,,,,h i l a,,,,,,,,h i l a,,,,,,
905_61_brothermans,,,,,,,,,,,,,,,,,,,,,,,,tʃ i ʃ,,,,,,,,,,,,,,,,,,,,,,,,ts i s i,,
905_62_brotherwomans,,,,,,,,,,,,,,,,,,,,,,,,tʃ i ʃ,,,,,,,,,,,,,,,,,,,,,,,,ts i s i,,
907_61_brothermans,,,,,,,,,,,,,,,,,,,,,,,,,q u n ts a,,q u n ts a,,,,,,,,,,,,,,,,,,,,,,,
908_19_this,k ai,k ai,k ai,k ai,k ai,k ai,k ai,k ai,k ai,k ai,k eː,k ai,,k ai,k ai,k ai,k ai,k ai,,k ai,,k ai,k ai,,,k ai,,k ai,k ai,k ai,k ai,k ai,k ai,k ai,k ai,,k ai,k ai,,k ai,k ai,k ai,k ai,,k ai,k ai,k ai,,,k eː
90_33_elbow,k u tʃ u tʃ,k u ʈ u ʃ,,k u tʃ u s,k u tʃ u s,k u tʃ u s,,,k u ʈ u ʃ,k u ʈʂ u ʃ,,,,,,k u tʃ u tʃ,,k u ʈʂ u ʂ,,k u ʈ u ʃ,,,,,,k u ʈʂ u ʂ,,k u ʈʂ u ʃ,k u ʈʂ u ʃ,k u ʈ u ʃ,,,k u ʈʂ u ʃ,,,,,,,k u ʈ u ʃ,,k u tʃ u χ,,,,k u ʈʂ u ʂ,,,,
910_15_thouyousg,k a m,q a m,q a n,χ a m,χ a m,χ a m,k a n,k a n,q a m,k a m,q a m,q a m,,q a n,q a n,k a m,q a m,q a m,,q a m,q a m,k a n,x a m,,,q a m,,k a m,q a m,q a m,q a n,k a n,ʁ a m,k a n,ʁ a n,,q a n,k a m,q a m,q a m,q a m,k a m,k a n,,q a n,χ a m,k a n,,q a m,q a m
911_15_thouyousg,,,,,,,,,,,,,,,,,,,h u m a,,,,,,h u m a,,h u m a,,,,,,,,,h u m a,,,,,,,,h u m a,,,,,,
912_3_three,k i m s a,k i m s a,k i n s a,k i m s a,k i m z a,k i m s a,k i m s a,k i m s a,k i m s a,k i m s a,k i m a,k i m s a,,k i m s a,k i n s a,χ i m s a,k i m s a,k i m s a,,k i m s a,k i m a,k i m s a,k i m s a,,,k i m s a,,k i m s a,k i m s a,k i m s a,k i n s a,k i m s a,k i m a,k i m s a,k i n s a,,k i m s a,k i m s a,k i m s a,k i m s a,k i m s a,k i m s a,k i n s a,,k i m s a,k i m a,k i m s a,,k i m s a,k i n s a
913_40_bone,,,,,,,,,,,,,,,,,,,tʃʼ a kʰ a,,,,,,tsʼ aː k a,,tsʼ aː k a,,,,,,,,,tʃʼ a kʰ a,,,,,,,,tʃʼ a kʰ a,,,,,,
914_3_three,,,,,,,,,,,,,tʃ h e p,,,,,,,,,,,tʃ eː p,,,,,,,,,,,,,,,,,,,,,,,,,,
916_110_tire,!s̺/s ai k u + n i,,s ai kʼ u,s ai k a,,,ʃ ai k u + tʃ i + n a,,,ç ai k u,,ʃ ai k u,,s ai kʼ u,s ai kʼ u,s ai k u + n i,,,,,,ʃ ai x u + ʃ k a,ʃ ai k u,,,,,ç ai k u,ʃ ai k u,,s ai kʼ u,,,ʃ ai k u + n a,s ai kʼ u,,s ai kʼ u,s ai k u + r i,,,s ai k u s,s ai k u + n i + w i,,,s ai kʼ u,ç ai g u,ʃ ai k u,,,ʃ eː k u
917_110_tire,,p i ʃ i p a,p i s i p a,,p i s i p a,p i s i p a,,,p i ʃ i p a,,p i ʃ i p a,,,,,,p i ʃ i p a,p i ʃ i p a,,p i ʃ i p a,p i ʃ i p aː,,,,,p i ʃ i p a,,,,p i ʃ i p a,,,p i ç i k aː,,,,,,p i ʃ i p aː,p i ʃ i p a,,,,,,,,,p i ʃ i p aː,
919_110_tire,,,,,,,,,,,,,,,,,,,q a r i x j a t a,,,,,,,,,,,,,,,,,q a r i,,,,,,,,q a r i,,,,,,
91_43_bellystomach,,,,,,,,,,,p a tʃ a,p a ʈʂ a,,,,,p a tʃ a,p a t a,,,p a tʃ a,,p a ʈʂ a,,,p a t a,,,,,,,p a ʈʂ a,,,,,,p a tʃ a,,,,,,,p a ʈʂ a,,,p a tʃ a,p a ʈʂ a
920_37_leg,,,,,,,,,,,,,,,,,,,,,,,,,,,,,,,,,,,,tʃ a r a,,,,,,,,tʃ a r a,,,,ts aː r a,,
921_30_tongue,k a ʎ u,q a ʎ u,q a ʎ u,χ a ʎ u,χ a ʎ u,χ a ʎ u,k a ʎ u,k a ʎ u,q a ʎ u,k a dʑ u,q a ʎ u,q a dʑ u,,q a ʎ u,q a ʎ u,k a ʎ u,q a ʎ u,h a ʎ u,,q a ʎ u,q a ʎ u,x a ʎ u,q a dʒ u,,,h a ʎ u,,k a dʑ u,q a ʎ u,q a ʎ u,q a ʎ u,k a ʎ u,ʁ a ʎ u,k a ʎ u,ɢ a ʎ u,,q a ʎ u,k a ʎ u,q a ʎ u,q a ʎ u,q a ʒ u,q a ʎ u,k a ʎ u,,q a ʎ u,χ a ʎ u,kʰ a ʒ u,,q a ʎ u,q a ʎ u
922_30_tongue,,,,,,,,,,,,,,,,,,,l a χ r a,,,,,,n a x r a,,n i x r a,,,,,,,,,l a χ r a,,,,,,,,l a χ r a,,,,,,
923_31_tooth,k i r u,k i ɾ u,k i r u,k i ɾ u,k i r u,k i ɾ u,k i ɾ u,k i r u,k i l u,k i r u,k i r u,k i r u,,k i r u,k i r u,χ i r u,k i r u,k i l u,,k i ɾ u,k i ɾ u,k i ɾ u,k i r u,,,k i l u,,k i r u,k i r u,k i ɾ u,k i r u,k i r u,k i ɾ u,k i r u,k i r u,,k i r u,x i r u,k i ɾ u,k i ɾ u,k i ɾ u,k e r o,k i r u,,k i r u,k i ɾ u,k i r u,,k i ɾ u,k i r u
924_31_tooth,,,,,,,,,,,,,,,,,,,l a k a,,,,,,,,,,,,,,,,,l a k a,,,,,,,,l a k a,,,,,,
925_66_day,,,,,,,,,,,,,,,,,,,,,,,,m a χ e ɲ i,,,,,,,,,,,,,,,,,,,,,,,,m a χ e ɲ a,,
926_36_foot,tʃ a k i,ʈ a k i,tʃ a k i,tʃ a k i,tʃ a k i,tʃ a k i,tʃ a k i,tʃ a k i,ʈ a k i,ʈʂ a k i,tʃ a k i,ʈʂ a k i,,tʃ a k i,tʃ a k i,tʃ a χ i,tʃ a k i,ʈʂ a k i,,ʈ a k i,tʃ a k i,tʃ a k i,ʈʂ a k i,,,ʈʂ a k i,,tʃ a k i,ʈʂ a k i,ʈ a k i,tʃ a k i,tʃ a k i,ʈʂ a k i,tʃ a k i,tʃ a k i,,tʃ a k i,tʃ a x i,tʃ a k i,ʈ a k i,tʃ a x i,tʃ a k i,tʃ a k i,,tʃ a k i,ʈʂ a g i,tʃ a k i,,tʃ a k i,ʈʂ a k i
926_37_leg,,ʈ a k i,,,,,,,ʈ a k i,,,,,tʃ a k i,tʃ a k a,,,,,ʈ a k i,,,,,,,,,,ʈ a k i,tʃ a k i,,,,tʃ a k i,,tʃ a k i,,,ʈ a k i,,tʃ a k i,,,tʃ a k i,,,,,
928_89_tree,h a tʃ a,,s a tʃ a,,s a tʃ a,s a tʃ a,,,,,h a tʃ a,,,s a tʃʼ a,,h a tʃʰ a,,h a ʈʂ a,,,,,,,,s a ʈʂ a,,,,,s a tʃʼ a,,,,s a tʃʼ a,,,s a tʃ a,,,,s a tʃ a,,,s a tʃʼ a,,,,,a ʈʂ a
928_91_branch,,,,,,,,,,,,,,,,,,,,,,,,,,,,,,,,,,,,,,,,,,,,,s a tʃʼ a n,,,,,a ʈʂ a
929_89_tree,,,,,,,j u ɾ a,r u j a,,j u r a,,,,,,,,,,,,j u ɾ a,,,,,,j u r a,,,,r u j a,,,,,,,,,,,j u r a,,,,j u r a,,,
929_92_leaf,,j u ɾ a,,,,,,,,,,,,,,,,,,j u ɾ a,,,,,,,,,,,,,,,,,,,,,,,,,,,,,,
92_33_elbow,,,,,,,,,,,,,,,,,,,,,,,,,ʃ i n k ai + p i,,ʃ u n k ai + p i,,,,,,,,,,,,,,,,,,,,,,,
932_89_tree,,,,,,,,,,,,,,,,,,,,,,,,,,,,,m u n t i,,,,,,,,,,,,,,,,,,,,m u n t i,
935_2_two,i s!s̺/s a k ai,i ʃ k ai,i s k ai,i s k ai,i s k ai,i s k ai,i ʃ k ai,i s k ai,i ʃ k ai,i ç k ai,i ʃ k eː,i s k ai,,i s k ai,i s k ai,i s k ai,i s k ai,i ʃ k ai,,i ʃ k ai,i ʃ k ai,i ʃ k ai,i s k ai,,,i ʃ k ai,,i ç k ai,i ʃ k ai,i ʃ k ai,i s k ai,i ʃ k ai,i ç k ai,i ʃ k ai,i s k ai,,i s k ai,i s k ai,i ʃ k ai,i ʃ k ai,i ʃ k ai,i s k ai,i ʃ k i,,i s k ai,i ç g ai,i ʃ k i,,i ʃ k ai,i ʃ k eː
936_2_two,,,,,,,,,,,,,,,,,,,p a j a,,,,,,p a x a,,p a x a,,,,,,,,,p a j a,,,,,,,,p a j a,,,,p aː t i,,
938_125_walkto,p u r i + n i,,p u r i,p u ɾ i,p u r i,p u ɾ i,p u ɾ i + n a,p u r i + n a,,p u r i,p u r i,p u r i,,p u r i,p u r i,p u r i + n i,p u r i,p u l i,,,p u ɾ i,p u ɾ i + n a,p u r i,,,p u l i,,p u r i,p u r i,,p u r i,p u r i + n a,p u ɾ i,p u r i + n a,p u r i,,p u r i,p u r i,p u ɾ i,,p u ɾ iː,p o r i + n i + w i,p u r i,,p u r i,p u ɾ i,p u r i,,p u ɾ i,p u r i
938_96_road,,,,,,,,,,,,,,,,,,p u l i + n a,,,,,,,,,,,,,,,,,,,,,,,,,,,,,,,,
940_125_walkto,,,,,,,,,,,,,,,,,,,s a r + n a + q a,,,,,,,,,,,,,,,,,s a r + n a + q a,,,,,,,,s a r + n a + q a,,,,,,
941_125_walkto,,,,,,,,,,,,,,,,,,,,,,,,,w a s a,,w a s a,,,,,,,,,,,,,,,,,,,,,,,
942_61_brothermans,,,,,,,,,,,,,,,,,,,,,,,,,,,,,,,,,,,,,t u r a,,,,,,,,,,,,,
942_62_brotherwomans,,t u ɾ i,t o r ai,t u ɾ i,t u r i,t u ɾ i,t u ɾ i,t u r i,t u l i,t u r i,t u r i,t u r i,,t u r a,t u r a,,t u r i,t u l i,,t u ɾ i,t u ɾ i,,,,,t u l i,,t u r i,t u r i,t u ɾ i,,t u r i,t u ɾ i,t u r i,,,t u r a,t u r i,t u ɾ i,t u ɾ i,t u ɾ a,t o r a,t u r i,,t u r a,t u ɾ i,t u r i,,t u ɾ i,t u r i
942_63_sistermans,t u r a,,,,,,,,,,,,,,,t u r a,,,,,,,,,,,,,,,,,,,,,,,,,,,,,,,,,,
943_117_warmhotsw,r u p a k,,,,,,,r u p a,,,,,,,,r u p a k,,,,,,,,,,,,,,,,r u p a,,ɾ u p a,r u pʰ a,,,r u p a,,,ɾ u p a χ,r u p ai,r u p a k,,,,,,,
944_117_warmhotsw,k ɔ ɲ i,q o n i,q o ɲ i,χ u ɲ i,χ u n i,χ o ɲ i,k u n u g,,q o n i,k u ɲ u,,q u ɲ u χ,,,qʼ u ɲ i,χ u ɲ i,,,,q o n i,,,χ u ɲ u χ,,,,,k u ɲ u,,q o n i,qʼ u ɲ i,,χ o ɲ u,,,,qʼ u ɲ i,k u n u,,q o n i,,,,,,χ o n u,k u n u x,,,
945_117_warmhotsw,,,,,,,,,,,,,,,,,,,h u n tʼ u,,,,,,h u n ʈʂʼ u,,h u n ʈʂʼ u,,,,,,,,,h u n tʼ u,,,,,,,,h u n tʼ u,,,,,,
947_117_warmhotsw,,,,,,,,,,,,,,,,,,,,,,,,ʃ iː,,,,,,,,,,,,,,,,,,,,,,,,s iː j a,,
948_35_back,,,,,,,,,,,w a x t a,w a x t a,,,,,w a χ t a,,,,w a q t a,,w a χ t a,,,,,,,,,,,,,,,,w a q t a,,,w a k t a,,,,,,,w a q t a,w a q t a
949_72_water,,,,,,,,,,,,,qʰ w a z,,,,,,,,,,,qʰ o a s i,,,,,,,,,,,,,,,,,,,,,,,,h u aː s e,,
94_12_righthandside,,,,,,,,,,,,,,,,,,,,,,,,,,,,,,,,,,,,,,,,,,,,,,,,h u i l i + h a l a n t a + h a l a n t a,,
94_13_lefthandside,,,,,,,,,,,,,,,,,,,,,,,,,,,,,,,,,,,,,,,,,,,,,,,,h u iː l i + h a l a n t a,,
950_72_water,u n u,,u n u,,,,,,,,,,,u n u,u n u,u n u,,,,,,,,,,,,,,,,,,,,,u n u,,,,,h u n o,,,u n u,,,,,
952_14_weinclusive,ɲ ɔ k a n tʃ i k,n o q a n tʃ i k,ɲ o q a n tʃ i s,ɲ u χ a n tʃ i k,ɲ u χ a n tʃ i k,ɲ o χ a n tʃ i k,ɲ u q a n tʃ i,ɲ u k a n tʃ i,ɲ o q a n tʃ i k,ɲ u k a n tʃ i,n u q a n ts i χ,n u ʁ a n dʒ i ʁ,,ɲ u q a n tʃ i s,n u q a n tʃ i s,ɲ u k a n tʃ i k,n u q a n tʃ i,,,ɲ o q a n tʃ i k,ɲ o q a ɲ ts i,ɲ u k a n tʃ i k,n u ʁ a n tʃ i,,,,,ɲ u k a n tʃ i,n u q a n tʃ i k,ɲ o q a n tʃ i k,n u q a n tʃ i s,ɲ u k a n tʃ i,ɲ o χ a n s i,n u k a n tʃ i,n u ʁ a n tʃ i χ,,n u q a n tʃ i s,n u k a n tʃ i,ɲ o q a ɲ ts i,ɲ o q a n tʃ i k,,ɲ o k a n tʃ i k,ɲ u k a n tʃ i,,ɲ u q a n tʃ i s,n o χ a ɲ tʃ i,ɲ u k a n tʃ i x,,ɲ o q a ɲ ts i,ɲ u q a n ts i k
953_14_weinclusive,,,,,,,,,,,,,u ʈʂ u m,,,,,,,,,,,,,,,,,,,,,,,,,,,,,,,,,,,,,
954_14_weinclusive,,,,,,,,,,,,,,,,,,,h i w a s a,,,,,,h i w s a,,h i w s a,,,,,,,,,h i w a s a,,,,,,,,h i w a s a,,,,,,
955_17_what,i m a,i m a,i m a,i m a,i m a,i m a,i m a,i m a,i m a,i m a,i m a,i m a,,i m a,i m a,i m a,i m a,i m a,,i m a,i m a,i m a,i m a,,,i m a,,i m a,i m a,i m a,i m a,i m a,i m a,i m a,i m a,,i m a,i m a,i m a,i m a,i m a,i m a,i m a,,i m a,i m a,i m a,,i m a,i m a
957_17_what,,,,,,,,,,,,,,,,,,,k u n a,,,,,,,,,,,,,,,,,k u n a,,,,,,,,k u n a,,,,,,
958_33_elbow,,,,,,,,,,,,,,m u χ ʎ i,,,,,m u x ʎ i,,,,,,,,,,,,,,,,,m u χ ʎ i,,,,,,,,m u x ʎ i,,,,,,
959_98_white,j u r a k,j u ɾ a q,j u r a q,j u ɾ a χ,r u j a χ,j u ɾ a χ,j u ɾ a g,r u j a χ,j u l a q,j u r a k,j u l a x,j u r a q,,j u r a χ,j u r a χ,j u r a k,j u r a χ,j u l a ʔ,,j u ɾ a q,j u l a q,j u ɾ a x,j u r a q,,,j u l a ʔ,,j u r a k,j u r a χ,j u ɾ a q,j u r a χ,r u j a χ,j u ɾ a χ,j u r a,j u r a χ,,j u r a χ,j u r a,j u ʎ a q,j u ɾ a q,j u ɾ a χ,j u r a k,j u r a x,,j u r a χ,j u ɾ a χ,j u r a x,,j u ɾ a q,j u r a q
961_98_white,,,,,,,,,,,,,,,,,,,h a n qʼ u,,,,,,h a n qʼ u,,h a n qʼ u,,,,,,,,,h a n qʼ u,,,,,,,,h a n qʼ u,,,,,,
962_18_who,p i,p i,p i,p i,p i,p i,p i,,p i,p i,p i,p i,,p i,p i,p i,p i,p i,,p i,p i,p i,p i,,,p i,,p i,p i,p i,p i,,p i,p i,p i,,p i,p i,p i,p i,p i + t a χ,p i,p i,,p i,p i,p i,,p i,p i
963_18_who,,,,,,,,m ai k a n,,,,,,,,,,,,,,,,,,,,,,,,m ai k a n,,,,,,,,,,,,,,,,,,
965_18_who,,,,,,,,,,,,,,,,,,,,,,,,,q a tʃ i,,q a tʃ i,,,,,,,,,,,,,,,,,,,,,,,
967_83_wind,w ai r a,w ai r a,w ai r a,w ai ɾ a,w ai r a,w ai ɾ a,w ai ɾ a,w ai r a,w ai l a,w ai r a,,w ai r a,,w ai r a,w ai r a,w ai r a,,w ai w a,,w ai ɾ a,,w ai ɾ a,w ai r a,,,w ai w a,,w ai r a,w ai r a,w ai ɾ a,w ai r a,w ai r a,,w ai r a,w ai r a,,w ai r a,w ai r a,,w ai ɾ a,w ai ɾ a,w ai r a,w ai r a,,w ai r a,,w ai r a,,,w eː r a
970_33_elbow,,,,,,,ɾ i g ɾ a + m u k u,r i g r a + m u k u,,,,,,,,,,,,,,ɾ i g ɾ a + m u k u,,,,,,,,,,r i g r a,,,,,,,,,,,,,,,,,,
970_56_wing,r i k r a,ɾ i k ɾ a,,ɾ i k ɾ a,,,,r i g r a,ʃ i k l a,r i k r a,,,,l i x r a,,r i k r a,,,,ɾ i k ɾ a,r i k r a,,,,,,,r i k r a,l i k r a,l i k l a,l i x r a,r i g r a,,ɾ i g r a,l i χ r a,,r i x r a,,r i k r a,ɾ i k ɾ a,l i x ɾ a,r i k r a,,,r i x r a,,,,r i k r a,
970_91_branch,,,,,,,,,,,,r i k r a,,,,,,,,,,,r i k r a,,,,,,,,,,,,,,,,,,,,,,,,,,,
972_56_wing,,,,,,,,,,,,,,,,,,,,,,,,,k aː k a,,k aː k a,,,,,,,,,,,,,,,,,,,,,,,
973_56_wing,,,,,,,,,,,,,,,,,,,tʃʰ i qʰ a,,,,,,,,,,,,,,,,,tʃʰ i qʰ a,,,,,,,,tʃʰ i qʰ a,,,,,,
976_20_with,w a n,w a n,w a n,,w a n,w a ŋ,w a n,,w a n,,w a n,w a n,,w a n,w a n,w a n,w a n,,,w a n,,,w a n,,,,,,w a n,w a n,w a n,,,,w a n,,w a n,,,,a n,w a m,w a,,w a n,,w a n,,w a ɲ,w a n
977_20_with,,,,,,,,,,,,,z h t a n,,,,,,,,,,,,,,,,,,,,,,,,,,,,,,,,,,,,,
978_20_with,,,,,,,,,,,,,,,,,,,m p i,,,,,,,,,,,,,,,,,,,,,,,,,m p i,,,,,,
979_20_with,,,,,,,,,,,,,,,,,,,,,,,,,w ʃ q a,,w ʃ q a,,,,,,,,,,,,,,,,,,,,,,,
97_120_sweet,,,,,,,,,,,,,,,,,,,m u χ s a,,,,,,m u x s a,,m u s a,,,,,,,,,m u s qʼ a,,,,,,,,m u χ s a,,,,,,
981_82_cloud,p u j u,p u j u,p u j u,p u j u,p u j u,p u j u,p u j u,p u j u,,p u j u,,,,pʰ u j u,pʰ u j u,p u j u,,,,p u j u,,f u j u,,,,,,p u j u,,,pʰ u j u,p u j u,,p u j u,pʰ u j u,,pʰ u j u,p u j u,,p u j u,p u j u,p u j u,p u j u,,pʰ u j u,,pʰ u j u,,,
982_105_youngfemale,,,,,,,,,,,,,,,,,,,,,,w a ɾ m i,,,,,,,,,,,,,,,,,,,,,,,,,,,,
982_59_woman,w a r m i,w a ɾ m i,w a r m i,w a ɾ m i,w a r m i,w a ɾ m i,w a ɾ m i,w a r m i,w a l m i,w a r m i,w a r m i,w a r m i,,w a r m i,w a r m i,w a r m i,w a r m i,w a l m i,,w a ɾ m i,w a ɾ m i,w a ɾ m i,w a r m i,,,w a l m i,,w a r m i,w a r m i,w a ɾ m i,w a r m i,w a r m i,w a ɾ m i,w a r m i,w a r m i,,w a r m i,w a r m i,w a ɾ m i,w a ɾ m i,w a ɾ m i,w a r m e,w a r m i,,w a r m i,w a ɾ m i,w a r m i,,w a ɾ m i,w a r m i
983_82_cloud,,,,,,,,,,,,,,,,,,,q i n a j a,,,,,,,,,,,,,,,,,q i n a j a,,,,,,,,q i n a j a,,,,,,
984_82_cloud,,,,,,,,,,,,,ts h i r i,,,,,,,,,,,ts iː r iː,,,,,,,,,,,,,,,,,,,,,,,,,,
987_51_worm,k u r u,u ɾ u,u r u,u ɾ u,k u r u,u ɾ u,k u ɾ u,k u r u,u l u,k u r u,k u r u,k u r u,,k u r u,k u r u,k u r u,k u r u,k u l u,,u ɾ u,k u ɾ u,,,,,k u l u,,k u r u,k u r u,u ɾ u,kʰ u r u,k u r u,k u ɾ u,k u r u,kʰ u r u,,k u r u,k u r u,k u ɾ u,u ɾ u,k u ɾ u,k u r o,k u r u,,k u r u,k u ɾ u,kʰ u r u,,k u ɾ u,k u r u
988_51_worm,,,,,,,,,,,,,,,,,,,,,,,,,ɲ i qʼ u,,ɲ i qʼ u,,,,,,,,,,,,,,,,,,,,,,,
989_11_year,w a t a,w a t a,w a t a,w a t a,w a t a,w a t a,w a t a,w a t a,w a t a,w a t a,w a t a,w a t a,,w a t a,w a t a,w a t a,w a t a,w a t a,,w a t a,w a t a,w a t a,,,,w a t a,,w a t a,w a t a,w a t a,w a t a,w a t a,w a t a,w a t a,w a t a,,w a t a,w a t a,w a t a,w a t a,w a t a,w a t a,w a t a,,w a t a,w a t a,w a t a,,w a t a,w a t a
990_11_year,,,,,,,,,,,,,,,,,,,m a r a,,,,,,,,,,,,,,,,,m a r a,,,,,,,,m a r a,,,,,,
992_95_rope,,,,,,,,,,,,,,,,,,,,,,,,k a r u,,,,,,,,,,,,,,,,,,,,,,,,k a r u,,
993_101_yellow,k a r w a,q a ɾ w a,q a r w a,,,,,,q a l w a,,ɢ a ʎ w a ʃ,q a r w a,,,,χ a r w a,q a r w a ʃ,,,q a ɾ w a,q a ɾ w a ʃ,,χ a r w a,,,,,,q a r w a ʃ,q a ɾ w a,,,ʁ a ɾ w a,,,,,,q a ɾ w a ʃ,q a ɾ w a,,,,,,q a ɾ w a ʃ,,,q a ɾ w a ʃ,q a r w a
996_105_youngfemale,!s̺/s i p a !s̺/s,ʃ i p a ʃ,s i p a s,s i p a s,s i p a s,s i p a s,,,ʃ i p a ʃ,ʃ i p a ʃ,h i p a ʃ,ʃ i p a ʃ,,s i p a s,s i p a s,s i p a s,,,,ʃ i p a ʃ,ʃ i p a ʃ,,ʃ i p a ʃ,,,,,ʃ i p a ʃ,s i p a s,ʃ i p a ʃ,s i p a s,,x i p a ʃ,ʃ i p a s,s i p a s,,s i p a s,s i p a s,ʃ i p a ʃ,ʃ i p a ʃ,s i p a s,s i p a s,,,s i p a s,χ e b a ʃ,,,ʃ i p a ʃ,ʃ i p a ʃ
998_105_youngfemale,,,,,,,,,,,,,,,,,,,t a w a q a,,,,,,,,,,,,,,,,,t a w a q u,,,,,,,,t a w a q u,,,,,,
999_105_youngfemale,,,,,,,,,,,,,,,,,,l a s a k,,,,,,,,,,,,,,,r a ʁ a k,,,,,,,,,,,,,,,,,
99_113_empty,tʃ u k a k,,tʃ u s a q,,,,tʃ u ʃ a g,tʃ u ʃ a,,,,,,tʃʼ u s a χ,tʃʼ u s a χ,tʃ u s a k,,,,,,tʃ u ʃ a x,,,,,,,,,tʃʼ u s a χ,tʃ u ʃ a,,tʃ u ʃ a,tʃʼ u s a χ,,tʃʼ u s a χ,tʃ u s a,,,tʃ u s a χ,tʃʼ u s a,tʃ u ʃ a x,,tʃʼ u s a χ,,tʃ u ʃ a x,,,
9_108_oldwoman,,,,,,,,,,,,,,,,,,,,,,,,,a p a + k a,,a p a + k a,,,,,,,,,,,,,,,,,,,,,,,
