Cognate_ID,Anonimo,Apuri,Apurimac,Arma,Atalla,Ayacucho,Azuay,Bobonaza,Cacra-Hongos,Chachapoyas,Chacpar,Chetilla,Chipaya,Curva,Cuzco,CuzquenoAntiguo,Huallaga,Huanca,Huancane,Huangascar,HuarazHuailas,Imbabura,Inkawasi,Iruhito,Jaqaru,Jauja,Kawki,Lamas,Laraos,Lincha-Tana,Maragua,Napo,Pacaraos,Pastaza,Pocona,Puki,Puno,Putumayo,Raimondi,SanPedro,Santiagueno,SantoTomas,Serena,Sullkatiti,Taquile,Tarma,Troje,Tsimu,Wari,Yanac
0_109_besick,,,,,,,u n g u + k u + n a,,,,,,,,,,,,,,,,,,,,,,,,,,,,,,,,,,,,,,,,,,,
0_133_biteto,,,,,,,k a n i + n a,,,,,,,,,,,,,,,,,,,,,,,,,,,,,,,,,,,,,,,,,,,
1000_105_youngfemale,,,,,,,,,,,,,,,,,,w a m l a,,,,,,,,w a m l a,,,,,,,,,,,,,,,,,,,,,,,,
1000_106_youngmale,,,,,,,,,,,,w a m r a,,,,,,,,,,,,,,,,,,,,,w a m ɾ a,,,,,,,,,,,,,,,,,
1002_106_youngmale,w ai n a,,w ai n a,,,,,,,w ai n a,,,,w ai n a,w ai n a,w ai n a,,,,,,,,,,,,w ai n a,,,w ai n a,,,w ai n a,w ai n a,,w ai n a,,,,w ai n a,w ai n a,,,w ai n a,,,,,
1003_105_youngfemale,,,,,,,,m a l t a,,,,,,,,,,,,,,,,,,,,,,,,m a l t a,,,,,,,,,,,m a l t a,,,,,,,
1003_106_youngmale,,,,,,,,m a l t a,,,,,,,,,,,,,,,,,,,,,,,,m a l t a,,,,,,,,,,,m a l t a,,,,,,,
1006_106_youngmale,,,,,,,,,,,,,,,,,,w a l a ʂ,,,,,,,,w a l a ʂ,,,,,,,,,,,,,,,,,,,,w a l a ʃ,,,,
1007_82_cloud,,,,,,,,,p u k u t ai,,p u k u t eː,p u k u t ai,,,,,p u k u t ai,p u k u t ai,,,p u k u t ai,,p u k t ai,,,p u k u t ai,,,p u k u t ai,p u k u t ai,,,p u k u t ai,,,,,,p u k u t ai,,,,,,,p u g u t ai,,,p u k u t ai,p u k u t eː
1010_100_green,,,,,,,,,,,,,,,,,,,,,,,,,,,,,,,,,,k i ʎ u,,,,,,,,,,,,,,,,
1010_101_yellow,k e ʎ ɔ,,q i ʎ u,χ i ʎ u,χ i ʎ u,χ e ʎ u,k i ʎ u,k i ʎ u,,k i dʑ u,,,,qʼ i ʎ u,qʼ i ʎ u,χ i ʎ u,,,,,,k i ʎ u,,,,,,k i dʑ u,,,qʼ i ʎ u,k i ʎ u,,k i ʎ u,qʼ i ʎ u,,qʼ i ʎ u,x i ʎ u,,,q ɪ ʒ u,q i ʎ o,k i ʎ u,,qʼ i ʎ u,,k i ʒ u,,,
1011_118_cold,tʃ i r i,tʃ i ɾ i,tʃ i r i,tʃ i ɾ i,tʃ i r i,tʃ i ɾ i,tʃ i ɾ i,tʃ i r i,,tʃ i r i,,tʃ i r i,,tʃ i r i,tʃ i r i,tʃ i r i,,,,tʃ i ɾ i,,tʃ i ɾ i,,,,,,tʃ i r i,,tʃ i ɾ i,tʃ i r i,tʃ i r i,,tʃ i r i,tʃ i r i,,tʃ i r i,tʃ i r i,,tʃ i ɾ i,tʃ i ɾ i,tʃ i r i,tʃ i r i,,tʃ i r i,,tʃ i r i,,,
1012_118_cold,,a l a l ai,,,,,,,a l a l ai,,a l a,,,,,,,a l a l a ʔ,,a l a l ai,a l aː l ai,,,,,a l a l a ʔ,,,a l a l a,a l a l ai,,,a l a l ai,,,,,,a l aː l ai,a l a l ai,,,,,,a l a l a,,,a l aː l ai,a l a l a
1013_118_cold,,,,,,,,,,,,,,,,,,,,,,,,h iː p uː,,,,,,,,,,,,,,,,,,,,,,,,k iː p uː,,
1016_102_big,,,,,,,,,,,,,,,,,,,h a tʃʼ a,,,,,,a x tsʼ a,,a s ʈʂʼ a,,,,,,,,,h a tʃʼ a,,,,,,,,h a tʃʼ a,,,,,,
1018_104_small,,,,,,,,,,,,,,,,,,,,,,,,,u t j i t j a,,i t j i t j a,,,,,,,,,,,,,,,,,,,,,,,
1019_124_cometo,h a m u + n i,h a m u,h a m u,h a m u,h a m u,h a m u,ʃ a m u + n a,ʃ a m u + n a,h a m u,ʃ a m u,ʃ a m u,ʃ a m u,,h a m u,h a m u,h a m u + n i,ʃ a m u,ʂ a m u,,h a m u,ʃ a m u,ʃ a m u + n a,ʃ a m u,,,,,ʃ a m u,h a m u,h a m u,h a m u,ʃ a m u + n a,ʃ a m u,ʃ a m u + n a,h a m u,,h a m u,s a m u,ʃ a m u,h a m u,a m u,χ a m u + n i,ʃ a m u,,h a m u,ʃ a m u,ʃ a m u,,ʃ a m u,ʃ a m u
101_113_empty,,,,,,,,,,,,,,,,,h aː k u + χ,h a l k u + ʂ a,,,,,,,,h a l k u + ʂ a,,,,,,,,,,,,,,,,,,,,,,,,
1020_103_highup,,,,,,,,,,,,,,,,,,,,,,,,,,,,,,,p a t a,,,,p a t a,,,,,,,,,,,,,,,
1021_104_small,,t a k s a,t a k s a,t a k s a,t a k s a,t a k s a,,,t a k s a,,,t a k ʃ a,,,,,,t a k ʂ a,,t a k s a,t a k ʃ a,,t a k ʃ a,,,t a k ʂ a,,t a k ʃ a,,t a k s a,,,,,,,,,t a k ʃ a,t a k s a,,,,,,t a k ʃ a,,,t a k ʃ a,
1023_104_small,,,tʃ i k i,,,,,,,,,,,,,,,,,,,,,,,,,,,,,,,,,,,,,,,,,,,,,,,
1024_105_youngfemale,,,,,,,w a m b ɾ a,,,,,,,,,,,,,,,,,,,,,,,,,,,,,,,,,,,,,,,,w a m b r a,,,
1024_106_youngmale,,,,,,,w a m b ɾ a,,,,,,,,,,,,,,,x a t u n + w a m b ɾ a,,,,,,,,,,,,,,,,,,,,,,,,,w a m b r a,,,
1026_105_youngfemale,,,,p a s ɲ a,,p a s ɲ a,,,,,,,,,,,,,,,,,,,,,,,,,,,,,,,,,,,,,,,,,,,,
1026_106_youngmale,,,p a s ɲ a,,,,,,,,,,,,,,,,,,,,,,,,,,,,,,,,,,,,,,,,,,,,,,,
1027_135_lickto,,,l au q a,,,,,ʎ au k a + n a,,,,,,,,,,,,,,,,,,,,,,,,ʎ au k a + n a,,l au k a + n a,,,,,,,,,ʎ au k a,,,,,,,
1027_63_sistermans,,,,,,,,,,,,,k u ʎ a k a,,,,,,,,,,,,,,,,,,,,,,,,,,,,,,,,,,,,,
1028_146_cryto,w a k a + n i,w a q a,w a q a,,w a χ a,w a χ a,w a k a + n a,w a k a + n a,w a q a,w a k a,w a ʁ a,w a ʁ a,,w a q a,w a q a,w a k a + n i,w a q a,w a ʔ ai,,w a q a,w a q ai,w a k a + n a,w a ʁ a,,,w a ʔ ai,,w a k a,w a q a,w a q a,w a q a,w a k a + n a,w a ʁ a,w a k a + n a,w a ʁ a,,w a q a,w a k a,w a q ai,w a q a,w a χ ai,w a k a + n i,w a k a,,w a q a,w a χ a,w a k a,,w a q ai,w a q a
1029_135_lickto,,,,,,,,,,,,,,,,,,,,,,,,,,,,,,,,,,,,,,,,,,,,,,,ʎ a w a + n a,,,
1029_61_brothermans,,,,,,,,,,,,,h i l a,,,,,,,,,,,,,,,,,,,,,,,,,,,,,,,,,,,,,
102_101_yellow,,,,,,,,,,,,,,,,,,t u n ʔ u ʂ,,,,,,,,t u n ʔ u ʂ,,,,,,,,,,,,,,,,,,,,,,,,
1030_107_oldman,,,,,,,,,au k i ʃ,,,,,,,,au k i s,au k i ʃ,,,au k i s,,,,,au k i ʃ,,,au k i ʃ,au k i ʃ,,,au k i ŋ,,,,,,au k i s,,,au k i,,,,au g i s,,,au k i s,au k i s
1031_92_leaf,r a p i,,r a p i,,r a p i,ɾ a p i,,,,,,,,r a pʰ i,r a pʼ i,r a p i,,,,,,,,,,,,,,,l a qʰ i,,,,l a qʰ i,,l a pʰ i,,,,,r a p i,,,l a pʰ i,,,,,
1033_109_besick,ɔ n k ɔ + n i,o ŋ q u,o n q o + tʃ i,u ŋ χ u,u n ɢ u,o ŋ χ o,,u n g u + tʃ i + n a,,,,,,u n q u,u n q u,u n χ u + n i + n,,,,o ŋ q u,,u n k u,,,,,,u n g u,,o ŋ q u,u n q u,u n g u + tʃ i + n a,,u n g u + n a,u n ʁ u,,u n q u,u n g u,,o ŋ q u,o ŋ q o s,h u n k u + n i,u n g u,,u n q u,,u n g u,,,
1034_66_day,p u n tʃ au,p u n ʈ au,p u tʃ au,p u n tʃ au,p u n tʃ au,p u n tʃ au,p u n ʒ a,p u n dʒ a,p u n ʈ au,p u n tʃ au,,p u n dʒ au,,pʼ u n tʃ ai,pʼ u n tʃ ai,p u n tʃ au,,p u n,,p u n ʈ au,,p u n tʃ a,,,,p u n,,p u n tʃ au,,p u n ʈ au,pʼ u n tʃ ai,p u n dʒ a,,p u n tʃ a,pʼ u n tʃ ai,,pʼ u n tʃ ai,p u n tʃ a,,p u n ʈ au,p u n tʃ au,p u n tʃ au,p u n dʒ a,,pʼ u n tʃ au,,p u n dʒ a,,,
103_122_new,,,,,,,,,,,,,,,,,,,m a tʃ a q a,,,,,,m a tʃ a q a,,m a tʃ a q a,,,,,,,,,m a tʃ a q a,,,,,,,,m a tʃ a q a,,,,,,
105_123_goto,,,,,,,,,,,,,,,,,,,s a r a,,,,,,,,,,,,,,,,,s a r a,,,,,,,,s a r a,,,,,,
106_123_goto,,ai w a,,,,,,,ai w a,,eː w a,,,,,,a w a,,,ai w a,ai w a,,,,,ai w a,,,,ai w a,,,,,,,,,ai w a,ai w a,,,,,,a w a,,,ai w a,eː w a
106_124_cometo,,,,,,,,,,,,,,,,,,,,,,,,,,ai w a + m u,,,,,,,,,,,,,,,,,,,,,,,,
107_106_youngmale,,m a q t a,m a q t a,m a χ t a,m a χ t a,m a χ t a,,,m a q t a,,,,,,,,,,,m a q t a,,,,,,,,,m a χ t a,m a q t a,,,,,,,,,,m a q t a,,,,,,,,,,
109_22_face,,,,,,,ɲ a w i,ɲ a w i,,,,,,,,,,,,,,ɲ a w i,,,,,,,,,,ɲ a w i,,,,,,ɲ a w i,,,,,ɲ a β i,,,,ɲ a w i,,,
109_23_forehead,,,,,,,,,,,,,,,,,,,,,,ɲ a w i,,,,,,,,,,,,,,,,,,,,,,,,,,,,
109_25_eye,ɲ a w i,ɲ a w i,ɲ a w i,ɲ a w i,ɲ a w i,ɲ a w i,ɲ a w i,ɲ a w i,ɲ a w i,ɲ a w i,n a w i,ɲ a w i,,ɲ a w i,ɲ a w i,ɲ a w i,ɲ a w i,ɲ a w i,,ɲ a w i,ɳ a w i,,n a w i,,,ɲ a w i,,ɲ a w i,ɲ a w i,ɲ a w i,ɲ a w i,ɲ a w i,ɲ a w i,ɲ a v i,ɲ a w i,,ɲ a w i,ɲ a w i,ɳ a w i,ɲ a w i,ɲ a w i,ɲ a w i,ɲ a β i,,ɲ a w i,n a w i,ɲ a w i,,ɲ a w i,ɲ a w i
111_25_eye,,,,,,,,,,,,,ʈʂʰ u k i,,,,,,,,,,,tʃ uː k,,,,,,,,,,,,,,,,,,,,,,,,tʃʼ aː χ,,
112_115_lightnotheavy,,,,,,,,,,,,,,,,,,,s u x a,,,,,,,,,,,,,,,,,,,,,,,,,,,,,,,
114_90_root,,,,,,,,,,,,ʈʂ u p a,,,,,,,,,,,ʈʂ u p a,,,,,,,,,,,,,,,,,,,,,,,,,,,ʈʂ a p a
115_90_root,,,,,,,,,,,,,,,,,,,,,,,,t u k,,,,,,,,,,,,,,,,,,,,,,,,t oː k a,,
116_90_root,,,,,,,,,,,,,,,,,,,,,,,,,a s u,,a s u,,,,,,,,,,,,,,,,,,,,,,,
118_22_face,,,,,,,,,,,q a χ ʎ a,q a ʁ ʎ a,,,,,q a χ ʎ a,,,,q a q ʎ a,,,,q a x ʎ a,,q a x ʎ a,,,,,,,,,,,,q a ʎ q a,,,,,,,,,,q a ʎ q a,q a q ʎ a
119_22_face,u j a,u j a,u j a,u j a,,u j a,,,,,,,,u j a,u j a,u j a,,,,u j a,,,,,,,,u j a,,,u j a,,,u j a,u j a,,u j a,,,u j a,u j a,o j a,,,u j a,,,,,
120_22_face,r i k tʃ ai,,,,,,,,,,,,,,,r i k tʃ ai,,,,,,,,,,,,,,,,,,,,,,,,,,r i k tʃ a,,,,,,,,
121_22_face,,,,,,,,,,,,,,,,,,,a χ a n u,,,,,,,,,,,,,,,,,,,,,,,,,a χ a n u,,,,,,
122_89_tree,,,,,,,,,,,,,,,,,,,,,,,,p aː r a,,,,,,,,,,,,,,,,,,,,,,,,p a r a,,
124_103_highup,,,,,,,h a w a + p i,h a w a,,,,,,,,,,,,,,,,,,,,,,,,h a w a,,a w a,,,,a w a + p i,,,,,,,,,,,,
129_116_faraway,k a r u,k a ɾ u,k a r u,k a ɾ u,k a r u,k a ɾ u,k a ɾ u,k a r u,k a l u,k a r u,k a r u,k a r u,,k a r u,k a r u,k a r u,k a r u,k a l u,,k a ɾ u,k a ɾ u,k a ɾ u,k a r u,,,k a l u,,k a r u,k a r u,k a ɾ u,k a r u,k a r u,k a ɾ u,k a r u,k a r u,,k a r u,k a r u,k a ɾ u,k a ɾ u,k a ɾ u,k a r o,k a r u,,k a r u,k a ɾ u,k a r u,,k a ɾ u,
12_139_dieto,w a ɲ u,w a ɲ u,w a ɲ u,w a ɲ u,w a ɲ u,w a ɲ u,w a ɲ u + n a,w a ɲ u + n a,w a ɲ u,w a ɲ u,w a n u,w a ɲ u,,w a ɲ u,w a ɲ u,w a ɲ u + n i,w a ɲ u,w a ɲ u,,w a ɲ u,w a ɲ u,w a ɲ u + n a,w a n u,,,w a ɲ u,,w a ɲ u,w a ɲ u,w a ɲ u,w a ɲ u,w a ɲ u + n a,w a ɲ u + k u,w a ɲ u + n a,w a ɲ u,,w a ɲ u,w a ɲ u,w a ɲ u,w a ɲ u,w a ɲ u,w a ɲ u + n i,w a ɲ u,,w a ɲ u,w a n u,w a ɲ u,,w a ɲ u,w a ɲ u
130_116_faraway,,,,,,,,,,,,,a z h k i n,,,,,,,,,,,a s k,,,,,,,,,,,,,,,,,,,,,,,,a s k i s,,
131_116_faraway,,,,,,,,,,,,,,,,,,,h a j a,,,,,,h a j a,,h a j a,,,,,,,,,h a j a,,,,,,,,h a j a,,,,,,
134_127_sitto,,,,,,,,,,,,,,,,,,,,,,,,,,,ʃ u k a,,,,,,,,,tʃ u k u,,,,,,,,,,,,,,
13_131_eatto,,,,,,,,,,,,,,,,,,,m a n qʼ a,,,,,,,,,,,,,,,,,m a qʼ a,,,,,,,,m a n qʼ a,,,,,,
140_87_fatgrease,,w i ɾ a,w i r a,w i ɾ a,w i r a,w i ɾ a,w i ɾ a,,w i l a,w i r a,w i r a,w i r a,,w i r a,w i r a,,w i r a,w i l a,,w i ɾ a,w i ɾ a,ɸ i ɾ a,w i r a,,,w i l a,,w i r a,w i r a,w i ɾ a,w i r a,,w i ɾ a,,w i r a,,w i r a,w i r a,w i ɾ a,w i ɾ a,w i ɾ a,w i r a,i r a,,w i r a,w i ɾ a,w i r a,,w i ɾ a,w i r a
144_87_fatgrease,,,,,,,,,,,,,,,,,,,l i kʼ i,,,,,,n i kʼ i,,ɲ i kʼ i,,,,,,,,,l i kʼ i,,,,,,,,l i kʼ i,,,,,,
147_53_egg,,,,,,,,,,,,,z i ɲ i,,,,,,,,,,,ʃ i ɲ i,,,,,,,,,,,,,,,,,,,,,,,,s iː ɲ a,,
14_139_dieto,,,,,,,,,,,,,,,,,,,h i w a,,,,,,h i w a,,h i w a,,,,,,,,,h i w a,,,,,,,,h i w a,,,,,,
150_13_lefthandside,,,,,,,,,,,,,,,,,,,tʃʼ i q a,,,,,,ʈʂʼ i q a,,tsʼ i qʼ a,,,,,,,,,tʃʼ i q a,,,,,,,,tʃʼ i q a,,,,,,
151_93_grass,,,,,,,j u j u,,,,,,,,,,,,,,,,,,,,,,,,,,,,,,,,,,j u j u,,,,,,,,,
152_42_fingernail,s i ʎ u,s i ʎ u,s i ʎ u,s i ʎ u,s i ʎ u,s i ʎ u,ʃ i ʎ u,ʃ i ʎ u,s i ʎ u,ʃ i dʑ u,ʃ i ʎ u,ʃ i dʒ u,,s i ʎ u,s i ʎ u,s i ʎ u,ʃ i ʎ u,ʃ i ʎ u,,s i ʎ u,ʃ i ʎ u,s i ʎ u,s i ʒ u,,,ʃ i ʎ u,,ʃ i dʑ u,ʃ i ʎ u,s i ʎ u,s i ʎ u,ʃ i ʎ u,ʃ i l u,ʃ i ʎ u,s i ʎ u,,s i ʎ u,s i ʎ u,ʃ i ʎ u,s i ʎ u,s i ʒ u,s i ʎ o,s i ʎ u,,s i ʎ u,ʃ i l u,s i ʒ u,,ʃ i ʎ u,ʃ i ʎ u
153_88_seed,,,m u χ u,,m u x u,,,,,,,,,m u x u,m u x u,m u h u,,m u h u,,,,,,,,m u h u,,,,,m u h u,,,,m u h u,,m u x u,,,,,m o h o,,,m u x u,,,,,
154_119_dry,,,,,,,,,,,,,,,,,,,,,,,,,tʃ aː k i,,tʃ a k i,,,,,,,,,,,,,,,,,,,,,,,
155_8_eight,,,,,,,,,,,,,,,,,,,,,,,,k o n k o,,,,,,,,,,,,,,,,,,,,,,,,k u n k u,,
157_79_sand,,,,,,,,,,,,,pʰ i l a,,,,,,,,,,,p iː l a,,,,,,,,,,,,,,,,,,,,,,,,tʼ iː r a,,
158_75_fire,n i n a,n i n a,n i n a,n i n a,n i n a,n i n a,n i n a,n i n a,n i n a,n i n a,n i n a,n i n a,,n i n a,n i n a,n i n a,n i n a,n i n a,,n i n a,ɲ i ɲ a,n i n a,n i n a,,,n i n a,,n i n a,n i n a,n i n a,n i n a,n i n a,n i n a,n i n a,n i n a,,n i n a,n i n a,ɲ i ɲ a,n i n a,n i n a,n i n a,n i n a,,n i n a,n i n a,n i n a,,ɲ i ɲ a,n i n a
15_110_tire,,,,,,,,,,,,,,,,,,u t i k a,,,,,,,,u t i k a,,,,,,,,,,,,,,,,,,,,,,,,
160_75_fire,,,,,,,,,,,,,,,,,,,,,,,,uː χ,,,,,,,,,,,,,,,,,,,,,,,,oː χ i,,
162_60_name,,,,,,,,,,,,,tʰ uː,,,,,,,,,,,t uː,,,,,,,,,,,,,,,,,,,,,,,,t uː χ,,
163_83_wind,,,,,,,,,,,,,,,,,,,,,,,,,w au j a,,w au j a,,,,,,,,,,,,,,,,,,,,,,,
164_70_star,,,,,,,,,,,,,,,,,,,,,,,,ts a q o l,,,,,,,,,,,,,,,,,,,,,,,,ts a k uː ɲ a,,
166_74_mountain,,,,,,,,,,,,,,,,,,,,,,,,,q aː q a,,q a q a,,,,,,,,,,,,,,,,,,,,,,,
167_5_five,p i tʃ χ a,p i tʃ q a,p i s k a,p i tʃ χ a,p i tʃ χ a,p i tʃ χ a,p i tʃ k a,p i tʃ k a,p i tʃ q a,p i tʃ k a,p i ts q a,p i tʃ ʁ a,,p i tʃ q a,p i s q a,p i tʃ χ a,p i tʃ q a,p i tʃ ʔ a,,p i tʃ q a,p i ts q a,p i ʃ k a,,,,p i tʃ ʔ a,,p i tʃ k a,p i tʃ q a,p i tʃ q a,p i ʃ q a,p i tʃ k a,p i s ʁ a,p i tʃ k a,pʰ i ʃ ʁ a,,p i s q a,p i tʃ k a,p i ts q a,p i tʃ q a,p i ʃ q a,p i χ k a,p i tʃ k a,,p i s q a,p i tʃ χ a,p i tʃ k a,,p i ts q a,p i ts q a
169_5_five,,,,,,,,,,,,,,,,,,,,,,,,t a s k n uː k uː,,,,,,,,,,,,,,,,,,,,,,,,t a s n uː,,
171_74_mountain,,,q i r k a,,,,,,,,,,,,,,h i r k a,,,,x i ɾ k a,,,,,,,,,,,,x i ɾ k a,,,,,,x i ɾ k a,,,,,,,x i ɾ k a,,,x i ɾ k a,
174_73_river,,,,,,,,,,,,,w i w i,,,,,,,,,,,w eː w eː,,,,,,,,,,,,,,,,,,,,,,,,w iː w i,,
175_94_flower,s i s a,s i s a,,s i s a,,,s i s a,s i s a,h i s a,,,,,,,s i s a,,s i s a,,s i s a,,s i s a,,,,s i s a,,s i s a,,s i s a,,s i s a,,s i s a,,,,,,s i s a,s i s a,s i s oi,s i s a,,,,s i s a,,,
176_94_flower,i n k i ʎ,,,,,,,,,,,,,,,i n χ i ʎ,,,,,,,,,,,,,,,,,,,,,,,,,,,,,,,,,,
177_94_flower,,w ai t a,w ai t a,w ai t a,w ai t a,w ai t a,,,w ai t a,w ai t a,,,,,,,,w ai t a,,w ai t a,w ai t a,,,,,w ai t a,,,w ai t a,w ai t a,,,w ai tʃ a,,,,,,w ai t a,w ai t a,,,,,,w ai t a,,,w ai t a,w eː t a
178_71_shadow,,,,,,,,,,,,,,,,,,,,,,,,,h u n kʼ a,,h u n kʼ i,,,,,,,,,,,,,,,,,,,,,,,
179_94_flower,,,,,,,,,,,t u k t u,t u k t u,,,,,t u k t u,,,,,,t u k t u,,,,,,,,,,,,,,,t u x t u,,,,,,,,,,,,
180_77_ash,,,,,,,,,,,,,,,,,,,qʰ i ʎ a,,,,,k i ʎ a,qʰ i ʎ p i,,qʰ i ʎ p i,,,,,,,,,qʰ i ʎ a,,,,,,,,qʰ i ʎ a,,,,k iː ʎ a,,
185_94_flower,,,t i k a,,,,,,,,,,,tʼ i k a,tʼ i k a,,,,,,,,,,,,,,,,tʼ i k a,,,,tʼ i k a,tʼ i k a,tʼ i k a,,,,,,,,tʼ i k a,,,,,
187_53_egg,,,,,,,ɾ u r u,,,,,r u r u,,,,,,,,,ɾ u ɾ u,,,,,l u l u,,,,,,,ɾ u ɾ u,,,,,,,,,r u r u,,,,!ʐ/r u r u,,,,
188_129_flyto,p a w a + n,p a w a,p a w a,p a w a,p a w a,p a w a,,,p a w a,p a w a,,,,,pʰ a w a,p a w a + n i,,,,p a w a,,,,,,,,p a w a,p a w a,p a w a,pʰ a w a,,,p a w a + n a,pʰ a w a,,,,,p a w a,p aː,p a w a + n i,,,pʰ a w a,,,,,
190_129_flyto,,,,,,,,,,,,,,h a l a + tʃ a,,,,,h a l a,,,,,,,,,,,,,,,,,χ a l a,h a l a + n t a,,,,,,,,,,,,,
191_129_flyto,,,,,,,,,,,,,,,,,,,,,,,,,h a x + p t a,,h a x + p t a,,,,,,,,,,,,,,,,,,,,,,,
193_94_flower,,,,,,,,,,,,,p a qʰ a ʎ a,,,,,,p a n q a r a,,,,,p a n k a r a,,,,,,,,,,,,,,,,,,,,p a n q a r a,,,,,,
194_102_big,h a t u n,h a t u n,h a t u n,h a t u ŋ,h a t u n,h a t u ŋ,h a t u n,h a t u n,h a t u n,a t u n,h a t u n,a t u n,,a tʰ u n,h a t u n,h a t u n,h a t u n,h a t u n,,h a t u n,h a t u n,x a t u n,a t u n,,,h a t u n,,a t u n,h a t u n,h a t u n,h a t u n,h a t u n,x a t u ŋ,a t u n,h a t u n,,h a t u n,a t u n,h a t u n,h a t u n,a t u n,a t u n,a t u n,,a tʰ u n,χ a t u ŋ,h a t u n,,h a t u n,a t u n
194_103_highup,,,,,,,,,,,,,,,,,,,,,,x a t u n,,,,,,,,,,,,,,,,,,,,,,,,,,,,
196_105_youngfemale,,,,,,,,,,,,,,,,,w a n k a ʃ,,,,,,,,,,,,,,,,,,,,,,,,,,,,,,,,,
196_106_youngmale,,,,,,,,,,,,,,,,,w a n k a ʃ,,,,,,,,,,,,,,,,,,,,,,,,,,,,,,,,,
198_93_grass,,,,,,,,,,,,,,,,,,,,,,,,,,,,,,,,,,,,,,u x s a,,,,,,,,,,,,
198_94_flower,,,,,,,,,,,,,,,,,,,,,,,,,,,,,,,,,,,,,,,,,,,,,,,,pʼ oː χ s a,,
199_36_foot,,,,,,,,,,,,,,,,,,,k a j u,,,,,,k a j u,,k a j u,,,,,,,,,k a j u,,,,,,,,k a j u,,,,,,
199_37_leg,,,,,,,,,,,,,,,,,,,k a j u,,,,,,k a j u,,k a j u,,,,,,,,,,,,,,,,,,,,,,,
19_47_dog,a ʎ k ɔ,a ʎ q o,a ʎ q o,a ʎ χ u,a ʎ χ u,a ʎ χ o,a ʎ k u,a ʎ k u,a ʎ q o,a dʑ k u,a ʎ ʁ u,a tʃ ʁ u,,a l q u,a l q u,a ʎ k u,a ʎ q u,a ʎ ʔ u,,a ʎ q o,a ʎ q u,a ʎ k u,a ʒ ʁ u,,,a ʎ ʔ u,,a dʑ k u,a l q u,a ʎ q o,a l q u,a ʎ k u,a l χ o,a ʎ k u,a l ʁ u,,a l q u,a l k u,a ʎ q u,a ʎ q o,a ʒ q o,a ʎ q u,a ʎ k u,,a l q u,a l χ o,a ʒ k u,,a ʎ q u,a ʎ q u
202_93_grass,,q e w a,,,,,k i w a,k i w a,q !e/i w a,k i w a,,q i w a,,,,,q e w a,h i w a,,q e w a,q e w a,x i w a,χ i w a,,,q i w a,,k i w a,q i w a,q e w a,,k i w a,χ e w a,k i w a,,,,,q e w a,q e w a,,,k i w a,,,χ e w a,kʰ i w a,,q e w a,
204_133_biteto,,,k a tʃ u,k a tʃ u,k a tʃ a,,,,,,,,,,,,,,,,,,,,,,,,k a ʈʂ u,,,,,,,,,,,,,,,,,,,,,
205_91_branch,,,p a ʎ q a,,,,,p a ʎ k a,,,,,,,,,,,,,,,,,,,,,,,,p a ʎ k a,,,,,,,,,,p a ʎ k a,p a ʎ k a,,,,,,,
206_91_branch,t a n k a,,,,,,t a n k a,,,,,,,,,,,,,,,,,,,,,,,,,,,,,,,,,,,,,,,,,,,
207_23_forehead,m a t i,,m a t i,,,,m a t i,,,,,,,m a tʼ i,m a tʼ i,m ai t i,,,,,,,,,,,,,,,,,,,,,m a tʼ i,,,,,m a r t i,,,m a tʼ i,,,,,
209_23_forehead,,,,u ɾ k u,u r k u,u ɾ k u,,,,u r k u,u r k u,u r k u,,,,,u r k u,u l k u,,,u ɾ k u,,u r k u,,,u l k u,,u r k u,,,,,,,,,,,u ɾ k u,,,,,,,,,,u ɾ k u,u r k u
210_23_forehead,,p a q ʈ a,,,,,,,p a q ʈ a,,,,,,,,,p a ʔ ʈʂ a,,p a q ʈ a,,,,,,p a ʔ ʈʂ a,,,p a q ʈʂ a,p a q ʈ a,,,,,,,,,,p a q ʈ a,,,,,,,,,,
211_23_forehead,,,,,,,,,,,,,a j a,,,,,,,,,,,aː j a,,,,,,,,,,,,,,,,,,,,,,,,,,
215_52_louse,,,,,,,,,,,,,,,,,,,,,,,l i s u,,,,,,,,,,,,,,,,,,,,,,,,,,,
216_134_suckto,tʃ ɔ m k a + n i,,tʃ o n q a,,,,s u n g a + n a,,,,,,,tʃʼ u n q a,tʃʼ u n q a,tʃ u m χ a + n i,,,,,,,,,,,,,,,tʃʼ u n q a,ts u n g a + n a,,ts u n g a + n a,tʃʼ u n ʁ a,,tʃʼ u n q a,,,,tʃ o ŋ q a,tʃʼ u n q a,ts u n g a,,tʃʼ u n q a,,,,,
217_89_tree,,q e ɾ u,,,,,,,q !e/i l u,,,q i r u,,,,,q i r u,,,q e ɾ u,q e ɾ u,,χ i r u,,,,,,,q e ɾ u,,,χ e ɾ u,,,,,,q e ɾ u,q e ɾ u,,,,,,χ e ɾ u,,,q e ɾ u,
218_4_four,t a w a,t a w a,t a w a,t a w a,t a w a,t a w a,,,t a w a,,,,,t a w a,t a w a,t a w a,,t a w a,,t a w a,,,,,,t a w a,,,t a w a,t a w a,t a w a,,,,t a w a,,t a w a,,,t a w a,t aː,t a w a,,,t a w a,,,,,
219_4_four,,,,,,,tʃ u s k u,tʃ u s k u,,tʃ u s k u,tʃ u s k u,ʈʂ u s k u,,,,,tʃ u s k u,ʈʂ u s k u,,,tʃ u s k u,tʃ u s k u,,,,ʈʂ u s k u,,tʃ u s k u,,,,tʃ u s k u,ʈʂ u s k u,tʃ u s k u,,,,tʃ u s k u,tʃ u s k u,,,,tʃ u s k u,,,ʈʂ u s g u,tʃ u s k u,,tʃ u s k u,ʈʂ u s k u
220_4_four,,,,,,,,,,,,,p a q p i k,,,,,,,,,,,p a χ p iː k,,,,,,,,,,,,,,,,,,,,,,,,,,
221_4_four,,,,,,,,,,,,,,,,,,,p u s i,,,,,,p u ʃ i,,p u ʃ i,,,,,,,,,p u s i,,,,,,,,p u s i,,,,p u χ,,
222_89_tree,,,,,,,,,,,,,,,,,,,q u q a,,,,,,,,,,,,,,,,,q u q a,,,,,,,,q u q a,,,,,,
224_82_cloud,,,,,,,,,,,,,,,,,,,,,,,,,u r p i,,u r p i,,,,,,,,,,,,,,,,,,,,,,,
227_48_fox,a t ɔ k,a t o q,a t o q,a t u χ,a t u χ,a t o χ,,,a t o q,a t u k,a t u q,a t o q,,a t u χ,a t u χ,a t u k,a t u χ,a t u ʔ,,a t o q,a t o q,,,,,a t u ʔ,,a t u k,a t u χ,a t o q,a t u χ,,a tʃ o χ,,a t u χ,,a t u χ,,a t o q,a t o q,a t o χ,a t o k,,,a t u χ,a t o χ,a t u x,,a t o q,a t u q
228_48_fox,,,,,,,,,,,,,,,,,,,q a m a q i,,,,,,,,,,,,,,,,,q a m a q i,,,,,,,,q a m a q i,,,,,,
229_48_fox,,,,,,,a ɲ a s,,,,,,,,,,,,,,,a ɲ a s,,,,,,,,,,,,,,,,,,,,,,,,,,,,
22_47_dog,,,,,,,,,,,,,,,,,,,,,,,,,,,,,,,,,,,,a n u,,,,,,,,a n u,,,,,,
231_79_sand,,,,,,,,,,,,,,,,,,,,,,,,,,,,,,,,,,,,tʃʼ a ʎ a,,,,,,,,tʃʼ a ʎ a,,,,,,
235_112_full,h a n t a,h u n t a,h u n t a,h u n t a,h u n t a,h u n t a,h u n d a,h u n d a,h u n t a,x u n d a,h u n t a,u n d a,,h u n tʼ a,h u n tʼ a,h u n t a + s k a,h u n t a,h u n t a,,h u n t a,h u n t ai,x u n d a,u n d a,,,h u n t a,,x u n d a,h u n t a,h u n t a,h u n tʼ a,h u n d a,x u n t a,u n d a,h u n tʼ a,,h u n tʼ a,x u n d a,h u n t ai,h u n t a,u n t a,,u n d a + k t a,,h u n tʼ a,χ o n t a,h u n d a,,h u n t ai,u n t a
238_112_full,,,,,,,,,,,,,,,,,,,pʰ u qʰ a,,,,,,pʰ u q a,,pʰ u qʰ a,,,,,,,,,pʰ u qʰ a,,,,,,,,pʰ u qʰ a,,,,,,
240_121_happybe,,,,,,,,,,,,,,,,,,,k u s i,,,,,,k u ʃ u,,k u ʃ u,,,,,,,,,k u s i,,,,,,,,k u s i,,,,,,
241_143_thinkoveraboutto,,,,,,,,,,,,,,,,,,j ai n i + tʃ a + k u,,,,,,,,,,,,,,,,,,,,,,,,,,,,,,,,
243_145_laughto,,,,,,,,,,,,,,,,,,,,,,,,,,,,,,,,,,,,,,,,,,a k u + s i + n i,,,,ai k u,,,,
245_147_giveto,k ɔ + n i,q o,q o,χ u,χ u,χ o,k u + n a,k u + n a,q o,k u,ɢ u,q u,,q u,q u,χ u + n i,q u,ʔ u,,q o,,k u + n a,q u,,,ʔ u,,k u,q u,q o,q u,k u + n a,χ o,k u + n a,ɢ u,,q u,k ua,,q o,q o,k o,k u,,q u,χ o,k u,,,q u
247_147_giveto,,,,,,,,,,,,,,,,,,,tʃ u r a,,,,,,,,,,,,,,,,,tʃ u r a,,,,,,,,tʃ u r a,,,,,,
248_126_standto,,,,,,,,,,,,,,,,,,,,,,,,,,,s a j a,,,,,,,,,s a j a,,,,,,,,s a j a,,,,,,
252_147_giveto,,,,,,,,,,,,,,,,,,,,,,,,,j a k a,,j a k a,,,,,,,,,,,,,,,,,,,,,,,
254_123_goto,r i + n i,ɾ i,r i,ɾ i,r i,ɾ i,ɾ i + n a,r i + n a,l i,r i,,r i,,r i,r i,r i,,l i,,ɾ i,,ɾ i + n a,r i,,,,,r i,r i,l i,r i,r i + n a,ɾ i,ɾ i + n a,r i,,r i,r i,,ɾ i,ɾ iː,r i + n i,r i,,r i,,r i,,,
256_123_goto,,,,,,,,,,,,,,,,,,,,,,,,,m a x a,,m a x a,,,,,,,,,,,,,,,,,,,,,,,
257_148_sewto,,,,,,,,,,,,,,,,,,,tʃʼ u k u,,,,,,tsʼ u k u,,ʈʂʼ u k u,,,,,,,,,tʃʼ u k u,,,,,,tʃ u k + t a + n i,,tʃʼ u k u,,,,,,
258_74_mountain,,,,,,,,,,,,,,,,,,,q u ʎ u,,,,,,,,,,,,,,,,,q u ʎ u,,,,,,,,q u ʎ u,,,,,,
259_149_hitto,,m a q a,,,,,,,m a q a,m a k a,,m a q a,,,,,m a q a,m a ʔ a,,m a q a,m a q a,,,,,m a ʔ a,,m a k a,m a q a,m a q a,,,m a ʁ a,,,,,m a k a,m a q a,m a q a,m a x a,,,,,m a χ a,,,m a q a,
260_150_pushto,,,,,,,,,,,,,,,,,,,n u kʰ u,,,,,,,,,,,,,,,,,,,,,,,,,n u kʰ u,,,,,,
262_150_pushto,,,,,,,,,,,,,,,,,,,,,,,,,tʃ i m a,,tʃ i m a,,,,,,,,,,,,,,,,,,,,,,,
263_80_gold,k ɔ r i,,q o r i,χ u ɾ i,χ u r i,χ o ɾ i,k u ɾ i,k u r i,,k u r i,q u r i,q u r i,,q u r i,q u r i,k u r i,q u r i,h u l i,,,q o ɾ i,k u ɾ i,,,,q u r i,,k u r i,,,q u r i,k u r i,,k u r i,ɢ u r i,,q u r i,k u r i,q o ɾ i,,q o ɾ i,k o r i,k u r i,,q u r i,,k u r i,,q o ɾ i,q u r i
264_80_gold,,,,,,,,,,,,,,,,,,,,,,,,g iː s h a,,,,,,,,,,,,,,,,,,,,,,,,g iː s n a,,
265_16_not,,,,,,,,,,,,,,,,,,,h a n i,,,,,,,,,,,,,,,,,h a n i,,,,,,,,h a n i,,,,,,
268_18_who,,,,,,,,,,,,,,,,,,,kʰ i t i,,,,,,,,,,,,,,,,,kʰ i t i,,,,,,,,kʰ i t i,,,,,,
269_19_this,,,,,,,,,,,,,,,,,,,ai k a,,,,,,a k a,,a k a,,,,,,,,,a k a,,,,,,,,a k a,,,,,,
26_111_many,,,,,,,,,,,,,,,,,,,,,,,,,a ʈʂ h i,,a ʈʂ i,,,,,,,,,,,,,,,,,,,,,,,
270_2_two,,,,,,,,,,,,,p i z k,,,,,,,,,,,p iː ʃ k,,,,,,,,,,,,,,,,,,,,,,,,,,
271_93_grass,,,q o r a,χ u ɾ a,χ u r a,χ o ɾ a,,,,,q u r a,,,q u r a,q u r a,,,q u l a,,,,,,,,q u l a,,,,,q u r a,,,,,,q u r a,,,,,,,,q u r a,,,,,q u r a
275_93_grass,,,,,,,,,,w ai dʑ a,,,,,,,,,,,,,,,,,,w ai dʑ a,,,,,,,,,,,,,,,,,,,,,,
276_22_face,,,,,,,,,,,,,j u k,,,,,,,,,,,j uː kʰ,,,,,,,,,,,,,,,,,,,,,,,,j uː k i,,
279_50_bird,p i s k ɔ,p i ʃ q o,p i s q o,p i s χ u,,p i s χ o,p i ʃ k u,p i ʃ k u,p i ʃ q o,p i ʃ k u,,p i ʃ ʁ u,,pʼ i s q u,,p i s k u,p i ʃ q u,p i ʃ ʔ u,,p i ʃ q o,p i ʃ q u,p i ʃ k u,,,,p i ʃ ʔ u,,p i ʃ k u,p i ʃ q u,p i ʃ q o,pʼ i s q u,p i ʃ k u,p i ʃ χ o,p i ʃ k u,pʼ i s ʁ u,,pʼ i s q u,p i s k u,p i ʃ q u,p i ʃ q o,p i ʃ q o,p i s k o,p i ʃ k u,,pʼ i s q u,p i ʃ χ o,p i ʃ k u,,p i ʃ q u,p i ʃ q u
280_50_bird,p i tʃ i n,,p i tʃ i n k o,,,,,,,,,,,,p i tʃ i n k u,p i tʃ i u,,,,,,,,,,,,,,,,,,,,,,,,,,,,,,,,,,
282_100_green,,,q o m i r,,,χ u m i !r̝/r,,,,,,,,qʼ u m i r,qʼ u m i r,,,,,,,,,,,,,,,,qʼ u m i r,,,,qʼ u m i r,,qʼ u m i r,,,,q o m e ɾ,,,,qʼ u m i r,,,,,
283_50_bird,,,,,,,,,,,,,,,,,,,h a m a tʃʼ i,,,,,,,,,,,,,,,,,h a m a tʃʼ i,,,,,,,,h a m a tʃʼ i,,,,,,
287_56_wing,,,,,,,,,,,,,,,,,k a p a,,,,,,,,,,,,,,,,,,,,,,,,,,,,,,,,,
287_91_branch,,,,,,,,,,,,,,,,k a r p a,,,,,,,,,,,,,,,,,,,,,,,,,,,,,,,,,,
288_50_bird,,,,,,,,,,,,,,,,,,,,,,,,,tʃʼ i p i,,tʃʼ i p i,,,,,,,,,,,,,,,,,,,,,,,
289_24_hair,tʃ u k tʃ a,tʃ u k tʃ a,tʃ u k tʃ a,tʃ u k tʃ a,tʃ u k tʃ a,tʃ u k tʃ a,,,,tʃ u x tʃ a,,,,tʃ u x tʃ a,tʃ u x tʃ a,tʃ u k tʃ a,,,,tʃ u k tʃ a,,,,,,,,tʃ u k tʃ a,,,tʃ u x tʃ a,,,tʃ u k tʃ a,tʃ u x tʃ a,,tʃ u x tʃ a,,,,tʃ u x tʃ a,tʃ u k tʃ a,,,tʃ u x tʃ a,,,,,
290_24_hair,a k tʃ a,a q tʃ a,,,,,a g tʃ a,a k tʃ a,a q tʃ a,,a q ts a,a χ tʃ a,,,,,a χ tʃ a,a ʔ tʃ a,,a q tʃ a,a q ts a,a k tʃ a,a χ tʃ a,,,a ʔ tʃ a,,,a χ tʃ a,a q tʃ a,,a k tʃ a,a χ s a,,,,,a x tʃ a,a q ts a,a q tʃ a,,j a k tʃ a,a k tʃ a,,,a χ tʃ a,a x tʃ a,,a q ts a,a q ts a
293_24_hair,,,,,,,,,,,,,,,,,,,ɲ i kʼ u t a,,,,,,n u kʼ u t a,,n u kʼ u ʈʂ a,,,,,,,,,ɲ a kʼ u t a,,,,,,,,ɲ i kʼ u t a,,,,,,
294_25_eye,,,,,,,,,,,,,,,,,,,n ai r a,,,,,,n ai r a,,n ai r a,,,,,,,,,n ai r a,,,,,,,,n ai r a,,,,,,
295_26_nose,,,,,,,,,,,,,,,,,,,n a s a,,,,,,n a s a,,n a s a,,,,,,,,,n a s a,,,,,,,,n a s a,,,,,,
298_32_hand,m a k i,m a k i,m a k i,m a k i,m a k i,m a k i,m a k i,m a k i,m a k i,m a k i,m a k i,m a k i,,m a k i,m a k i,m a χ i,m a k i,m a k i,,m a k i,m a k i,m a k i,m a k i,,,m a k i,,m a k i,m a k i,m a k i,m a k i,m a k i,m a k i,m a k i,m a k i,,m a k i,m a x i,m a k i,m a k i,m a x i,m a k i,m a k i,,m a k i,m a g i,m a k i,,m a k i,m a k i
299_33_elbow,,,,,,,,,,,,,,,,,,,,,,,,,,,,,,,m a k i + m u q u,,,,m a k i + m u ʁ u,,,,,,,,m a k i + m u k u,,,,,,,
2_77_ash,u tʃ p a,u ʈ p a,u s p a,u tʃ p a,u tʃ p a,u tʃ p a,u tʃ u p a,u ʃ p a,u ʈ p a,u ʈʂ p a,u tʃ p a,u ʂ p a,,u tʃ pʰ a,u s pʰ a,u tʃ p a,u tʃ p a,u ʈʂ p a,,u ʈ p a,u tʃ p a,u tʃ u f a,u ʈʂ p a,,,u ʈʂ p a,,u tʃ p a,u ʈʂ p a,u ʈ p a,u ʃ pʰ a,u ʃ p a,u ʈʂ p a,u tʃ p a,u ʃ pʰ a,,u s pʰ a,u tʃ p a,u tʃ p a,u ʈ p a,u ʃ p a,u χ p a,u ʃ p a,,u ʃ pʰ a,u tʃ p a,u ʃ p a,,u tʃ p a,u tʃ p a
300_32_hand,,,,,,,,,,,,,qʰ a r a,,,,,,,,,,,kʼ aː r a,,,,,,,,,,,,,,,,,,,,,,,,kʼ aː r a,,
301_32_hand,,,,,,,,,,,,,,,,,,,a m p a r a,,,,,,a m p a r a,,a m p a r a,,,,,,,,,a m p a r a,,,,,,,,a m p a r a,,,,,,
302_132_drinkto,,,,,,,,u p i + n a,,,,,,,,,,,,,,,,,,,,,,,,u p i + n a,,,,,,,,,,,u p i,,,,,,,
304_134_suckto,,,,,,,,,,,,,,,,,,,,,,,,,ʃ u qʼ u,,ʃ u qʼ u,,,,,,,,,,,,,,,,,,,,,,,
305_136_spitto,,,,,,,,,,,,,,,,,,,tʰ u s a,,,,,,tʰ u s u,,tʃ u s a,,,,,,,,,tʰ u s a,,,,,,,,tʰ u s a,,,,,,
